[Tuesday/November 08/11/2022 23:22:56] "Double your FPS for FREE!*** - Nvidia DLSS 3.0" | https://www.youtube.com/watch?v=PUTsE1q1bYI | length=1060.941 | time=774.941
[Wednesday/November 09/11/2022 11:00:09] "Double your FPS for FREE!*** - Nvidia DLSS 3.0" | https://www.youtube.com/watch?v=PUTsE1q1bYI | length=1060.941 | time=1060.929
[Wednesday/November 09/11/2022 11:00:16] "Double your FPS for FREE!*** - Nvidia DLSS 3.0" | https://www.youtube.com/watch?v=PUTsE1q1bYI | length=1060.941 | time=0
[Thursday/November 10/11/2022 08:40:53] C:\Users\SakuraFrost225\Downloads\Compressed\Frontend_masters_VIM_Fundamentals_2021-4.part3_Downloadly.ir\Frontend masters - VIM Fundamentals 2021-4\6. Wrapping Up\1. Wrapping Up.mp4 | length=397.67466666667 | time=396.99517777778
[Thursday/November 10/11/2022 17:54:55] "How to build a PC, the last guide you'll ever need!" | https://www.youtube.com/watch?v=BL4DCEp7blY | length=6124.541 | time=672.91449999966
[Thursday/November 10/11/2022 20:21:59] "How to build a PC, the last guide you'll ever need!" | https://www.youtube.com/watch?v=BL4DCEp7blY | length=6124.541 | time=553.886
[Thursday/November 10/11/2022 20:44:38] "How to build a PC, the last guide you'll ever need!" | https://www.youtube.com/watch?v=BL4DCEp7blY | length=6124.541 | time=1623.522
[Friday/November 11/11/2022 00:32:48] C:\Users\SakuraFrost225\Downloads\Compressed\Frontend_masters_VIM_Fundamentals_2021-4.part1_Downloadly.ir\Frontend masters - VIM Fundamentals 2021-4\1. Introduction\1. Introduction.mp4 | length=545.856 | time=543.59468968463
[Friday/November 11/11/2022 01:04:49] C:\Users\SakuraFrost225\Downloads\Compressed\Frontend_masters_VIM_Fundamentals_2021-4.part1_Downloadly.ir\Frontend masters - VIM Fundamentals 2021-4\1. Introduction\2. Why vim & Prerequisites.mp4 | length=699.648 | time=699.6478073711
[Friday/November 11/11/2022 01:28:15] C:\Users\SakuraFrost225\Downloads\Compressed\Frontend_masters_VIM_Fundamentals_2021-4.part1_Downloadly.ir\Frontend masters - VIM Fundamentals 2021-4\1. Introduction\3. Terminology.mp4 | length=255.296 | time=255.29579276024
[Friday/November 11/11/2022 01:36:14] C:\Users\SakuraFrost225\Downloads\Compressed\Frontend_masters_VIM_Fundamentals_2021-4.part1_Downloadly.ir\Frontend masters - VIM Fundamentals 2021-4\1. Introduction\4. Course Overview.mp4 | length=558.57066666667 | time=558.57046110585
[Friday/November 11/11/2022 10:11:37] C:\Users\SakuraFrost225\Downloads\Compressed\Frontend_masters_VIM_Fundamentals_2021-4.part1_Downloadly.ir\Frontend masters - VIM Fundamentals 2021-4\3. Customization\5. Files & Navigation - Remaps.mp4 | length=758.69866666667 | time=0
[Saturday/November 12/11/2022 00:06:41] D:\Downloads\Downloads\Music\Porter Robinson  Second Sky Festival (Oakland) - 19-09-2021.mp3 | length=6064.248 | time=43.778451000001
[Friday/November 25/11/2022 14:12:33] E:\Windows.old.000\Users\SakuraFrost225\Downloads\Video\outstanding.mp4 | length=4 | time=3.9666666666667
[Friday/November 25/11/2022 14:12:51] E:\Windows.old.000\Users\SakuraFrost225\Downloads\Video\SnapSave_App_phuc-thinh.mp4 | length=17.388888888889 | time=17.253606575964
[Friday/November 25/11/2022 14:13:07] E:\Windows.old.000\Users\SakuraFrost225\Downloads\Video\Snaptik_7029711538344791323_2-0-0-4.mp4 | length=15.647392290249 | time=15.48889824263
[Friday/November 25/11/2022 14:13:38] E:\Windows.old.000\Users\SakuraFrost225\Downloads\Video\super_que_toi.mp4 | length=52.032698412698 | time=29.866666666667
[Friday/November 25/11/2022 14:13:47] E:\Windows.old.000\Users\SakuraFrost225\Downloads\Video\VID_20220224_172351.mp4 | length=186.571 | time=152.824
[Friday/November 25/11/2022 14:13:54] E:\Windows.old.000\Users\SakuraFrost225\Downloads\Video\video_2022-01-01_03-38-21.mp4 | length=6.2666666666667 | time=6.2333333333333
[Friday/November 25/11/2022 14:14:07] E:\Windows.old.000\Users\SakuraFrost225\Downloads\Video\VIETNAM ANTI VIDEOS ON THE INTERNET - Facebook.mp4 | length=13.094648526077 | time=12.9811454521
[Friday/November 25/11/2022 14:19:58] E:\Windows.old.000\Users\SakuraFrost225\Downloads\Video\VIETNAM ANTI VIDEOS ON THE INTERNET - Facebook_2.mp4 | length=89.538684807256 | time=89.467673345875
[Friday/November 25/11/2022 14:20:11] E:\Windows.old.000\Users\SakuraFrost225\Downloads\Video\VIETNAM ANTI VIDEOS ON THE INTERNET - Facebook_3.mp4 | length=12.49514739229 | time=12.423874256781
[Friday/November 25/11/2022 14:20:38] E:\Windows.old.000\Users\SakuraFrost225\Downloads\Video\what_would_happen_if_a_russian_touhou_player_was_a_military_man__HD.mp4 | length=25.68126984127 | time=25.681049845429
[Friday/November 25/11/2022 14:22:57] E:\Windows.old.000\Users\SakuraFrost225\Downloads\Video\wut.mp4 | length=67.9 | time=67.866666666667
[Saturday/November 26/11/2022 23:13:25] F:\danser-0.6.8-win\videos\plasma gun.mp4 | length=47.767333333333 | time=2.65
[Saturday/November 26/11/2022 23:15:15] F:\danser-0.6.8-win\videos\danser_2022-11-26_23-08-13.mp4 | length=224.30233333333 | time=224.29866666666
[Saturday/November 26/11/2022 23:15:16] F:\danser-0.6.8-win\videos\plasma gun.mp4 | length=47.767333333333 | time=0
[Saturday/November 26/11/2022 23:21:01] F:\danser-0.6.8-win\videos\plasma gun.mp4 | length=47.767333333333 | time=8.6
[Saturday/November 26/11/2022 23:32:27] F:\danser-0.6.8-win\videos\danser_2021-11-02_23-56-41.mp4 | length=88.289333333333 | time=35.1
[Saturday/November 26/11/2022 23:35:22] F:\danser-0.6.8-win\videos\danser_2022-08-05_17-23-11.mp4 | length=241.45033333333 | time=241.42933333333
[Saturday/November 26/11/2022 23:35:40] F:\danser-0.6.8-win\videos\danser_2022-08-05_17-54-48.mp4 | length=241.45033333333 | time=3.0333333333333
[Wednesday/November 30/11/2022 23:02:50] F:\danser-0.6.8-win\videos\danser_2021-12-10_23-00-45.mp4 | length=88.289333333333 | time=88.277333333329
[Wednesday/November 30/11/2022 23:03:52] F:\danser-0.6.8-win\videos\danser_2021-12-12_23-15-56.mp4 | length=204.43933333333 | time=58.566666666667
[Friday/December 02/12/2022 18:08:36] F:\Video\2022-12-02 18-07-55.mp4 | length=12.05 | time=12.033333333333
[Friday/December 02/12/2022 18:08:38] F:\Video\39804 xi FREEDOM DiVE played by ErogeMaster225.mp4 | length=118.07920634921 | time=1.45
[Tuesday/December 06/12/2022 18:09:33] C:\Users\SakuraFrost225\Downloads\Facebook.mp4 | length=4.1800416666667 | time=3.4333333333333
[Friday/December 09/12/2022 00:40:38] C:\Users\SakuraFrost225\Downloads\318834139_633354208531627_2091889064038488755_n.mp4 | length=175.2849430114 | time=17.236552689462
[Saturday/December 10/12/2022 20:51:57] F:\osu!\Skinsbig\- ErogeMaster225 -\applause.mp3 | length=64.835918 | time=64.800856292518
[Wednesday/December 14/12/2022 15:49:38] F:\danser-0.6.8-win\videos\danser_2021-09-12_17-00-48.mp4 | length=328.63333333333 | time=218.53333333333
[Thursday/December 15/12/2022 18:45:11] F:\Video\input2.mp4 | length=126.56666666667 | time=126.55833333333
[Thursday/December 15/12/2022 18:48:00] F:\Video\ouput.mp4 | length=187.1 | time=183.91666666667
[Friday/December 16/12/2022 21:10:54] "BLASTPremier (live) 2022-12-16 21:08" | https://www.twitch.tv/blastpremier | length=0 | time=82777.880688889
[Monday/December 19/12/2022 21:05:54] D:\My Music\Alec Benjamin - If I Killed Someone For You [Official Lyric Video].mp3 | length=185.16 | time=185.11597902495
[Monday/December 19/12/2022 21:09:03] D:\My Music\Alec Benjamin - Outrunning Karma.mp3 | length=188.664 | time=188.63381235828
[Monday/December 19/12/2022 21:26:02] D:\My Music\All Time Low - Drugs & Candy (Official Audio).mp3 | length=213.984 | time=152.45999985828
[Wednesday/December 21/12/2022 20:01:09] "playlist.m3u8" | https://179314182.global.cdnfastest.com/live/may1FHD/playlist.m3u8 | length=0 | time=39.193
[Wednesday/December 21/12/2022 20:19:18] "playlist.m3u8" | https://179314182.global.cdnfastest.com/live/live/playlist.m3u8 | length=3.4416666666666 | time=1085.699
[Thursday/December 22/12/2022 19:51:59] C:\Users\SakuraFrost225\Downloads\collab-cl5mod6ur00324usctz7f4kh4-324577112583569410\AvatarMP4_1055.mp4 | length=4.9666666666667 | time=4.6333333333333
[Sunday/January 01/01/2023 21:53:40] C:\Users\SakuraFrost225\Videos\failsound.mp3 | length=336.039184 | time=66.083820687075
[Sunday/January 01/01/2023 23:33:25] "BobRoss (live) 2023-01-01 23:33" | https://www.twitch.tv/bobross | length=1.9969222222222 | time=0
[Sunday/January 01/01/2023 23:56:18] E:\Program Files (x86)\Steam\Skins\Fluent-for-Steam-0.4.4.2fix\Options++\sidebar.gif | length=4.74 | time=2.87
[Monday/January 02/01/2023 00:01:08] "BobRoss (live) 2023-01-01 23:33" | https://www.twitch.tv/bobross | length=1.9969222222222 | time=77355.771644444
[Monday/January 02/01/2023 00:58:33] F:\stuff\Daily Artwork Project\79500654_p0.jpg | length=0 | time=0
[Monday/January 02/01/2023 00:58:34] F:\stuff\Daily Artwork Project\79520970_p0.jpg | length=0 | time=0
[Monday/January 02/01/2023 00:58:37] F:\stuff\Daily Artwork Project\79551228_p0.jpg | length=0 | time=0
[Monday/January 02/01/2023 00:58:38] F:\stuff\Daily Artwork Project\79605656_p0.png | length=0 | time=0
[Monday/January 02/01/2023 00:58:40] F:\stuff\Daily Artwork Project\79624054_p0.jpg | length=0 | time=0
[Monday/January 02/01/2023 00:58:41] F:\stuff\Daily Artwork Project\79639012_p0.jpg | length=0 | time=0
[Monday/January 02/01/2023 00:58:43] F:\stuff\Daily Artwork Project\79656822_p0.png | length=0 | time=0
[Monday/January 02/01/2023 00:58:44] F:\stuff\Daily Artwork Project\79663617_p0.png | length=0 | time=0
[Monday/January 02/01/2023 00:58:46] F:\stuff\Daily Artwork Project\79688660_p0.jpg | length=0 | time=0
[Monday/January 02/01/2023 00:58:47] F:\stuff\Daily Artwork Project\79690646_p0.jpg | length=0 | time=0
[Monday/January 02/01/2023 01:00:13] F:\stuff\Daily Artwork Project\79494635_p0.png | length=0 | time=0
[Monday/January 02/01/2023 01:00:34] F:\stuff\Daily Artwork Project\79494949_p0.jpg | length=0 | time=0
[Monday/January 02/01/2023 01:01:31] F:\stuff\Daily Artwork Project\77112645_p0.png | length=0 | time=0
[Monday/January 02/01/2023 01:01:33] F:\stuff\Daily Artwork Project\86929530_p0.png | length=0 | time=0
[Monday/January 02/01/2023 01:01:34] F:\stuff\Daily Artwork Project\78227997_p0.png | length=0 | time=0
[Monday/January 02/01/2023 01:01:35] F:\stuff\Daily Artwork Project\64099029_p0.png | length=0 | time=0
[Monday/January 02/01/2023 01:18:00] F:\stuff\Daily Artwork Project\75255538_p0.jpg | length=0 | time=0
[Monday/January 02/01/2023 01:19:36] F:\stuff\Daily Artwork Project\75242413_p0.png | length=0 | time=0
[Tuesday/January 10/01/2023 21:06:58] "SEASON 2023 KICKOFF | Vietnam Championship Series - LMHT 2023-01-10 21:06" | https://www.youtube.com/watch?v=ux3J9L1dtz4 | length=0 | time=6.1728444444444
[Sunday/January 15/01/2023 21:19:16] D:\Music\MrSuicideSheep\Kerli - Better.mp3 | length=224.835918 | time=39.376065496032
[Tuesday/January 17/01/2023 20:33:54] D:\Etterna\Songs\Otaku's Dream 8th Anime Mix\(Tweety3187) Houkago Overflow\Houkago Overflow edit.mp3 | length=131.578776 | time=67.390488054422
[Tuesday/January 17/01/2023 20:34:10] F:\osu!\Songs\1636902 Aries - BELIEVE IN ME, WHO BELIEVES IN YOU\audio.mp3 | length=1972.897959 | time=5.6459777165533
[Thursday/January 26/01/2023 18:46:43] "[playlist] 초여름의 피크닉" | https://www.youtube.com/watch?v=uHvk5d1i6UY | length=4948.341 | time=1231.03
[Thursday/January 26/01/2023 20:08:25] "♪ Study Night [ Soothing Relaxation Study Sleep BGM ]" | https://www.youtube.com/watch?v=ROy57arUE1s | length=10800.681 | time=4895.857
[Thursday/January 26/01/2023 20:19:36] "Becky G - Shower" | https://www.youtube.com/watch?v=50-_oTkmF5I | length=219.961 | time=131.048
[Thursday/January 26/01/2023 20:20:26] "Katy Perry - Roar (Official)" | https://www.youtube.com/watch?v=CevxZvSJLk8 | length=269.141 | time=170.003
[Thursday/January 26/01/2023 20:21:08] "Katy Perry - Roar (Official)" | https://www.youtube.com/watch?v=CevxZvSJLk8 | length=269.141 | time=177.094
[Thursday/January 26/01/2023 20:21:40] "Katy Perry - Roar (Official)" | https://www.youtube.com/watch?v=CevxZvSJLk8 | length=269.141 | time=188.063
[Thursday/January 26/01/2023 20:23:18] "Becky G - Shower" | https://www.youtube.com/watch?v=50-_oTkmF5I | length=219.961 | time=137.596
[Thursday/January 26/01/2023 20:27:27] "Fifth Harmony - Work from Home (Official Video) ft. Ty Dolla $ign" | https://www.youtube.com/watch?v=5GL9JoH4Sws | length=219.961 | time=30.155
[Thursday/January 26/01/2023 20:31:42] "Fifth Harmony - Work from Home (Official Video) ft. Ty Dolla $ign" | https://www.youtube.com/watch?v=5GL9JoH4Sws | length=219.961 | time=17.351
[Thursday/January 26/01/2023 20:32:07] "Fifth Harmony - Work from Home (Official Video) ft. Ty Dolla $ign" | https://www.youtube.com/watch?v=5GL9JoH4Sws | length=219.961 | time=6.799
[Thursday/January 26/01/2023 20:32:40] "Becky G - Shower" | https://www.youtube.com/watch?v=50-_oTkmF5I | length=219.961 | time=219.94023425764
[Thursday/January 26/01/2023 20:32:50] "Becky G, Natti Natasha - Sin Pijama (Official Video)" | https://www.youtube.com/watch?v=zEf423kYfqk | length=216.361 | time=216.29941666667
[Thursday/January 26/01/2023 20:32:57] "Becky G, Bad Bunny - Mayores (Official Video)" | https://www.youtube.com/watch?v=GMFewiplIbw | length=211.061 | time=0.334
[Saturday/January 28/01/2023 11:51:16] F:\Video\2023-01-28 11-50-22.mp4 | length=22.416666666667 | time=12.25
[Saturday/January 28/01/2023 11:53:04] F:\Video\2023-01-28 11-51-44.mp4 | length=34.233333333333 | time=33.25
[Saturday/January 28/01/2023 12:55:08] F:\Video\2023-01-28 12-25-13.mp4 | length=30.416666666667 | time=6.0833333333333
[Saturday/January 28/01/2023 12:58:00] F:\Video\2023-01-28 12-56-00.mp4 | length=50.116666666667 | time=38.466666666667
[Thursday/February 02/02/2023 12:54:44] "VTV1 HD" | https://livecdn.fptplay.net/hda1/vtv1hd_vhls.smil/chunklist_b5000000.m3u8 | length=0 | time=1665.925
[Friday/February 03/02/2023 18:26:07] "National Geographic" | http://livecdn.fptplay.net/hda2/natgeohd_vhls.smil/chunklist_b5000000.m3u8 | length=0 | time=5.84
[Friday/February 03/02/2023 18:26:13] "NHK World" | http://livecdn.fptplay.net/hda2/nhkworld_vhls.smil/chunklist_b5000000.m3u8 | length=0 | time=9.5123333333333
[Friday/February 03/02/2023 18:26:17] "NHK World" | http://livecdn.fptplay.net/hda2/nhkworld_vhls.smil/chunklist_b5000000.m3u8 | length=0 | time=0
[Friday/February 03/02/2023 18:26:20] "Nat Geo Wild" | http://livecdn.fptplay.net/hda3/natgeowild_vhls.smil/chunklist_b5000000.m3u8 | length=0 | time=2.16
[Friday/February 03/02/2023 18:26:30] "KIX" | http://livecdn.fptplay.net/hda1/kixhd_vhls.smil/chunklist_b5000000.m3u8 | length=1.7706662222226 | time=8.5336666666667
[Friday/February 03/02/2023 18:26:41] "DreamWorks" | http://livecdn.fptplay.net/hda3/dreamworks_vhls.smil/chunklist_b5000000.m3u8 | length=0 | time=10.2
[Friday/February 03/02/2023 18:26:50] "DreamWorks" | http://livecdn.fptplay.net/hda3/dreamworks_vhls.smil/chunklist_b5000000.m3u8 | length=0 | time=0
[Friday/February 03/02/2023 18:26:57] "Cartoon Network" | http://livecdn.fptplay.net/hda3/cartoonnetworkhd_vhls.smil/chunklist_b5000000.m3u8 | length=1.2006668888898 | time=6.8
[Friday/February 03/02/2023 18:27:16] "ANIMAX" | http://livecdn.fptplay.net/hda3/animaxport_vhls.smil/chunklist_b5000000.m3u8 | length=1.2586670000001 | time=23.759
[Friday/February 03/02/2023 18:27:21] "Cinemax" | http://livecdn.fptplay.net/hda1/cinemax_vhls.smil/chunklist_b5000000.m3u8 | length=0 | time=3.226
[Friday/February 03/02/2023 18:27:29] "Cinema World" | http://livecdn.fptplay.net/hda2/cinemawork_vhls.smil/chunklist_b5000000.m3u8 | length=0 | time=7.0206666666667
[Friday/February 03/02/2023 18:27:57] "HBO" | http://livecdn.fptplay.net/hda1/hbo_vhls.smil/chunklist_b5000000.m3u8 | length=0 | time=27.73
[Friday/February 03/02/2023 18:28:03] "AXN" | http://livecdn.fptplay.net/hda3/axnhd_vhls.smil/chunklist_b5000000.m3u8 | length=0 | time=4.36
[Friday/February 03/02/2023 18:28:35] "AXN" | http://livecdn.fptplay.net/hda3/axnhd_vhls.smil/chunklist_b5000000.m3u8 | length=0 | time=0
[Friday/February 03/02/2023 18:36:23] "HBO" | http://livecdn.fptplay.net/hda1/hbo_vhls.smil/chunklist_b5000000.m3u8 | length=0 | time=466.57
[Thursday/February 16/02/2023 20:45:58] "BRO vs DK | Match43 Highlight 02.16 | 2023 LCK Spring Split" | https://www.youtube.com/watch?v=zeWCg73RAc4 | length=1067.541 | time=633.583
[Thursday/February 16/02/2023 21:47:21] "Another Love X Memories Perfect X Billie Eilish Lovely" | https://www.youtube.com/watch?v=UnjSeOPQw24 | length=363.281 | time=44.64
[Thursday/February 16/02/2023 21:51:21] "Maroon 5 - One More Night (Official Music Video)" | https://www.youtube.com/watch?v=fwK7ggA3-bU | length=223.001 | time=222.99367483418
[Thursday/February 16/02/2023 21:52:37] "Maroon 5 - Animals (Official Music Video)" | https://www.youtube.com/watch?v=qpgTC9MDx1o | length=280.061 | time=69.82
[Thursday/February 16/02/2023 21:55:56] "Niall Horan - Slow Hands (Official Lyric Video)" | https://www.youtube.com/watch?v=nBmNcLBaPUE | length=198.441 | time=192.859
[Thursday/February 16/02/2023 22:03:30] "Niall Horan - Nice To Meet Ya (Official Video)" | https://www.youtube.com/watch?v=k7jeYJA9bgY | length=197.061 | time=197.04536514333
[Thursday/February 16/02/2023 22:05:19] "Niall Horan - Too Much To Ask (Official Video)" | https://www.youtube.com/watch?v=ljXSjIph5ZM | length=225.521 | time=102.96
[Friday/February 24/02/2023 20:54:55] "Conan Gray - Astronomy (Official Lyric Video)" | https://www.youtube.com/watch?v=B-W6JrZGLdE | length=243.981 | time=243.96124502893
[Friday/February 24/02/2023 21:50:17] "Madison Beer - Reckless (Official Music Video)" | https://www.youtube.com/watch?v=TFHCew8DnC0 | length=228.341 | time=228.32262722492
[Friday/February 24/02/2023 21:53:39] "Madison Beer - Reckless (Lyrics)" | https://www.youtube.com/watch?v=kPOqHM9IQ7c | length=194.061 | time=194.03837122192
[Friday/February 24/02/2023 21:54:55] "Ruth B. - Dandelions (Lyrics)" | https://www.youtube.com/watch?v=jT5VCHzQtPs | length=233.061 | time=62.796
[Friday/February 24/02/2023 22:13:10] "Conan Gray - People Watching (Official Video)" | https://www.youtube.com/watch?v=goqqohUitmw | length=209.701 | time=209.68613629456
[Friday/February 24/02/2023 22:21:37] "Conan Gray - Heather" | https://www.youtube.com/watch?v=24u3NoPvgMw | length=205.121 | time=205.11431148954
[Friday/February 24/02/2023 22:26:34] "Conan Gray - Memories (Official Music Video)" | https://www.youtube.com/watch?v=2lSyHZLzNYA | length=290.101 | time=290.08770283622
[Friday/February 24/02/2023 22:26:49] "Conan Gray - Heather" | https://www.youtube.com/watch?v=24u3NoPvgMw | length=205.121 | time=8.809
[Friday/February 24/02/2023 22:30:36] "ROSÉ - 'Gone' M/V" | https://www.youtube.com/watch?v=K9_VFxzCuQ0 | length=220.661 | time=220.64842801679
[Friday/February 24/02/2023 22:32:02] "ROSÉ - 'On The Ground' M/V" | https://www.youtube.com/watch?v=CKZvWhCqx1s | length=188.941 | time=76.417
[Friday/February 24/02/2023 22:35:48] "Maroon 5 - One More Night (Official Music Video)" | https://www.youtube.com/watch?v=fwK7ggA3-bU | length=223.001 | time=217.342
[Friday/February 24/02/2023 22:39:48] "Niall Horan - On The Loose (Official Video)" | https://www.youtube.com/watch?v=wk99OKNE_Ro | length=234.141 | time=234.11599690056
[Friday/February 24/02/2023 22:40:45] "Niall Horan - Slow Hands (Official Lyric Video)" | https://www.youtube.com/watch?v=nBmNcLBaPUE | length=198.441 | time=50.383
[Friday/February 24/02/2023 22:40:54] "Niall Horan - Too Much To Ask (Official Video)" | https://www.youtube.com/watch?v=ljXSjIph5ZM | length=225.521 | time=2.36
[Friday/February 24/02/2023 22:43:30] "Niall Horan - Slow Hands (Official Lyric Video)" | https://www.youtube.com/watch?v=nBmNcLBaPUE | length=198.441 | time=198.42692573576
[Friday/February 24/02/2023 22:55:52] "Maroon 5 - Animals (Official Music Video)" | https://www.youtube.com/watch?v=qpgTC9MDx1o | length=280.061 | time=39.039
[Friday/February 24/02/2023 22:55:59] "Conan Gray - Maniac (Official Video)" | https://www.youtube.com/watch?v=-E-_IRJU5w0 | length=212.821 | time=212.80010453265
[Friday/February 24/02/2023 22:59:45] "BENEE ft. Gus Dapperton - Supalonely (Official Music Video)" | https://www.youtube.com/watch?v=Rb6Scz-5YOs | length=220.781 | time=220.7645443851
[Friday/February 24/02/2023 23:08:00] "Niall Horan - Too Much To Ask (Official Video)" | https://www.youtube.com/watch?v=ljXSjIph5ZM | length=225.521 | time=225.50142877703
[Friday/February 24/02/2023 23:19:44] "Niall Horan - Too Much To Ask (Official Alternate Version)" | https://www.youtube.com/watch?v=AOzJ8hFFEjM | length=225.561 | time=225.54786777967
[Friday/February 24/02/2023 23:30:53] "Niall Horan - Flicker (Official Acoustic)" | https://www.youtube.com/watch?v=BUaLnDL3f-M | length=256.961 | time=256.94124374234
[Friday/February 24/02/2023 23:34:10] "Tessa Violet - Not Over You" | https://www.youtube.com/watch?v=Dg4setI1nMk | length=191.601 | time=191.5770622849
[Saturday/February 25/02/2023 00:47:05] "Relaxing Sleep Music + Insomnia - Stress Relief, Relaxing Music, Deep Sleeping Music" | https://www.youtube.com/watch?v=bP9gMpl1gyQ | length=11130.781 | time=4.605
[Saturday/February 25/02/2023 00:48:52] "Relaxing Sleep Music + Insomnia - Stress Relief, Relaxing Music, Deep Sleeping Music" | https://www.youtube.com/watch?v=bP9gMpl1gyQ | length=11130.781 | time=11.945
[Saturday/February 25/02/2023 11:18:23] "Relaxing Sleep Music + Insomnia - Stress Relief, Relaxing Music, Deep Sleeping Music" | https://www.youtube.com/watch?v=bP9gMpl1gyQ | length=11130.781 | time=16.35
[Saturday/February 25/02/2023 11:18:51] "Niall Horan - This Town (Official Lyric Video)" | https://www.youtube.com/watch?v=ic1l36GrNOU | length=235.481 | time=235.46276992344
[Saturday/February 25/02/2023 11:18:55] "Niall Horan - This Town (Official Lyric Video)" | https://www.youtube.com/watch?v=ic1l36GrNOU | length=235.481 | time=0
[Saturday/February 25/02/2023 14:19:22] "[🔴LIVE] T1 vs KT - NS vs LSB | 2023 LCK Spring Split 2023-02-25 13:47" | https://www.youtube.com/watch?v=hdilqZcs21E | length=0 | time=1933.3833777778
[Saturday/February 25/02/2023 16:38:40] C:\mpv\downloads\EDEN - Wake Up.webm | length=279.448 | time=110.52
[Saturday/February 25/02/2023 16:39:57] "EDEN - Wake Up" | https://www.youtube.com/watch?v=YthChN1Wq8M | length=279.441 | time=215.72
[Saturday/February 25/02/2023 16:49:44] C:\mpv\downloads\EDEN - Wake Up.webm | length=279.448 | time=166.68
[Saturday/February 25/02/2023 16:49:57] C:\mpv\downloads\EDEN - Wake Up (Lyric Video).f303.webm | length=279.513 | time=271.855
[Sunday/February 26/02/2023 13:14:54] D:\Music\Arctic Empire\'Afterlife' A Melodic Dubstep Gaming Mix.mp3 | length=3716.571429 | time=1.6083984960317
[Sunday/February 26/02/2023 14:29:35] "Japanese soft indie/rock, that would be in Goodnight Punpun's playlist" | https://www.youtube.com/watch?v=DXKojYz25Gw | length=3628.961 | time=23.9
[Sunday/February 26/02/2023 15:30:24] "Japanese soft indie/rock, that would be in Goodnight Punpun's playlist" | https://www.youtube.com/watch?v=DXKojYz25Gw | length=3628.961 | time=3628.943249997
[Sunday/February 26/02/2023 15:38:49] "strange beats to rock out to: ᴀɴ ᴀᴅᴅɪᴄᴛɪɴɢ ᴊᴀᴘᴀɴᴇꜱᴇ ʀᴏᴄᴋ ᴘʟᴀʏʟɪꜱᴛ ᴛᴏ ʙᴏᴏꜱᴛ ʏᴏᴜʀ ꜱᴇʀᴏᴛᴏɴɪɴ" | https://www.youtube.com/watch?v=WdWC76shblk | length=1739.4133333333 | time=486.886
[Sunday/February 26/02/2023 21:36:57] "chunklist_b5000000.m3u8" | https://livecdn.fptplay.net/hda1/vtv1hd_vhls.smil/chunklist_b5000000.m3u8 | length=0 | time=351.88
[Sunday/February 26/02/2023 21:50:31] "chunklist_b5000000.m3u8" | https://livecdn.fptplay.net/hda1/vtv1hd_vhls.smil/chunklist_b5000000.m3u8 | length=0 | time=0.018
[Sunday/February 26/02/2023 22:02:36] "Tessa Violet - Crush (Official Music Video)" | https://www.youtube.com/watch?v=SiAuAJBZuGs | length=257.661 | time=186.811
[Sunday/February 26/02/2023 22:07:31] "Phum Viphurit - Lover Boy [Official Video]" | https://www.youtube.com/watch?v=8HnLRrQ3RS4 | length=312.021 | time=241.32
[Sunday/February 26/02/2023 22:14:07] "boy pablo - Everytime" | https://www.youtube.com/watch?v=Lzi7ljJiLJQ | length=178.581 | time=178.56226386262
[Sunday/February 26/02/2023 22:23:05] "boy pablo - sick feeling (official video)" | https://www.youtube.com/watch?v=hTFDlGv2IWg | length=155.721 | time=48.549
[Sunday/February 26/02/2023 22:29:40] "Tessa Violet - Haze" | https://www.youtube.com/watch?v=JCd9Z6cc_6Y | length=224.461 | time=223.79
[Sunday/February 26/02/2023 22:33:41] "Tessa Violet - Haze" | https://www.youtube.com/watch?v=JCd9Z6cc_6Y | length=224.461 | time=224.44508333337
[Sunday/February 26/02/2023 22:34:14] "Tessa Violet - Crush (Official Music Video)" | https://www.youtube.com/watch?v=SiAuAJBZuGs | length=257.661 | time=20.855
[Sunday/February 26/02/2023 22:42:46] "Tessa Violet - Crush (Official Music Video)" | https://www.youtube.com/watch?v=SiAuAJBZuGs | length=257.661 | time=257.63802083339
[Sunday/February 26/02/2023 22:43:10] "David Archuleta - Crush (Official Video)" | https://www.youtube.com/watch?v=6J1-eYBbspA | length=211.661 | time=14.581
[Sunday/February 26/02/2023 22:48:19] "Not Over You (acoustic)" | https://www.youtube.com/watch?v=oPpInGffxgM | length=202.141 | time=201.493
[Sunday/February 26/02/2023 22:48:29] "Not Over You (acoustic)" | https://www.youtube.com/watch?v=oPpInGffxgM | length=202.141 | time=202.13049452798
[Sunday/February 26/02/2023 22:48:33] "Not Over You (acoustic)" | https://www.youtube.com/watch?v=oPpInGffxgM | length=202.141 | time=0
[Sunday/February 26/02/2023 23:22:02] "Bolbbalgan4 (볼빨간 사춘기) Playlist Part.1" | https://www.youtube.com/watch?v=vUraRMLwl80 | length=3319.721 | time=18.267
[Sunday/February 26/02/2023 23:42:19] "Bolbbalgan4 (볼빨간 사춘기) Playlist Part.1" | https://www.youtube.com/watch?v=vUraRMLwl80 | length=3319.721 | time=1217.6477579992
[Sunday/February 26/02/2023 23:42:40] "Bolbbalgan4 (볼빨간 사춘기) Playlist Part.1" | https://www.youtube.com/watch?v=vUraRMLwl80 | length=3319.721 | time=0
[Monday/February 27/02/2023 08:55:07] "How One Line of Code Almost Blew Up the Internet" | https://www.youtube.com/watch?v=GEbn3nHyKnA | length=826.061 | time=4.5
[Monday/February 27/02/2023 10:08:43] "Bruno Mars, Anderson .Paak, Silk Sonic - Leave the Door Open [Official Video]" | https://www.youtube.com/watch?v=adLGHcj_fmA&list=RDadLGHcj_fmA&start_radio=1 | length=248.301 | time=61.519
[Monday/February 27/02/2023 10:09:08] "Bruno Mars - That’s What I Like [Official Music Video]" | https://www.youtube.com/watch?v=PMivT7MJ41M | length=210.741 | time=13.013
[Monday/February 27/02/2023 10:12:39] "Bruno Mars - That’s What I Like [Official Music Video]" | https://www.youtube.com/watch?v=PMivT7MJ41M | length=210.741 | time=210.72212500003
[Monday/February 27/02/2023 10:20:44] "Bruno Mars, Anderson .Paak, Silk Sonic - Leave the Door Open [Official Video]" | https://www.youtube.com/watch?v=adLGHcj_fmA&list=RDadLGHcj_fmA&start_radio=1 | length=248.301 | time=244.30630865718
[Monday/February 27/02/2023 10:26:37] "Bruno Mars - Versace on the Floor (Official Music Video)" | https://www.youtube.com/watch?v=-FyjEnoIgTM | length=336.861 | time=336.84131249998
[Monday/February 27/02/2023 10:30:53] "Bruno Mars - Just The Way You Are (Official Music Video)" | https://www.youtube.com/watch?v=LjhCEhWiKXk | length=236.761 | time=236.74006250005
[Monday/February 27/02/2023 10:34:25] "Bruno Mars - The Lazy Song (Official Music Video)" | https://www.youtube.com/watch?v=fLexgOxsZu0 | length=199.061 | time=199.04245833336
[Monday/February 27/02/2023 10:39:08] "Mark Ronson - Uptown Funk (Official Video) ft. Bruno Mars" | https://www.youtube.com/watch?v=OPf0YbXqDm0 | length=270.421 | time=270.39737500004
[Monday/February 27/02/2023 10:40:00] "Maroon 5 - Sugar (Official Music Video)" | https://www.youtube.com/watch?v=09R8_2nJtjg | length=301.381 | time=38.960289000001
[Monday/February 27/02/2023 10:43:39] "keshi - 2 soon // Lyrics" | https://www.youtube.com/watch?v=6P_w0adSpYU | length=207.021 | time=207.00689583337
[Monday/February 27/02/2023 11:04:46] "Steve Lacy - Static (Lyrics)" | https://www.youtube.com/watch?v=NfNqZ6OrpwI | length=156.161 | time=42.767
[Monday/February 27/02/2023 11:32:33] "Die For You ft. Grabbitz // Official Music Video // VALORANT Champions 2021" | https://www.youtube.com/watch?v=h7MYJghRWt0 | length=218.021 | time=0
[Monday/February 27/02/2023 11:43:32] "Burn It All Down (ft. PVRIS) | Worlds 2021 - League of Legends" | https://www.youtube.com/watch?v=1Z6CHioIn3s | length=212.021 | time=0
[Monday/February 27/02/2023 11:45:05] "Los Retros - Someone To Spend Time With" | https://www.youtube.com/watch?v=VRQDOFaFqWk&list=RDVRQDOFaFqWk&start_radio=1 | length=174.521 | time=94.417
[Monday/February 27/02/2023 11:47:58] "Brand New" | https://www.youtube.com/watch?v=OsYJWLaq9UI&list=RDOsYJWLaq9UI&start_radio=1 | length=156.401 | time=156.38225565038
[Monday/February 27/02/2023 11:49:44] "With Somebody" | https://www.youtube.com/watch?v=hLHyeMOpbQQ | length=204.181 | time=96.4
[Monday/February 27/02/2023 11:50:18] "Taylor Swift - Ours" | https://www.youtube.com/watch?v=LZ34LlaIk88 | length=243.161 | time=1.25
[Monday/February 27/02/2023 11:58:37] "Taylor Swift - The Story Of Us" | https://www.youtube.com/watch?v=nN6VR92V70M | length=266.181 | time=163.667
[Monday/February 27/02/2023 20:26:23] "keshi - LIMBO (Visualizer)" | https://www.youtube.com/watch?v=ssIiBm0ORuI | length=212.861 | time=212.84655101029
[Monday/February 27/02/2023 21:26:42] "♫ a keshi playlist (30 songs) [UPDATED]" | https://www.youtube.com/watch?v=3sAqPDjR2z4 | length=5269.021 | time=1461.527
[Monday/February 27/02/2023 21:30:05] "[MV] BOL4(볼빨간사춘기) _ Some(썸 탈꺼야)" | https://www.youtube.com/watch?v=hZmoMyFXDoI | length=186.701 | time=186.68924341695
[Monday/February 27/02/2023 21:33:44] "[M/V] 좋다고 말해 - 볼빨간사춘기" | https://www.youtube.com/watch?v=y5MAgMVwfFs | length=207.241 | time=207.21570587016
[Monday/February 27/02/2023 21:37:04] "[M/V] BOL4(볼빨간사춘기) - Some(썸 탈꺼야)" | https://www.youtube.com/watch?v=8Em2XrbY_cc | length=186.701 | time=186.68924923921
[Monday/February 27/02/2023 21:40:35] "[MV] IU(아이유) _ Celebrity" | https://www.youtube.com/watch?v=0-q1KafFCLU | length=198.101 | time=198.07863671901
[Monday/February 27/02/2023 21:44:18] "[MV] IU(아이유) _ BBIBBI(삐삐)" | https://www.youtube.com/watch?v=nM0xDI5R50E | length=208.401 | time=208.37669688484
[Monday/February 27/02/2023 21:46:14] "[MV] IU(아이유) _ Blueming(블루밍)" | https://www.youtube.com/watch?v=D1PvIWdJ8xo | length=221.801 | time=101.852
[Monday/February 27/02/2023 21:46:38] "[IU] Blueming Live Clip (2019 IU Tour Concert 'Love, poem')" | https://www.youtube.com/watch?v=o_nxIQTM_B0 | length=279.081 | time=4.771
[Monday/February 27/02/2023 21:57:26] "[MV] BOL4(볼빨간사춘기) _ Bom(나만, 봄)" | https://www.youtube.com/watch?v=AsXxuIdpkWM | length=222.281 | time=222.27382532569
[Monday/February 27/02/2023 22:01:57] "[MV] BOL4(볼빨간사춘기) _ Travel(여행)" | https://www.youtube.com/watch?v=xRbPAVnqtcs | length=257.401 | time=257.3940122431
[Monday/February 27/02/2023 22:05:48] "[M/V] 우주를 줄게  - 볼빨간사춘기" | https://www.youtube.com/watch?v=9U8uA702xrE | length=216.041 | time=216.01604246839
[Monday/February 27/02/2023 22:06:39] "[도깨비 OST Part 1] 찬열, 펀치 (CHANYEOL, PUNCH) - Stay With Me MV" | https://www.youtube.com/watch?v=pcKR0LPwoYs | length=192.021 | time=4.1679466908801
[Monday/February 27/02/2023 22:10:52] "Epik High (에픽하이) - 비 오는 날 듣기 좋은 노래 (Rain Song) ft. Colde | Official MV" | https://www.youtube.com/watch?v=0CS8qFgFHxU | length=243.761 | time=243.75250000005
[Monday/February 27/02/2023 22:16:13] "EPIK HIGH (에픽하이) - 빈차 (HOME IS FAR AWAY) ft. 오혁 of HYUKOH [Official MV]" | https://www.youtube.com/watch?v=pTD9Jysi3_g | length=343.721 | time=309.83106800001
[Monday/February 27/02/2023 22:21:56] "이하이 (LeeHi) - 'ONLY' Official MV (ENG/CHN)" | https://www.youtube.com/watch?v=KmOVNVZEP9o | length=330.361 | time=330.33968749999
[Monday/February 27/02/2023 22:29:30] "이하이 (LeeHi) - [4 ONLY] Live Performance Day 1 (ENG)" | https://www.youtube.com/watch?v=fF4UF6VaBSc | length=1080.101 | time=440.24874999989
[Monday/February 27/02/2023 22:34:23] "EDEN - Wake Up" | https://www.youtube.com/watch?v=YthChN1Wq8M | length=279.441 | time=279.41833333337
[Tuesday/February 28/02/2023 00:09:31] "Best of EDEN & The Eden Project   A Chillout Mix" | https://www.youtube.com/watch?v=i0I7ZuOfcVk | length=5636.461 | time=5636.4476250303
[Tuesday/February 28/02/2023 09:05:01] "I'm feeling emotional... (a chill mix)" | https://www.youtube.com/watch?v=HxgOpuDzap8 | length=5400.981 | time=3277.6544999979
[Tuesday/February 28/02/2023 09:23:57] "No Sleep | A Chill Mix" | https://www.youtube.com/watch?v=z3PpphdrEmU | length=5186.801 | time=1124.3011019993
[Tuesday/February 28/02/2023 09:24:32] "No Sleep | A Chill Mix" | https://www.youtube.com/watch?v=z3PpphdrEmU | length=5186.801 | time=0
[Tuesday/February 28/02/2023 20:41:05] "Los Retros - Someone To Spend Time With" | https://www.youtube.com/watch?v=VRQDOFaFqWk&list=RDVRQDOFaFqWk&start_radio=1 | length=174.521 | time=174.51039416242
[Tuesday/February 28/02/2023 20:53:47] "Los Retros - Someone To Spend Time With 🎧💟 1hour 1시간 재생" | https://www.youtube.com/watch?v=5nnvS-JuLrk | length=4021.421 | time=747.38
[Tuesday/February 28/02/2023 20:54:16] "Taylor Swift - Ours" | https://www.youtube.com/watch?v=LZ34LlaIk88&list=RDLZ34LlaIk88&start_radio=1 | length=243.161 | time=3.208
[Tuesday/February 28/02/2023 20:57:59] "Taylor Swift - Ours" | https://www.youtube.com/watch?v=LZ34LlaIk88&list=RDLZ34LlaIk88&start_radio=1 | length=243.161 | time=243.14856960968
[Tuesday/February 28/02/2023 21:02:22] "Taylor Swift - Begin Again" | https://www.youtube.com/watch?v=cMPEd8m79Hw | length=250.341 | time=250.32355373854
[Tuesday/February 28/02/2023 21:06:34] "Taylor Swift - Red" | https://www.youtube.com/watch?v=Zlot0i3Zykw | length=241.281 | time=241.26775029905
[Tuesday/February 28/02/2023 21:11:07] "Taylor Swift - New Romantics" | https://www.youtube.com/watch?v=wyK7YuwUWsU | length=261.461 | time=261.44589475154
[Tuesday/February 28/02/2023 21:14:51] "Taylor Swift - Gorgeous (Lyric Video)" | https://www.youtube.com/watch?v=EUoe7cf0HYw | length=211.601 | time=211.59267648857
[Tuesday/February 28/02/2023 21:19:39] "Taylor Swift - Blank Space" | https://www.youtube.com/watch?v=e-ORhEE9VVg | length=272.441 | time=272.42893766544
[Tuesday/February 28/02/2023 21:23:07] "Taylor Swift - Blank Space" | https://www.youtube.com/watch?v=e-ORhEE9VVg | length=272.441 | time=0
[Tuesday/February 28/02/2023 21:30:29] "Họa sỹ bầu trời - Sky Painter by Gác Mái (ORIGINAL)" | https://www.youtube.com/watch?v=e_O3TQ00qtY | length=210.061 | time=4.64
[Tuesday/February 28/02/2023 21:46:11] "Họa sỹ bầu trời - Sky Painter by Gác Mái (ORIGINAL)" | https://www.youtube.com/watch?v=e_O3TQ00qtY | length=210.061 | time=210.04855445454
[Wednesday/March 01/03/2023 08:29:18] D:\Tsukinami (2015, Limited Edition, EAC+CUE+LOG) - Kanon Wakeshima-20201212T152723Z-001\Tsukinami (2015, Limited Edition, EAC+CUE+LOG) - Kanon Wakeshima\04 - Chocolate.flac | length=285 | time=13.461035
[Wednesday/March 01/03/2023 22:54:22] "KT vs BRO - KDF vs DK | 2023 LCK Spring Split" | https://www.youtube.com/watch?v=5zZZs4Yw9cc | length=22142.061 | time=3192.339
[Thursday/March 02/03/2023 16:12:41] "[🔴LIVE] KT vs GEN - NS vs HLE | 2023 LCK Spring Split 2023-03-02 16:12" | https://www.youtube.com/watch?v=dDMN8ldXP38 | length=0 | time=12.831044444444
[Thursday/March 02/03/2023 16:15:54] "[🔴LIVE] KT vs GEN - NS vs HLE | 2023 LCK Spring Split 2023-03-02 16:13" | https://www.youtube.com/watch?v=dDMN8ldXP38 | length=0.91328911111123 | time=145.01610102041
[Thursday/March 02/03/2023 17:14:52] "Bình Luận Tiếng Việt: KT vs GEN | NS vs HLE | Tuần 7 Ngày 2 | LCK Mùa Xuân 2023 2023-03-02 16:16" | https://www.youtube.com/watch?v=pBp7ldaLt8k | length=0 | time=582.349
[Thursday/March 02/03/2023 17:48:03] "[🔴LIVE] KT vs GEN - NS vs HLE | 2023 LCK Spring Split 2023-03-02 17:46" | https://www.youtube.com/watch?v=dDMN8ldXP38 | length=0 | time=3.0363666666667
[Thursday/March 02/03/2023 18:18:02] "Gác Mái  | 388 |" | https://www.youtube.com/watch?v=WfeVvjaavW8 | length=339.761 | time=191.983
[Thursday/March 02/03/2023 18:22:16] "Taylor Swift - Ours" | https://www.youtube.com/watch?v=LZ34LlaIk88 | length=243.161 | time=243.14857427964
[Thursday/March 02/03/2023 18:27:30] "Taylor Swift - Back To December" | https://www.youtube.com/watch?v=QUwxKWT6m7U | length=304.041 | time=304.03150000001
[Thursday/March 02/03/2023 18:45:13] "Taylor Swift - Enchanted (Lyrics) | Ed Sheeran, Charlie Puth,..." | https://www.youtube.com/watch?v=MMP5ao1KlZg | length=1050.741 | time=1050.7271874993
[Thursday/March 02/03/2023 18:45:44] "Taylor Swift - Love Story (Lyrics) | Love Yourself,Memories,Mirrors..." | https://www.youtube.com/watch?v=ewaCn1xvdlA | length=1203.461 | time=18.3445
[Friday/March 03/03/2023 12:05:02] C:\Users\SakuraFrost225\Downloads\909 - Eden.flac | length=258.04 | time=6.100518
[Friday/March 03/03/2023 16:08:12] D:\Tsukinami (2015, Limited Edition, EAC+CUE+LOG) - Kanon Wakeshima-20201212T152723Z-001\Tsukinami (2015, Limited Edition, EAC+CUE+LOG) - Kanon Wakeshima\04 - Chocolate.flac | length=285 | time=12.16
[Friday/March 03/03/2023 16:19:49] "[🔴LIVE] LSB vs KDF - BRO vs T1 | 2023 LCK Spring Split 2023-03-03 16:08" | https://www.youtube.com/watch?v=ZHGejJd2Igs | length=0 | time=665.79913333333
[Friday/March 03/03/2023 23:36:06] C:\Users\SakuraFrost225\Downloads\909 - Eden.flac | length=258.04 | time=258.03977324263
[Friday/March 03/03/2023 23:39:22] C:\Users\SakuraFrost225\Downloads\4202013_browser_firefox_logo_social_social media_icon.png | length=0 | time=0
[Saturday/March 04/03/2023 11:16:26] " List TV by NguyenHung.Net" | https://i.imgur.com/g7whC32.jpg | length=0 | time=0
[Saturday/March 04/03/2023 11:51:30] "VTV1 FHD" | https://vips-livecdn.fptplay.net/hda1/vtv1hd_vhls.smil/chunklist_b5000000.m3u8 | length=0 | time=2103.801
[Saturday/March 04/03/2023 18:34:36] G:\11708519_20200303_095100.mp4 | length=1199.64 | time=2.32
[Sunday/March 05/03/2023 11:01:10] D:\Tsukinami (2015, Limited Edition, EAC+CUE+LOG) - Kanon Wakeshima-20201212T152723Z-001\Tsukinami (2015, Limited Edition, EAC+CUE+LOG) - Kanon Wakeshima\02 - Tsukinami.flac | length=293.826667 | time=293.82643990928
[Sunday/March 05/03/2023 11:05:09] D:\Tsukinami (2015, Limited Edition, EAC+CUE+LOG) - Kanon Wakeshima-20201212T152723Z-001\Tsukinami (2015, Limited Edition, EAC+CUE+LOG) - Kanon Wakeshima\03 - Sansukumi.flac | length=238 | time=237.99977324262
[Sunday/March 05/03/2023 11:35:17] D:\Tsukinami (2015, Limited Edition, EAC+CUE+LOG) - Kanon Wakeshima-20201212T152723Z-001\Tsukinami (2015, Limited Edition, EAC+CUE+LOG) - Kanon Wakeshima\04 - Chocolate.flac | length=285 | time=15.319855520408
[Sunday/March 05/03/2023 15:02:40] D:\Torrent\Atelier\Compilations and  Albums\[2010.06.23] アトリエシリーズ・ヴォーカルコレクション ～フォルクスリート3～\09. みとせのりこ — REPLICATED ANGEL.flac | length=336.693333 | time=1.329496
[Sunday/March 05/03/2023 15:02:56] "Họa sỹ bầu trời - Sky Painter by Gác Mái (Demo Version)" | https://www.youtube.com/watch?v=e_O3TQ00qtY | length=210.04 | time=2.6
[Sunday/March 05/03/2023 15:25:45] "Gác Mái  | 388 |" | https://www.youtube.com/watch?v=WfeVvjaavW8 | length=339.761 | time=12.512
[Sunday/March 05/03/2023 15:32:52] "Gác Mái  | 388 |" | https://www.youtube.com/watch?v=WfeVvjaavW8 | length=339.761 | time=126.584
[Sunday/March 05/03/2023 15:43:23] "Joji - Die For You" | https://www.youtube.com/watch?v=kIEWJ1ljEro | length=211.901 | time=211.88292607114
[Sunday/March 05/03/2023 15:44:47] "Joji - Glimpse of Us (Official Video)" | https://www.youtube.com/watch?v=NgsWGfUlwJI | length=234.061 | time=75.142
[Sunday/March 05/03/2023 15:49:17] "JVKE - this is what heartbreak feels like (Official Lyric Video)" | https://www.youtube.com/watch?v=hrAwz6fHYgk | length=156.301 | time=14.181
[Sunday/March 05/03/2023 20:50:24] "JVKE - golden hour (official music video)" | https://www.youtube.com/watch?v=PEM0Vs8jf1w | length=231.681 | time=93.843
[Sunday/March 05/03/2023 20:53:18] "JVKE - golden hour (official music video)" | https://www.youtube.com/watch?v=PEM0Vs8jf1w | length=231.681 | time=231.65467021394
[Sunday/March 05/03/2023 20:58:29] "JVKE - this is what falling in love feels like (Official Video)" | https://www.youtube.com/watch?v=BOyO8sZOaOQ | length=154.681 | time=154.65732393646
[Sunday/March 05/03/2023 21:01:23] "JVKE - Greatest Songs Playlist 2022    // hud_trai" | https://www.youtube.com/watch?v=sRwnEZBlNWI | length=1510.561 | time=162.367
[Sunday/March 05/03/2023 21:05:29] "Halsey - Without Me" | https://www.youtube.com/watch?v=ZAfAud_M_mg | length=236.261 | time=236.24064422339
[Sunday/March 05/03/2023 21:06:31] "The Chainsmokers - Closer (Lyric) ft. Halsey" | https://www.youtube.com/watch?v=PT2_F-1esPk | length=261.821 | time=23.69
[Sunday/March 05/03/2023 21:11:37] "Ice Cube - It Was A Good Day" | https://www.youtube.com/watch?v=h4UqMyldS7Q | length=306.361 | time=255.797
[Sunday/March 05/03/2023 21:18:19] "21 Savage - a lot (Official Video) ft. J. Cole" | https://www.youtube.com/watch?v=DmWWqogr_r8 | length=391.661 | time=391.65199999993
[Sunday/March 05/03/2023 21:22:00] "The Weeknd Playlist" | https://www.youtube.com/watch?v=ZPXoyXYIU04 | length=2176.941 | time=202.19245200003
[Sunday/March 05/03/2023 21:27:42] "Official髭男dism - Pretender［Official Video］" | https://www.youtube.com/watch?v=TQ8WlA2GXbk | length=335.601 | time=326.59099999999
[Sunday/March 05/03/2023 21:29:30] "Gác Mái | GƯƠNG" | https://www.youtube.com/watch?v=m1_ftpDgxAM | length=278.021 | time=2.52
[Sunday/March 05/03/2023 21:30:03] "Gác Mái | GƯƠNG" | https://www.youtube.com/watch?v=m1_ftpDgxAM | length=278.021 | time=5.84
[Sunday/March 05/03/2023 21:31:36] "Gác Mái | GƯƠNG" | https://www.youtube.com/watch?v=m1_ftpDgxAM | length=278.021 | time=7.12
[Sunday/March 05/03/2023 21:33:04] "Official髭男dism - I LOVE...［Official Video］" | https://www.youtube.com/watch?v=bt8wNQJaKAk | length=288.481 | time=45.42
[Sunday/March 05/03/2023 21:34:04] "Official髭男dism - I LOVE...［Official Video］" | https://www.youtube.com/watch?v=bt8wNQJaKAk | length=288.481 | time=1.084
[Sunday/March 05/03/2023 21:42:54] "Official髭男dism - I LOVE...［Official Video］" | https://www.youtube.com/watch?v=bt8wNQJaKAk | length=288.481 | time=288.47014522551
[Sunday/March 05/03/2023 21:43:20] "Official髭男dism - Subtitle [Official Video]" | https://www.youtube.com/watch?v=hN5MBlGv2Ac | length=321.481 | time=19.937
[Sunday/March 05/03/2023 21:43:37] "【imase】NIGHT DANCER（MV）" | https://www.youtube.com/watch?v=kagoEGKHZvU | length=210.981 | time=7.508
[Sunday/March 05/03/2023 21:47:02] "【imase】NIGHT DANCER（MV）" | https://www.youtube.com/watch?v=kagoEGKHZvU | length=210.981 | time=210.96574147005
[Sunday/March 05/03/2023 21:47:43] "【Shinunoga E-Wa】15minutes  #shinunogaewa#fujiikaze" | https://www.youtube.com/watch?v=RY85ARdlIEc | length=924.621 | time=28.125
[Sunday/March 05/03/2023 21:51:31] "Fujii Kaze - Shinunoga E-Wa Live at Nippon Budokan (2020)" | https://www.youtube.com/watch?v=lRVJuPI5IXI | length=254.281 | time=16.141
[Sunday/March 05/03/2023 21:56:25] "Fujii Kaze - Matsuri Live at Panasonic Stadium Suita" | https://www.youtube.com/watch?v=fDg3PTQ1tzM | length=276.581 | time=21.48
[Sunday/March 05/03/2023 22:04:46] "OMG" | https://www.youtube.com/watch?v=2Kff0U8w-aU | length=212.261 | time=212.25414201158
[Sunday/March 05/03/2023 22:10:29] "Fujii Kaze -  Matsuri（Official Video）" | https://www.youtube.com/watch?v=NwOvu-j_WjY | length=249.281 | time=15.141
[Sunday/March 05/03/2023 22:18:08] "Fujii Kaze -  Matsuri（Official Video）" | https://www.youtube.com/watch?v=NwOvu-j_WjY | length=249.281 | time=249.2554371346
[Sunday/March 05/03/2023 22:19:53] "Fujii Kaze - Matsuri Live at Panasonic Stadium Suita" | https://www.youtube.com/watch?v=fDg3PTQ1tzM | length=276.581 | time=96.179
[Monday/March 06/03/2023 20:11:55] "【Shinunoga E-Wa】15minutes  #shinunogaewa#fujiikaze" | https://www.youtube.com/watch?v=RY85ARdlIEc | length=924.621 | time=336.90776416663
[Monday/March 06/03/2023 20:49:24] "Fujii Kaze - Shinunoga E-Wa (Visual)" | https://www.youtube.com/watch?v=dawrQnvwMTY | length=191.381 | time=1.71
[Monday/March 06/03/2023 21:25:46] C:\Users\SakuraFrost225\YNWA - @sportbible [1632675620365713409].mp4 | length=20.970333333333 | time=20.970666666667
[Monday/March 06/03/2023 22:20:25] "Fujii Kaze - Shinunoga E-Wa (Visual)" | https://www.youtube.com/watch?v=dawrQnvwMTY | length=191.381 | time=33.8281185
[Monday/March 06/03/2023 22:29:42] "Public Library Commute - Moonlight (Official Music Video)" | https://www.youtube.com/watch?v=Lg3jBRe4PMQ | length=218.401 | time=43.117195000001
[Tuesday/March 07/03/2023 00:21:46] "GREY D - dự báo thời tiết hôm nay mưa | official visualizer" | https://www.youtube.com/watch?v=heMYSOZoT3c | length=292.001 | time=88.814499999999
[Wednesday/March 08/03/2023 18:22:10] "chunklist_b5000000.m3u8" | https://vips-livecdn.fptplay.net/hda1/vtv1hd_vhls.smil/chunklist_b5000000.m3u8 | length=0 | time=693.79233333333
[Wednesday/March 08/03/2023 19:36:41] "Fujii Kaze - Shinunoga E-Wa Live at Nippon Budokan (2020)" | https://www.youtube.com/watch?v=lRVJuPI5IXI | length=254.281 | time=23.691
[Wednesday/March 08/03/2023 19:46:23] "Fujii Kaze - Shinunoga E-Wa (Visual)" | https://www.youtube.com/watch?v=dawrQnvwMTY | length=191.381 | time=191.36808051904
[Wednesday/March 08/03/2023 19:50:45] "Fujii Kaze - Shinunoga E-Wa Live at Nippon Budokan (2020)" | https://www.youtube.com/watch?v=lRVJuPI5IXI | length=254.281 | time=254.25931455065
[Wednesday/March 08/03/2023 19:55:26] "Fujii Kaze - Matsuri Live at Panasonic Stadium Suita" | https://www.youtube.com/watch?v=fDg3PTQ1tzM | length=276.581 | time=262.679
[Wednesday/March 08/03/2023 19:59:11] "Ditto" | https://www.youtube.com/watch?v=-g9I2neQR7w | length=185.521 | time=185.50747952683
[Wednesday/March 08/03/2023 20:07:30] "OMG" | https://www.youtube.com/watch?v=2Kff0U8w-aU | length=212.261 | time=210.84
[Wednesday/March 08/03/2023 20:11:17] "keshi - LIMBO (Lyric Video)" | https://www.youtube.com/watch?v=1i8WJ8cRWsE | length=214.161 | time=214.13523146712
[Wednesday/March 08/03/2023 20:41:19] "[Playlist] Keshi best song" | https://www.youtube.com/watch?v=RJIf6M6t0EM | length=1790.501 | time=1790.4915090465
[Wednesday/March 08/03/2023 20:56:15] "♫ a keshi playlist (42 songs) [GABRIEL update]" | https://www.youtube.com/watch?v=QAStDQ5Evw4 | length=7382.401 | time=2514.5785965418
[Wednesday/March 08/03/2023 21:00:25] "♫ a keshi playlist (42 songs) [GABRIEL update]" | https://www.youtube.com/watch?v=QAStDQ5Evw4 | length=7382.401 | time=2694.225
[Thursday/March 09/03/2023 09:28:01] "keshi - War With Heaven [For Shang-Chi Album] (Official Audio)" | https://www.youtube.com/watch?v=9jdReDQre38 | length=193.381 | time=174.716
[Thursday/March 09/03/2023 09:29:22] F:\Video\754451 THE ORAL CIGARETTES ReI played by ErogeMaster225.mp4 | length=176.6419921875 | time=163.18365885417
[Thursday/March 09/03/2023 09:29:29] F:\Wallpaper.Engine.v1.7.12\Game\projects\defaultprojects\2B.mp4 | length=213.71733333333 | time=93.159733333333
[Thursday/March 09/03/2023 09:30:25] F:\Video\754451 THE ORAL CIGARETTES ReI played by ErogeMaster225.mp4 | length=176.6419921875 | time=28.675
[Thursday/March 09/03/2023 09:31:05] F:\Video\754451 THE ORAL CIGARETTES ReI played by ErogeMaster225.mp4 | length=176.6419921875 | time=35.95
[Thursday/March 09/03/2023 09:32:11] "keshi - War With Heaven [For Shang-Chi Album] (Official Audio)" | https://www.youtube.com/watch?v=9jdReDQre38 | length=193.381 | time=128.295
[Friday/March 10/03/2023 18:44:59] "keshi - War With Heaven [For Shang-Chi Album] (Official Audio)" | https://www.youtube.com/watch?v=9jdReDQre38 | length=193.381 | time=193.36499769289
[Friday/March 10/03/2023 18:45:08] "keshi - LIMBO (Visualizer)" | https://www.youtube.com/watch?v=ssIiBm0ORuI | length=212.861 | time=0
[Friday/March 10/03/2023 18:54:03] "keshi - LIMBO (Visualizer)" | https://www.youtube.com/watch?v=ssIiBm0ORuI | length=212.861 | time=106.88
[Saturday/March 11/03/2023 11:27:06] C:\Users\SakuraFrost225\Downloads\kiyun-lee-zTG_J5nUKYI-unsplash.jpg | length=0 | time=0
[Saturday/March 11/03/2023 14:10:01] D:\Video\Seitokai Yakuindomo\4. Seitokai Yakuindomo Bleep OVA\Seitokai Yakuindomo Bleep - 17 (OVA).mkv | length=1506.517 | time=132.257
[Saturday/March 11/03/2023 15:12:57] F:\Video\2023-03-11 15-12-22.mp4 | length=4.3833333333333 | time=4.3666666666667
[Saturday/March 11/03/2023 15:12:57] F:\Video\2023-03-11 15-12-22.mp4 | length=4.3833333333333 | time=0
[Saturday/March 11/03/2023 22:35:26] C:\Users\SakuraFrost225\Downloads\Keshi - War With Heaven.flac | length=193.373333 | time=32.6143025
[Saturday/March 11/03/2023 22:42:13] C:\Users\SakuraFrost225\Downloads\Keshi - LIMBO.flac | length=212.784762 | time=186.42603516666
[Sunday/March 12/03/2023 11:22:40] D:\Video\Seitokai Yakuindomo\4. Seitokai Yakuindomo Bleep OVA\Seitokai Yakuindomo Bleep - 15 (OVA).mkv | length=1486.485 | time=19.478
[Sunday/March 12/03/2023 11:23:47] D:\Video\Seitokai Yakuindomo\4. Seitokai Yakuindomo Bleep OVA\Seitokai Yakuindomo Bleep - 17 (OVA).mkv | length=1506.517 | time=21.063
[Sunday/March 12/03/2023 11:29:46] D:\Video\Seitokai Yakuindomo\4. Seitokai Yakuindomo Bleep OVA\Seitokai Yakuindomo Bleep - 14 (OVA).mkv | length=1501.5 | time=81.480666666666
[Sunday/March 12/03/2023 11:58:02] D:\Video\Seitokai Yakuindomo\4. Seitokai Yakuindomo Bleep OVA\Seitokai Yakuindomo Bleep - 17 (OVA).mkv | length=1506.517 | time=17.45
[Sunday/March 12/03/2023 11:58:41] D:\Video\Seitokai Yakuindomo\4. Seitokai Yakuindomo Bleep OVA\Seitokai Yakuindomo Bleep - 14 (OVA).mkv | length=1501.5 | time=80.658666666666
[Sunday/March 12/03/2023 15:19:48] C:\Users\SakuraFrost225\Downloads\Public Library Commute - Brand New.flac | length=156.381451 | time=137.92
[Sunday/March 12/03/2023 15:20:15] C:\Users\SakuraFrost225\Downloads\Keshi - LIMBO.flac | length=212.784762 | time=1.279963
[Sunday/March 12/03/2023 21:53:23] D:\Video\Seitokai Yakuindomo\4. Seitokai Yakuindomo Bleep OVA\Seitokai Yakuindomo Bleep - 14 (OVA).mkv | length=1501.5 | time=23.148
[Sunday/March 12/03/2023 21:54:09] D:/Video/Seitokai Yakuindomo/4. Seitokai Yakuindomo Bleep OVA/Seitokai Yakuindomo Bleep - 14 (OVA).mkv | length=1501.5 | time=45.587
[Sunday/March 12/03/2023 21:54:55] C:\Users\SakuraFrost225\Videos\20221126-231029-danser_2022-11-26_23-08-13.20221126-231658.mp4 | length=102.82666666667 | time=139.81666666667
[Sunday/March 12/03/2023 21:55:29] C:\Users\SakuraFrost225\Downloads\Video\Facebook_30.mp4 | length=75.281904761905 | time=30.1
[Sunday/March 12/03/2023 21:57:01] C:\Users\SakuraFrost225\Downloads\Video\Facebook_30.mp4 | length=75.281904761905 | time=37.299877
[Sunday/March 12/03/2023 21:58:37] C:\Users\SakuraFrost225\Videos\20221126-231029-danser_2022-11-26_23-08-13.20221126-231658.mp4 | length=102.82666666667 | time=169.81722233335
[Sunday/March 12/03/2023 22:00:22] C:\Users\SakuraFrost225\Videos\20221126-231029-danser_2022-11-26_23-08-13.20221126-231658.mp4 | length=102.82666666667 | time=223.99066666666
[Monday/March 13/03/2023 15:14:55] C:\Users\SakuraFrost225\Downloads\Compressed\LeeHi - ONLY.flac | length=240.906667 | time=39.958246166667
[Monday/March 13/03/2023 20:49:56] C:\Users\SakuraFrost225\Downloads\Keshi - War With Heaven.flac | length=193.373333 | time=193.37310657596
[Monday/March 13/03/2023 20:53:37] C:\Users\SakuraFrost225\Downloads\Public Library Commute - Brand New.flac | length=156.381451 | time=156.38122803288
[Monday/March 13/03/2023 20:55:29] C:\Users\SakuraFrost225\Downloads\Public Library Commute - Moonlight.flac | length=191.249002 | time=112.08300683333
[Tuesday/March 14/03/2023 01:24:48] C:\Users\SakuraFrost225\Downloads\Keshi - 2 soon.flac | length=206.511723 | time=44.25
[Tuesday/March 14/03/2023 01:28:29] C:\Users\SakuraFrost225\Downloads\Keshi - LIMBO.flac | length=212.784762 | time=212.78454407596
[Tuesday/March 14/03/2023 01:30:34] C:\Users\SakuraFrost225\Downloads\Keshi - War With Heaven.flac | length=193.373333 | time=68.885229166667
[Tuesday/March 14/03/2023 09:53:19] C:\Users\SakuraFrost225\Downloads\Keshi - 2 soon.flac | length=206.511723 | time=0
[Tuesday/March 14/03/2023 10:24:29] F:\osu!\Songs\510859 Camellia - chrono diver -fragment- (Camellia's crossroads of chrono remix)\compressing mp3 causes timing shift.mp3 | length=323.108542 | time=312.40754613262
[Tuesday/March 14/03/2023 10:39:21] C:\Users\SakuraFrost225\Downloads\Keshi - 2 soon.flac | length=206.511723 | time=81.949002267573
[Tuesday/March 14/03/2023 10:46:08] C:\Users\SakuraFrost225\Downloads\Video\336368216_199146256050458_5605725136922617032_n.mp4 | length=9.513375 | time=3.4666666666667
[Tuesday/March 14/03/2023 20:58:38] C:\Users\SakuraFrost225\Downloads\Compressed\LeeHi - ONLY.flac | length=240.906667 | time=240.90643990929
[Tuesday/March 14/03/2023 20:58:38] C:\Users\SakuraFrost225\Downloads\Compressed\Yuji - Old Love.flac | length=249.382313 | time=0
[Tuesday/March 14/03/2023 21:16:19] C:\Users\SakuraFrost225\Downloads\Compressed\Yuji - Old Love.flac | length=249.382313 | time=249.38210657595
[Tuesday/March 14/03/2023 22:05:20] C:\Users\SakuraFrost225\Downloads\Public Library Commute - Moonlight.flac | length=191.249002 | time=191.24879407596
[Tuesday/March 14/03/2023 22:05:20] C:\Users\SakuraFrost225\Downloads\Public Library Commute - Moonlight.flac | length=191.249002 | time=0
[Wednesday/March 15/03/2023 11:45:01] D:\Torrent\Atelier\A20 - Atelier Lulua The Scion of Arland\[2019.03.20] Atelier Lulua ~The Scion of Arland~ Original Soundtrack [KECH-8078~80]\Disc 1\31. Kazuki Yanagawa - 長い夜に.flac | length=86.133333 | time=6.730646
[Wednesday/March 15/03/2023 11:45:06] D:\Torrent\Atelier\A20 - Atelier Lulua The Scion of Arland\[2019.03.20] Atelier Lulua ~The Scion of Arland~ Original Soundtrack [KECH-8078~80]\Disc 1\30. Kazuki Yanagawa - 習得しちゃお！.flac | length=31.853333 | time=5.180842
[Wednesday/March 15/03/2023 12:06:16] F:\osu!\Songs\1635918 zts - discolor\audio.mp3 | length=344.304 | time=344.27999985829
[Wednesday/March 15/03/2023 13:20:57] F:\osu!\Songs\1635918 zts - discolor\audio.mp3 | length=344.304 | time=321.38876002495
[Thursday/March 16/03/2023 21:50:22] D:\Torrent\[audio.hauu.net] Code ZTS Label 1.0 (part2 flac)\[2011.12.31] Umineko no Naku Koro ni Chiru musicbox Red (C81)\12 - lastendconductor.flac | length=650.133333 | time=645.1463664966
[Thursday/March 16/03/2023 21:56:20] D:\Torrent\[audio.hauu.net] Code ZTS Label 1.0 (part2 flac)\[2011.12.31] Umineko no Naku Koro ni Chiru musicbox Red (C81)\11 - discolor.flac | length=344.826667 | time=344.82643990928
[Thursday/March 16/03/2023 22:01:19] D:\Torrent\[audio.hauu.net] Code ZTS Label 1.0 (part2 flac)\[2011.12.31] Umineko no Naku Koro ni Chiru musicbox Red (C81)\12 - lastendconductor.flac | length=650.133333 | time=650.1331189059
[Thursday/March 16/03/2023 22:08:00] "Ariana Grande - positions (official video)" | https://www.youtube.com/watch?v=tcYodQoapMg | length=177.541 | time=177.517368816
[Thursday/March 16/03/2023 22:11:48] "Ariana Grande - 34+35 (official video)" | https://www.youtube.com/watch?v=B6_iQvaIjXw | length=220.781 | time=220.76455538701
[Thursday/March 16/03/2023 22:13:18] "She BETRAYED ME in Roblox Sacrifice Sanctuary!" | https://www.youtube.com/watch?v=sASYJsN9Y3Y | length=1980.941 | time=50.6
[Friday/March 17/03/2023 17:18:41] "[🔴LIVE] KDF vs KT - BRO vs NS | 2023 LCK Spring Split 2023-03-17 16:57" | https://www.youtube.com/watch?v=1gAVLwmcCaY | length=0 | time=1296.7133888889
[Saturday/March 18/03/2023 22:57:18] "Public Library Commute - Moonlight (Official Music Video)" | https://www.youtube.com/watch?v=Lg3jBRe4PMQ | length=218.401 | time=218.38447364178
[Saturday/March 18/03/2023 22:57:41] C:\ytdl\Public_Library_Commute_-_Summertime_Official_Video-X_t1UmyvqN8.mkv | length=177.886 | time=94.928
[Saturday/March 18/03/2023 22:57:51] C:\ytdl\Public_Library_Commute_-_Summertime_Official_Video-X_t1UmyvqN8.mkv | length=177.886 | time=4.296
[Saturday/March 18/03/2023 22:58:01] C:\ytdl\Public_Library_Commute_-_Summertime_Official_Video-X_t1UmyvqN8.mkv | length=177.886 | time=0
[Saturday/March 18/03/2023 23:01:13] "Ariana Grande - pov (audio)" | https://www.youtube.com/watch?v=nQJEp-k-ogs | length=202.881 | time=157.532
[Saturday/March 18/03/2023 23:23:50] C:\Users\SakuraFrost225\Downloads\Music\Conan Gray - Astronomy.flac | length=243.907166 | time=243.90693990929
[Saturday/March 18/03/2023 23:44:23] C:\ytdl\The_Weeknd_Ariana_Grande_-_Die_For_You_Remix_Official_Lyric_Video-YQ-qToZUybM.mkv | length=232.933 | time=232.94342517267
[Saturday/March 18/03/2023 23:44:26] C:\ytdl\The_Weeknd_Ariana_Grande_-_Die_For_You_Remix_Official_Lyric_Video-YQ-qToZUybM.mkv | length=232.933 | time=0
[Saturday/March 18/03/2023 23:52:46] "Ariana Grande - pov (audio)" | https://www.youtube.com/watch?v=nQJEp-k-ogs | length=202.881 | time=202.87355984951
[Saturday/March 18/03/2023 23:58:17] "♫ danielions' best of 2020 - underground korean r&b (30 songs)" | https://www.youtube.com/watch?v=lHddo9UUdi4 | length=5522.701 | time=18.519
[Saturday/March 18/03/2023 23:59:25] C:\ytdl\danielions_best_of_2020_-_underground_korean_r_b_30_songs-lHddo9UUdi4.mkv | length=5522.684 | time=9.776
[Sunday/March 19/03/2023 00:01:40] "♫ Public Library Commute playlist (9 songs)" | https://www.youtube.com/watch?v=NoBVzVOgRTg | length=1601.461 | time=196.63
[Sunday/March 19/03/2023 00:02:07] "♫ danielions' best of 2020 - underground korean r&b (30 songs)" | https://www.youtube.com/watch?v=lHddo9UUdi4 | length=5522.701 | time=4457.901986173
[Sunday/March 19/03/2023 00:19:16] "♫ Public Library Commute playlist (9 songs)" | https://www.youtube.com/watch?v=NoBVzVOgRTg | length=1601.461 | time=1011.277
[Sunday/March 19/03/2023 00:21:23] "♫ Public Library Commute playlist (9 songs)" | https://www.youtube.com/watch?v=NoBVzVOgRTg | length=1601.461 | time=1059.358
[Sunday/March 19/03/2023 00:25:23] C:\ytdl\bho2Y1thfiA-danielions_Best_of_2016_-_K-Indie_happy.mkv | length=5461.423 | time=239.038
[Sunday/March 19/03/2023 00:29:46] C:\ytdl\M7Lr3ujt4Ro-Why_Did_I_Promise_To_Build_This.mkv | length=8502.06 | time=64.064
[Sunday/March 19/03/2023 00:50:03] "I Bought the Last One Apple Ever Made..." | https://www.youtube.com/watch?v=eFnj7LvhvR4 | length=1144.921 | time=160.461
[Sunday/March 19/03/2023 00:51:13] "I Bought the Last One Apple Ever Made..." | https://www.youtube.com/watch?v=eFnj7LvhvR4 | length=1144.921 | time=2.002
[Sunday/March 19/03/2023 00:51:14] "I Bought the Last One Apple Ever Made..." | https://www.youtube.com/watch?v=eFnj7LvhvR4 | length=1144.921 | time=0
[Sunday/March 19/03/2023 00:59:15] "Brand New" | https://www.youtube.com/watch?v=OsYJWLaq9UI | length=156.401 | time=6.52
[Sunday/March 19/03/2023 01:00:12] "Brand New" | https://www.youtube.com/watch?v=OsYJWLaq9UI | length=156.401 | time=9.56
[Sunday/March 19/03/2023 01:02:55] C:\ytdl\b0fmZ7oMDeY-Mile High.mkv | length=209.08 | time=16.32
[Sunday/March 19/03/2023 01:03:22] C:\ytdl\no251xmDUZA-No One Like You.mkv | length=170.92 | time=26
[Sunday/March 19/03/2023 01:03:49] "Brand New" | https://www.youtube.com/watch?v=OsYJWLaq9UI | length=156.401 | time=7.44
[Sunday/March 19/03/2023 01:04:13] C:\ytdl\b0fmZ7oMDeY-Mile High.mkv | length=209.08 | time=23.44
[Sunday/March 19/03/2023 01:04:14] C:\ytdl\b0fmZ7oMDeY-Mile High.mkv | length=209.08 | time=0
[Monday/March 20/03/2023 21:05:21] C:\Users\SakuraFrost225\Videos\Keshi - War With Heaven.opus | length=193.379833 | time=0
[Monday/March 20/03/2023 21:11:26] C:\Users\SakuraFrost225\Videos\Keshi - War With Heaven.opus | length=193.379833 | time=193.37333333336
[Monday/March 20/03/2023 22:18:09] "Paying for 4K Video is DUMB" | https://www.youtube.com/watch?v=i_oLsQfRfOc | length=1030.221 | time=267.901
[Monday/March 20/03/2023 22:24:53] "Paying for 4K Video is DUMB" | https://www.youtube.com/watch?v=i_oLsQfRfOc | length=1030.221 | time=272.071
[Monday/March 20/03/2023 22:30:05] "Paying for 4K Video is DUMB" | https://www.youtube.com/watch?v=i_oLsQfRfOc | length=1030.221 | time=565.698
[Tuesday/March 21/03/2023 08:55:10] D:\Torrent\[audio.hauu.net] Code ZTS Label 1.0 (part2 flac)\[2007.03.23] Selfregards 2\01 - The Mom.flac | length=247.04 | time=1.699839
[Saturday/March 25/03/2023 20:27:14] D:\Torrent\Atelier\A22 - Atelier Ryza 2 Lost Legends & the Secret Fairy\[2020-12-02] Atelier Ryza 2 Lost Legends & the Secret Fairy Original Soundtrack\Disc 2\25 ''wish''.flac | length=419.733333 | time=163.13999999999
[Monday/March 27/03/2023 10:35:53] D:\Windows.old\Users\BOSS\Pictures\giphy_waifu2x_1920x1080_2n_waifu2x_2x_2n.gif | length=1.44 | time=0.72
[Monday/March 27/03/2023 10:36:00] D:\Windows.old\Users\BOSS\Pictures\giphy_waifu2x_1920x1080_2n_waifu2x_1x_3n.gif | length=1.44 | time=0
[Monday/March 27/03/2023 10:39:53] E:\Windows.old\Users\BOSS\Videos\output-120fps-resampled.mp4 | length=191.4485260771 | time=191.44831490933
[Monday/March 27/03/2023 10:56:06] D:\Torrent\Atelier\A22 - Atelier Ryza 2 Lost Legends & the Secret Fairy\[2020-12-02] Atelier Ryza 2 Lost Legends & the Secret Fairy Original Soundtrack\Disc 1\08 よし、じゃあ始めるよ.flac | length=56 | time=16.12138
[Monday/March 27/03/2023 11:02:55] D:\Torrent\Atelier\A22 - Atelier Ryza 2 Lost Legends & the Secret Fairy\[2020-12-02] Atelier Ryza 2 Lost Legends & the Secret Fairy Original Soundtrack\Disc 1\05 その腕の先に～from願いと大剣～.flac | length=100.68 | time=20.941350333333
[Monday/March 27/03/2023 11:48:13] D:\Torrent\Atelier\A22 - Atelier Ryza 2 Lost Legends & the Secret Fairy\[2020-12-02] Atelier Ryza 2 Lost Legends & the Secret Fairy Original Soundtrack\Disc 1\05 その腕の先に～from願いと大剣～.flac | length=100.68 | time=91.222379999998
[Monday/March 27/03/2023 12:52:29] D:\Torrent\Atelier\A22 - Atelier Ryza 2 Lost Legends & the Secret Fairy\[2020-12-02] Atelier Ryza 2 Lost Legends & the Secret Fairy Original Soundtrack\Disc 1\16 迫りくる足音.flac | length=90.28 | time=21.83
[Monday/March 27/03/2023 20:16:38] D:\Torrent\Atelier\A22 - Atelier Ryza 2 Lost Legends & the Secret Fairy\[2020-12-02] Atelier Ryza 2 Lost Legends & the Secret Fairy Original Soundtrack\Disc 1\10 王都の賑わい.flac | length=108.106667 | time=108.10645833333
[Monday/March 27/03/2023 20:16:52] D:\Torrent\Atelier\A22 - Atelier Ryza 2 Lost Legends & the Secret Fairy\[2020-12-02] Atelier Ryza 2 Lost Legends & the Secret Fairy Original Soundtrack\Disc 1\11 ひとやすみ.flac | length=14.24 | time=14.239791666667
[Monday/March 27/03/2023 20:18:25] D:\Torrent\Atelier\A22 - Atelier Ryza 2 Lost Legends & the Secret Fairy\[2020-12-02] Atelier Ryza 2 Lost Legends & the Secret Fairy Original Soundtrack\Disc 1\12 今日も晴れです!.flac | length=92.76 | time=92.759791666665
[Monday/March 27/03/2023 20:19:55] D:\Torrent\Atelier\A22 - Atelier Ryza 2 Lost Legends & the Secret Fairy\[2020-12-02] Atelier Ryza 2 Lost Legends & the Secret Fairy Original Soundtrack\Disc 1\13 少し高い空の下.flac | length=90.226667 | time=90.226458333332
[Monday/March 27/03/2023 20:21:24] D:\Torrent\Atelier\A22 - Atelier Ryza 2 Lost Legends & the Secret Fairy\[2020-12-02] Atelier Ryza 2 Lost Legends & the Secret Fairy Original Soundtrack\Disc 1\14 のんびりしてもいいよね.flac | length=87.986667 | time=87.986458333332
[Monday/March 27/03/2023 20:23:04] D:\Torrent\Atelier\A22 - Atelier Ryza 2 Lost Legends & the Secret Fairy\[2020-12-02] Atelier Ryza 2 Lost Legends & the Secret Fairy Original Soundtrack\Disc 1\15 淡い夕日.flac | length=100.68 | time=100.67979166666
[Monday/March 27/03/2023 20:24:36] D:\Torrent\Atelier\A22 - Atelier Ryza 2 Lost Legends & the Secret Fairy\[2020-12-02] Atelier Ryza 2 Lost Legends & the Secret Fairy Original Soundtrack\Disc 1\16 迫りくる足音.flac | length=90.28 | time=90.279791666665
[Monday/March 27/03/2023 20:26:39] D:\Torrent\Atelier\A22 - Atelier Ryza 2 Lost Legends & the Secret Fairy\[2020-12-02] Atelier Ryza 2 Lost Legends & the Secret Fairy Original Soundtrack\Disc 1\17 夢境.flac | length=122.32 | time=122.31979166666
[Monday/March 27/03/2023 20:28:25] D:\Torrent\Atelier\A22 - Atelier Ryza 2 Lost Legends & the Secret Fairy\[2020-12-02] Atelier Ryza 2 Lost Legends & the Secret Fairy Original Soundtrack\Disc 1\18 泥濘.flac | length=106.32 | time=106.31979166666
[Monday/March 27/03/2023 20:30:07] D:\Torrent\Atelier\A22 - Atelier Ryza 2 Lost Legends & the Secret Fairy\[2020-12-02] Atelier Ryza 2 Lost Legends & the Secret Fairy Original Soundtrack\Disc 1\19 その目の先に映るのは.flac | length=101.533333 | time=101.533125
[Monday/March 27/03/2023 20:31:24] D:\Torrent\Atelier\A22 - Atelier Ryza 2 Lost Legends & the Secret Fairy\[2020-12-02] Atelier Ryza 2 Lost Legends & the Secret Fairy Original Soundtrack\Disc 1\20 危機と焦り.flac | length=76.8 | time=76.799791666667
[Monday/March 27/03/2023 20:32:42] D:\Torrent\Atelier\A22 - Atelier Ryza 2 Lost Legends & the Secret Fairy\[2020-12-02] Atelier Ryza 2 Lost Legends & the Secret Fairy Original Soundtrack\Disc 1\21 小石がなくても躓くの.flac | length=78.24 | time=78.239791666667
[Monday/March 27/03/2023 20:34:40] D:\Torrent\Atelier\A22 - Atelier Ryza 2 Lost Legends & the Secret Fairy\[2020-12-02] Atelier Ryza 2 Lost Legends & the Secret Fairy Original Soundtrack\Disc 1\22 新たなる冒険の拠点.flac | length=117.346667 | time=117.34645833333
[Monday/March 27/03/2023 20:36:47] D:\Torrent\Atelier\A22 - Atelier Ryza 2 Lost Legends & the Secret Fairy\[2020-12-02] Atelier Ryza 2 Lost Legends & the Secret Fairy Original Soundtrack\Disc 1\23 石畳にはずむステップ.flac | length=127.906667 | time=127.90645833333
[Monday/March 27/03/2023 20:39:17] D:\Torrent\Atelier\A22 - Atelier Ryza 2 Lost Legends & the Secret Fairy\[2020-12-02] Atelier Ryza 2 Lost Legends & the Secret Fairy Original Soundtrack\Disc 1\24 街灯りは揺らめいて.flac | length=149.68 | time=149.67979166666
[Monday/March 27/03/2023 20:41:31] D:\Torrent\Atelier\A22 - Atelier Ryza 2 Lost Legends & the Secret Fairy\[2020-12-02] Atelier Ryza 2 Lost Legends & the Secret Fairy Original Soundtrack\Disc 1\25 海風を背に受けて.flac | length=134.026667 | time=134.02645833333
[Monday/March 27/03/2023 20:43:55] D:\Torrent\Atelier\A22 - Atelier Ryza 2 Lost Legends & the Secret Fairy\[2020-12-02] Atelier Ryza 2 Lost Legends & the Secret Fairy Original Soundtrack\Disc 1\26 星空の大地.flac | length=143.453333 | time=143.45312499999
[Monday/March 27/03/2023 20:45:50] D:\Torrent\Atelier\A22 - Atelier Ryza 2 Lost Legends & the Secret Fairy\[2020-12-02] Atelier Ryza 2 Lost Legends & the Secret Fairy Original Soundtrack\Disc 1\27 木々の距離ほど近く.flac | length=115.173333 | time=115.173125
[Monday/March 27/03/2023 20:48:06] D:\Torrent\Atelier\A22 - Atelier Ryza 2 Lost Legends & the Secret Fairy\[2020-12-02] Atelier Ryza 2 Lost Legends & the Secret Fairy Original Soundtrack\Disc 1\28 星々の距離ほど遠く.flac | length=135.52 | time=135.51979166666
[Monday/March 27/03/2023 20:50:20] D:\Torrent\Atelier\A22 - Atelier Ryza 2 Lost Legends & the Secret Fairy\[2020-12-02] Atelier Ryza 2 Lost Legends & the Secret Fairy Original Soundtrack\Disc 1\29 Deep Forest Daylight.flac | length=134.24 | time=134.23979166666
[Monday/March 27/03/2023 20:52:38] D:\Torrent\Atelier\A22 - Atelier Ryza 2 Lost Legends & the Secret Fairy\[2020-12-02] Atelier Ryza 2 Lost Legends & the Secret Fairy Original Soundtrack\Disc 1\30 Deep Forest Night.flac | length=136.84 | time=136.83979166666
[Monday/March 27/03/2023 20:58:09] D:\Torrent\Atelier\A22 - Atelier Ryza 2 Lost Legends & the Secret Fairy\[2020-12-02] Atelier Ryza 2 Lost Legends & the Secret Fairy Original Soundtrack\Disc 1\31 芒種、鼠黐の薫風.flac | length=331.52 | time=331.51979166664
[Monday/March 27/03/2023 21:01:56] D:\Torrent\Atelier\A22 - Atelier Ryza 2 Lost Legends & the Secret Fairy\[2020-12-02] Atelier Ryza 2 Lost Legends & the Secret Fairy Original Soundtrack\Disc 1\32 It's all uphill from here.flac | length=226.893333 | time=226.89312499998
[Monday/March 27/03/2023 21:50:38] D:\Torrent\Atelier\A22 - Atelier Ryza 2 Lost Legends & the Secret Fairy\[2020-12-02] Atelier Ryza 2 Lost Legends & the Secret Fairy Original Soundtrack\Disc 1\33 勝利の記憶.flac | length=47.471844 | time=47.471635416667
[Monday/March 27/03/2023 21:58:29] D:\Torrent\Atelier\A22 - Atelier Ryza 2 Lost Legends & the Secret Fairy\[2020-12-02] Atelier Ryza 2 Lost Legends & the Secret Fairy Original Soundtrack\Disc 1\02 新しい大冒険～fromひと夏の大冒険～.flac | length=147.28 | time=147.27979166666
[Monday/March 27/03/2023 22:00:22] D:\Torrent\Atelier\A22 - Atelier Ryza 2 Lost Legends & the Secret Fairy\[2020-12-02] Atelier Ryza 2 Lost Legends & the Secret Fairy Original Soundtrack\Disc 1\03 未知への冒険～fromソラミミ～.flac | length=112.96 | time=112.95979166666
[Monday/March 27/03/2023 22:02:20] D:\Torrent\Atelier\A22 - Atelier Ryza 2 Lost Legends & the Secret Fairy\[2020-12-02] Atelier Ryza 2 Lost Legends & the Secret Fairy Original Soundtrack\Disc 1\04 光と風の音色～from銀の音さやか～.flac | length=118.386667 | time=118.38645833333
[Monday/March 27/03/2023 22:04:01] D:\Torrent\Atelier\A22 - Atelier Ryza 2 Lost Legends & the Secret Fairy\[2020-12-02] Atelier Ryza 2 Lost Legends & the Secret Fairy Original Soundtrack\Disc 1\05 その腕の先に～from願いと大剣～.flac | length=100.68 | time=100.67979166666
[Monday/March 27/03/2023 22:06:02] D:\Torrent\Atelier\A22 - Atelier Ryza 2 Lost Legends & the Secret Fairy\[2020-12-02] Atelier Ryza 2 Lost Legends & the Secret Fairy Original Soundtrack\Disc 1\06 知への探求心～from透明な栞～.flac | length=120.973333 | time=120.973125
[Monday/March 27/03/2023 22:06:11] D:\Torrent\Atelier\A22 - Atelier Ryza 2 Lost Legends & the Secret Fairy\[2020-12-02] Atelier Ryza 2 Lost Legends & the Secret Fairy Original Soundtrack\Disc 1\07 あの夏の思い出.flac | length=9.24 | time=9.2397916666667
[Monday/March 27/03/2023 22:07:07] D:\Torrent\Atelier\A22 - Atelier Ryza 2 Lost Legends & the Secret Fairy\[2020-12-02] Atelier Ryza 2 Lost Legends & the Secret Fairy Original Soundtrack\Disc 1\08 よし、じゃあ始めるよ.flac | length=56 | time=55.999791666668
[Monday/March 27/03/2023 22:08:11] D:\Torrent\Atelier\A22 - Atelier Ryza 2 Lost Legends & the Secret Fairy\[2020-12-02] Atelier Ryza 2 Lost Legends & the Secret Fairy Original Soundtrack\Disc 1\09 なるほど、なるほどなー.flac | length=63.84 | time=63.839791666668
[Monday/March 27/03/2023 22:09:35] D:\Torrent\Atelier\A22 - Atelier Ryza 2 Lost Legends & the Secret Fairy\[2020-12-02] Atelier Ryza 2 Lost Legends & the Secret Fairy Original Soundtrack\Disc 1\10 王都の賑わい.flac | length=108.106667 | time=83.420085999999
[Wednesday/March 29/03/2023 10:05:40] D:\Torrent\Atelier\A22 - Atelier Ryza 2 Lost Legends & the Secret Fairy\[2020-12-02] Atelier Ryza 2 Lost Legends & the Secret Fairy Original Soundtrack\Disc 1\02 新しい大冒険～fromひと夏の大冒険～.flac | length=147.28 | time=3.024229
[Wednesday/March 29/03/2023 10:11:02] D:\Torrent\Atelier\A22 - Atelier Ryza 2 Lost Legends & the Secret Fairy\[2020-12-02] Atelier Ryza 2 Lost Legends & the Secret Fairy Original Soundtrack\Disc 1\01 Somewhen, Somewhere....flac | length=321.99825 | time=321.99804166664
[Wednesday/March 29/03/2023 10:11:22] D:\Torrent\Atelier\A22 - Atelier Ryza 2 Lost Legends & the Secret Fairy\[2020-12-02] Atelier Ryza 2 Lost Legends & the Secret Fairy Original Soundtrack\Disc 1\02 新しい大冒険～fromひと夏の大冒険～.flac | length=147.28 | time=19.19
[Wednesday/March 29/03/2023 21:11:52] C:\Users\SakuraFrost225\Downloads\Music\Jeremy Zucker - scared.flac | length=207.52 | time=185.60257266666
[Thursday/March 30/03/2023 12:52:21] C:\Users\SakuraFrost225\Downloads\Music\Rex Orange County - Television - So Far So Good.flac | length=262.6 | time=145.32097916666
[Thursday/March 30/03/2023 18:53:39] F:\Video\712974 Fractal Dreamers Fortuna Redux.mp4 | length=252.25 | time=243.01666666667
[Thursday/March 30/03/2023 22:09:53] C:\Users\SakuraFrost225\Downloads\Music\Jeremy Zucker - all the kids are depressed.flac | length=169.973333 | time=13.960161333333
[Thursday/March 30/03/2023 23:45:53] C:\Users\SakuraFrost225\Downloads\Music\Jeremy Zucker - comethru.flac | length=181.613333 | time=128.2043855
[Friday/March 31/03/2023 09:32:08] C:\Users\SakuraFrost225\Downloads\Music\Keshi - 2 soon.flac | length=206.511723 | time=60.566166666667
[Friday/March 31/03/2023 15:45:47] C:\Users\SakuraFrost225\Downloads\Music\Jeremy Zucker - comethru.flac | length=181.613333 | time=174.57483299999
[Friday/March 31/03/2023 15:45:55] C:\Users\SakuraFrost225\Downloads\Music\Jeremy Zucker - scared.flac | length=207.52 | time=7.260457
[Friday/March 31/03/2023 17:04:04] C:\Users\SakuraFrost225\Downloads\Music\LeeHi - ONLY.flac | length=240.906667 | time=238.18350099999
[Friday/March 31/03/2023 20:24:13] C:\Users\SakuraFrost225\Downloads\Music\Henry Moodie - drunk text.flac | length=187.263152 | time=3.359989
[Friday/March 31/03/2023 21:30:59] C:\Users\SakuraFrost225\Downloads\Music\Public Library Commute - Brand New.flac | length=156.381451 | time=86.949999999999
[Friday/March 31/03/2023 21:49:04] C:\Users\SakuraFrost225\Downloads\Music\Public Library Commute - Brand New.flac | length=156.381451 | time=151.566647
[Friday/March 31/03/2023 21:52:21] C:\Users\SakuraFrost225\Downloads\Music\Jeremy Zucker - all the kids are depressed.flac | length=169.973333 | time=8.94845
[Friday/March 31/03/2023 23:16:57] C:\Users\SakuraFrost225\Downloads\Music\Henry Moodie - drunk text.flac | length=187.263152 | time=8.6524568333333
[Saturday/April 01/04/2023 17:57:46] C:\Users\SakuraFrost225\Downloads\Music\Public Library Commute - Moonlight.flac | length=191.249002 | time=55.913916666667
[Sunday/April 02/04/2023 18:56:50] "chunklist_b5000000.m3u8" | https://vips-livecdn.fptplay.net/hda1/vtv1hd_vhls.smil/chunklist_b5000000.m3u8 | length=0 | time=1432.6733333333
[Monday/April 03/04/2023 18:26:46] C:\Users\SakuraFrost225\Downloads\Music\LeeHi - ONLY.flac | length=240.906667 | time=240.90643990929
[Monday/April 03/04/2023 18:30:47] C:\Users\SakuraFrost225\Downloads\Music\Protostar - Galaxies.flac | length=240 | time=239.99977324262
[Monday/April 03/04/2023 18:33:23] C:\Users\SakuraFrost225\Downloads\Music\Public Library Commute - Brand New.flac | length=156.381451 | time=156.38123157596
[Monday/April 03/04/2023 18:36:35] C:\Users\SakuraFrost225\Downloads\Music\Public Library Commute - Moonlight.flac | length=191.249002 | time=191.24879407596
[Monday/April 03/04/2023 21:38:06] C:\Users\SakuraFrost225\Downloads\Music\Rex Orange County - Pluto Projector.flac | length=267.52 | time=267.51977324262
[Monday/April 03/04/2023 21:42:28] C:\Users\SakuraFrost225\Downloads\Music\Rex Orange County - Television - So Far So Good.flac | length=262.6 | time=262.59977324262
[Monday/April 03/04/2023 23:16:20] C:\Users\SakuraFrost225\Downloads\Music\FINNEAS - Let-'s Fall in Love for the Night.flac | length=190.348413 | time=190.34818990929
[Monday/April 03/04/2023 23:19:27] C:\Users\SakuraFrost225\Downloads\Music\Henry Moodie - drunk text.flac | length=187.263152 | time=187.26293990929
[Monday/April 03/04/2023 23:22:17] C:\Users\SakuraFrost225\Downloads\Music\Jeremy Zucker - all the kids are depressed.flac | length=169.973333 | time=169.97310657597
[Monday/April 03/04/2023 23:25:19] C:\Users\SakuraFrost225\Downloads\Music\Jeremy Zucker - comethru.flac | length=181.613333 | time=181.61310657596
[Monday/April 03/04/2023 23:28:46] C:\Users\SakuraFrost225\Downloads\Music\Jeremy Zucker - scared.flac | length=207.52 | time=207.51977324262
[Monday/April 03/04/2023 23:32:13] C:\Users\SakuraFrost225\Downloads\Music\Keshi - 2 soon.flac | length=206.511723 | time=206.51150240929
[Monday/April 03/04/2023 23:35:46] C:\Users\SakuraFrost225\Downloads\Music\Keshi - LIMBO.flac | length=212.784762 | time=212.78454407596
[Monday/April 03/04/2023 23:39:00] C:\Users\SakuraFrost225\Downloads\Music\Keshi - War With Heaven.flac | length=193.373333 | time=193.37310657596
[Monday/April 03/04/2023 23:40:46] C:\Users\SakuraFrost225\Downloads\Music\LeeHi - ONLY.flac | length=240.906667 | time=105.390612
[Tuesday/April 04/04/2023 20:24:00] C:\Users\SakuraFrost225\Downloads\Music\Yuji - Old Love.flac | length=249.382313 | time=35.3833515
[Tuesday/April 04/04/2023 20:41:10] C:\Users\SakuraFrost225\Downloads\Music\Vũ. - Bước Qua Nhau.flac | length=257.647052 | time=257.64683574262
[Tuesday/April 04/04/2023 20:41:11] C:\Users\SakuraFrost225\Downloads\Music\Yuji - Old Love.flac | length=249.382313 | time=0
[Tuesday/April 04/04/2023 20:41:13] C:\Users\SakuraFrost225\Downloads\Music\Yuji - Old Love.flac | length=249.382313 | time=2.070305
[Tuesday/April 04/04/2023 20:42:41] C:\Users\SakuraFrost225\Downloads\Music\Vũ. - Bước Qua Nhau.flac | length=257.647052 | time=69.2664835
[Wednesday/April 05/04/2023 13:26:23] C:\Users\SakuraFrost225\Downloads\Music\Vũ. - Bước Qua Nhau.flac | length=257.647052 | time=167.85051499999
[Thursday/April 06/04/2023 23:04:02] D:\flac\Yuji - Old Love.flac | length=249.382313 | time=38.312332047619
[Friday/April 07/04/2023 08:44:37] D:\flac\Rex Orange County - Television - So Far So Good.flac | length=262.6 | time=7.9168
[Friday/April 07/04/2023 09:17:29] D:\flac\Jeremy Zucker - comethru.flac | length=181.613333 | time=77.38
[Friday/April 07/04/2023 21:20:48] D:\flac\Conan Gray - Astronomy.flac | length=243.907166 | time=243.90693990929
[Friday/April 07/04/2023 21:23:59] D:\flac\FINNEAS - Let-'s Fall in Love for the Night.flac | length=190.348413 | time=190.34818990929
[Friday/April 07/04/2023 23:28:22] D:\flac\Public Library Commute - Moonlight.flac | length=191.249002 | time=110.94
[Saturday/April 08/04/2023 10:19:12] D:\flac\Henry Moodie - drunk text.flac | length=187.263152 | time=187.26293990929
[Saturday/April 08/04/2023 10:22:02] D:\flac\Jeremy Zucker - all the kids are depressed.flac | length=169.973333 | time=169.97310657597
[Saturday/April 08/04/2023 10:25:04] D:\flac\Jeremy Zucker - comethru.flac | length=181.613333 | time=181.61310657596
[Saturday/April 08/04/2023 10:28:32] D:\flac\Jeremy Zucker - scared.flac | length=207.52 | time=207.51977324262
[Saturday/April 08/04/2023 10:32:00] D:\flac\Keshi - 2 soon.flac | length=206.511723 | time=206.51150240929
[Saturday/April 08/04/2023 10:35:33] D:\flac\Keshi - LIMBO.flac | length=212.784762 | time=212.78454407596
[Saturday/April 08/04/2023 10:38:47] D:\flac\Keshi - War With Heaven.flac | length=193.373333 | time=193.37310657596
[Saturday/April 08/04/2023 10:42:49] D:\flac\LeeHi - ONLY.flac | length=240.906667 | time=240.90643990929
[Saturday/April 08/04/2023 11:49:46] D:\flac\Rex Orange County - Television - So Far So Good.flac | length=262.6 | time=262.59977324262
[Saturday/April 08/04/2023 21:12:40] D:\flac\Protostar - Galaxies.flac | length=240 | time=239.99977324262
[Saturday/April 08/04/2023 21:15:17] D:\flac\Public Library Commute - Brand New.flac | length=156.381451 | time=156.38123157596
[Saturday/April 08/04/2023 22:13:29] D:\flac\Public Library Commute - Moonlight.flac | length=191.249002 | time=191.24879407596
[Saturday/April 08/04/2023 22:17:56] D:\flac\Rex Orange County - Pluto Projector.flac | length=267.52 | time=267.51977324262
[Sunday/April 09/04/2023 00:26:39] D:\flac\Rex Orange County - Television - So Far So Good.flac | length=262.6 | time=254.68999999999
[Sunday/April 09/04/2023 20:26:25] C:\Users\SakuraFrost225\Downloads\Fujii Kaze - Shinunoga E-Wa.flac | length=185.573333 | time=185.57310657596
[Sunday/April 09/04/2023 20:26:25] C:\Users\SakuraFrost225\Downloads\Kobaryo - Bookmaker.flac | length=263.351973 | time=0
[Sunday/April 09/04/2023 21:11:31] C:\Users\SakuraFrost225\Downloads\Kobaryo - Bookmaker.flac | length=263.351973 | time=263.35175240929
[Sunday/April 09/04/2023 21:11:36] C:\Users\SakuraFrost225\Downloads\Fujii Kaze - Shinunoga E-Wa.flac | length=185.573333 | time=3.080263
[Sunday/April 09/04/2023 21:16:07] D:\flac\Vũ. - Bước Qua Nhau.flac | length=257.647052 | time=257.64683574262
[Sunday/April 09/04/2023 21:38:01] D:\flac\Yuji - Old Love.flac | length=249.382313 | time=249.38210657595
[Tuesday/April 11/04/2023 10:27:16] "❔ 2023-04-11 10:25" | https://www.youtube.com/watch?v=MVPTGNGiI-4 | length=3.9766447777802 | time=118.466
[Tuesday/April 11/04/2023 10:38:40] "❔ 2023-04-11 10:27" | https://www.youtube.com/watch?v=MVPTGNGiI-4 | length=0 | time=642.966
[Tuesday/April 11/04/2023 10:42:26] "❔ 2023-04-11 10:42" | https://www.youtube.com/watch?v=MVPTGNGiI-4 | length=0 | time=7.433
[Tuesday/April 11/04/2023 10:42:48] "Soothing Breeze 🍃 [asian lofi hip hop]" | https://www.youtube.com/watch?v=gnZImHvA0ME | length=3085.021 | time=11.962
[Tuesday/April 11/04/2023 10:43:00] "Best of lofi hip hop 2022 🎆 - beats to relax/study to" | https://www.youtube.com/watch?v=i43tkaTXtwI | length=11950.021 | time=1.168
[Tuesday/April 11/04/2023 10:48:21] "You Might Not Wanna Hear This - WAN Show March 31, 2023" | https://www.youtube.com/watch?v=LZOOVhu3T70 | length=15962.921 | time=307.975
