[02/02/22 18:18:23] "San Holo - show me (Stingray SONGBOOK Session)" | https://www.youtube.com/watch?v=ITgivG9etVM&list=RDMM&index=3 | time=279.28
[02/02/22 18:19:19] "San Holo - show me (Stingray SONGBOOK Session)" | https://www.youtube.com/watch?v=ITgivG9etVM&list=RDMM&index=3 | time=288.4
[02/02/22 18:20:10] "San Holo - show me (Stingray SONGBOOK Session)" | https://www.youtube.com/watch?v=ITgivG9etVM&list=RDMM&index=3 | time=289.88
[03/02/22 12:37:41] "San Holo - show me" | https://www.youtube.com/watch?v=7j-mAAaNzkw | time=51.318
[03/02/22 13:48:59] "San Holo - show me" | https://www.youtube.com/watch?v=7j-mAAaNzkw | time=341.48527083331
[04/02/22 22:28:01] E:\osu!\Skins\Pedo Skin By [_Kanaria_]\Music\Æâæ╛ - é╛é±é▓æσë╞æ░.flac | time=5.069553
[07/02/22 11:29:54] C:\Users\SakuraFrost225\Downloads\Video\S7CqKHV.mp4 | time=18.218666666667
[07/02/22 11:30:39] C:\Users\SakuraFrost225\Downloads\Video\FinalVideo_1642331518.550443.mov | time=18.55108574263
[08/02/22 18:50:57] C:\Windows.old\Users\BOSS\Pictures\giphy_waifu2x_1920x1080_2n_waifu2x_2x_2n.gif | time=0.99
[08/02/22 18:51:40] E:\VSCode\data\extensions\kamikillerto.vscode-colorize-0.11.1\Kapture 2019-03-01 at 15.07.39.gif | time=0.13
[09/02/22 21:46:19] "Why Manjaro Bundling Vivaldi is a Good Choice" | https://www.youtube.com/watch?v=fJU0pmPoLGA | time=240.501
[09/02/22 21:54:02] "How To Improve Performance And Rendering Times In Kdenlive" | https://www.youtube.com/watch?v=e6AQdMTq0ZM | time=376.92
[09/02/22 21:59:28] "New To Linux? Try Solus OS!" | https://www.youtube.com/watch?v=o8tvUkc5d_w | time=318.04
[09/02/22 22:07:05] "Best Open Source Alternatives To Discord!" | https://www.youtube.com/watch?v=hP3AYsKwxEc | time=594.72
[09/02/22 22:12:56] "Live Wallpapers For Linux: Komorebi Revisited" | https://www.youtube.com/watch?v=mKYvMQI6QPg | time=289.73962500003
[09/02/22 23:45:37] "The BEST case got SMALLER!" | https://yewtu.be/watch?v=LGFKXUuahwo | time=666.57624999999
[09/02/22 23:51:20] "The BEST case got SMALLER!" | https://yewtu.be/watch?v=LGFKXUuahwo | time=78.145
[09/02/22 23:51:51] C:\Windows.old\Users\BOSS\Downloads\Video\10000000_1998830603611380_3127772921166567998_n.mp4 | time=5.5473307291667
[09/02/22 23:53:57] G:\Users\Administrator\Downloads\Video\video0-6-1-3.mp4 | time=13.444127409297
[09/02/22 23:55:29] "The BEST case got SMALLER!" | https://yewtu.be/watch?v=LGFKXUuahwo | time=129.963
[17/02/22 21:04:58] "踊り子 / Vaundy：MUSIC VIDEO" | https://www.youtube.com/watch?v=7HgJIAUtICU | time=57.7035
[17/02/22 22:03:46] "踊り子 / Vaundy：MUSIC VIDEO" | https://www.youtube.com/watch?v=7HgJIAUtICU | time=120.913
[17/02/22 22:08:15] "Introduction To Async, Await, And Tasks | C# 201 [5 of 8]" | https://www.youtube.com/watch?v=X9N5r6kMOxw | time=69.703
[17/02/22 22:13:58] "Combining Branches and Loops | C# 101 [11 of 19]" | https://www.youtube.com/watch?v=qK7tUpaOXi8 | time=331.164
[18/02/22 00:11:57] "Arrays, List, and Collections | C# 101 [12 of 19]" | https://www.youtube.com/watch?v=qLeF_wpnVto | time=419.886
[18/02/22 08:04:40] "Ryzen 6000 Blew Me Away" | https://www.youtube.com/watch?v=wNSFKfUTGR8 | time=317.083
[18/02/22 09:28:59] "Arrays, List, and Collections | C# 101 [12 of 19]" | https://www.youtube.com/watch?v=qLeF_wpnVto | time=640.4886249997
[18/02/22 09:44:53] "Sort, Search, and Index Lists | C# 101 [13 of 19]" | https://www.youtube.com/watch?v=NJ5ghiutzfY | time=383.783
[18/02/22 09:52:30] "Lists of Other Types | C# 101 [14 of 19]" | https://www.youtube.com/watch?v=oIQdb93xewE | time=469.74068749998
[18/02/22 09:58:56] "Debugging | C# 101 [15 of 19]" | https://www.youtube.com/watch?v=pm_pv0Eb7Fw | time=276.743
[18/02/22 10:35:22] "Object Oriented Programming: Objects and Classes | C# 101 [16 of 19]" | https://www.youtube.com/watch?v=TzgxcAiHCWA | time=775.74487499994
[18/02/22 10:46:24] "Object Oriented Programming: Methods and Members | C# 101 [17 of 19]" | https://www.youtube.com/watch?v=xLhm3bEG__c | time=521.722
[18/02/22 10:52:11] "Object Oriented Programming: Methods and Exceptions | C# 101 [18 of 19]" | https://www.youtube.com/watch?v=8YsoBBiVVzQ | time=423.857
[23/02/22 16:09:14] "ASMR: Complete Optical Measuring (role play)" | https://www.youtube.com/watch?v=ln10cFQVbHY | time=346.9
[23/02/22 16:23:23] "ASMR: Complete Optical Measuring (role play)" | https://www.youtube.com/watch?v=ln10cFQVbHY | time=352.667
[23/02/22 16:24:36] "ASMR: Complete Optical Measuring (role play)" | https://www.youtube.com/watch?v=ln10cFQVbHY | time=406.666
[23/02/22 17:18:52] "Fastest Medical ASMR | Neurologist, Eye Doctor, Dentist, Pediatrician, Allergist, PT, Derm, & More!" | https://www.youtube.com/watch?v=R6yzzcCHUwU | time=1128.043
[23/02/22 17:21:09] "Fastest Medical ASMR | Neurologist, Eye Doctor, Dentist, Pediatrician, Allergist, PT, Derm, & More!" | https://www.youtube.com/watch?v=R6yzzcCHUwU | time=1195.578
[23/02/22 17:21:50] "Fastest Medical ASMR | Neurologist, Eye Doctor, Dentist, Pediatrician, Allergist, PT, Derm, & More!" | https://www.youtube.com/watch?v=R6yzzcCHUwU | time=1225.591
[23/02/22 17:23:54] "Fastest ASMR | Fastest Ad, Teacher, Waitress, Interior Design, Movie Theater, Zoo, Nurse, Gym, Nails" | https://www.youtube.com/watch?v=dAMN9kqaaqw | time=77.210329640998
[23/02/22 17:24:22] "Fastest ASMR | Fastest Ad, Teacher, Waitress, Interior Design, Movie Theater, Zoo, Nurse, Gym, Nails" | https://www.youtube.com/watch?v=dAMN9kqaaqw | time=97.397397397397
[23/02/22 17:41:42] "Fastest ASMR | Fastest Ad, Teacher, Waitress, Interior Design, Movie Theater, Zoo, Nurse, Gym, Nails" | https://www.youtube.com/watch?v=dAMN9kqaaqw | time=1127.9796874993
[23/02/22 18:12:30] "Fastest ASMR | Perfume Shop, Mom, Office Worker, Jewelry Store, Bathroom Attendant, Eyebrows & more!" | https://www.youtube.com/watch?v=xaVF9r2zXz0 | time=1125.07395
[23/02/22 20:47:14] "cYsmix - Eden" | https://www.youtube.com/watch?v=Vzxjk9AaDzM | time=21.6
[23/02/22 20:53:02] "cYsmix - Eden" | https://www.youtube.com/watch?v=Vzxjk9AaDzM | time=359.05118749996
[23/02/22 20:54:03] "cYsmix - Escapism | Full Album" | https://www.youtube.com/watch?v=EK0kbhaR0XY | time=51.5515
[23/02/22 20:54:59] "I Broke This CPU on Purpose... Let me Explain" | https://www.youtube.com/watch?v=bFNJVaO9E-o | time=11.177833333333
[23/02/22 21:02:22] "I Broke This CPU on Purpose... Let me Explain" | https://www.youtube.com/watch?v=bFNJVaO9E-o | time=708.675
[23/02/22 21:03:38] "I better not screw this up - Intel $5,000 Extreme Tech Upgrade" | https://www.youtube.com/watch?v=39Z00YkoUeA | time=31.264
[23/02/22 21:03:47] "I better not screw this up - Intel $5,000 Extreme Tech Upgrade" | https://www.youtube.com/watch?v=39Z00YkoUeA | time=0
[23/02/22 21:09:50] "Intro to MPV + Lua Scripts" | https://www.youtube.com/watch?v=4wWI1iv4KEE | time=588.18445209751
[23/02/22 21:10:11] "Lua for Embedded GUI Development: When to use it, why and how?" | https://www.youtube.com/watch?v=9esqnzutQvE | time=3.533
[23/02/22 21:10:11] "Lua for Embedded GUI Development: When to use it, why and how?" | https://www.youtube.com/watch?v=9esqnzutQvE | time=0
[23/02/22 21:11:52] "Embedding Lua in C++ #1" | https://www.youtube.com/watch?v=4l5HdmPoynw | time=92
[23/02/22 21:25:01] "Making Mpv Even Better With Some Lua Scripts" | https://www.youtube.com/watch?v=b8GoHyKw_8Q | time=744
[23/02/22 21:27:14] "I SEE STARS - Running With Scissors - Acoustic (Official Music Video)" | https://www.youtube.com/watch?v=d5qHGUzG564 | time=12.596
[24/02/22 10:24:34] "274145819_2048491208662162_999199298088047854_n.mp4" | https://media.discordapp.net/attachments/889947477971722286/946244932186820698/274145819_2048491208662162_999199298088047854_n.mp4 | time=71.152542372881
[24/02/22 10:48:48] "I SEE STARS - Running With Scissors - Acoustic (Official Music Video)" | https://www.youtube.com/watch?v=d5qHGUzG564 | time=252.51802083333
[24/02/22 10:52:15] "I SEE STARS - Calm Snow - Acoustic (Official Music Video)" | https://www.youtube.com/watch?v=URT1FvwgjDQ | time=196.488
[24/02/22 17:40:29] C:\Users\SakuraFrost225\Downloads\Video\FinalVideo_1642331518.550443.mov | time=13.736666666667
[24/02/22 20:42:58] "VTV1 HD" | https://vips-livecdn.fptplay.net/hda1/vtv1hd_vhls.smil/chunklist_b5000000.m3u8 | time=38.135666666667
[24/02/22 21:37:58] "VEGAS Pro 19: How To Render Up To 2 Times Faster - Tutorial #569" | https://www.youtube.com/watch?v=2-loYXX60zw | time=124.7
[24/02/22 21:41:31] "VEGAS Pro 19: How To Render Up To 2 Times Faster - Tutorial #569" | https://www.youtube.com/watch?v=2-loYXX60zw | time=131.84
[24/02/22 21:43:41] "VEGAS Pro 19: How To Render Up To 2 Times Faster - Tutorial #569" | https://www.youtube.com/watch?v=2-loYXX60zw | time=366.72
[24/02/22 21:44:31] "This Seems Like a BAD Idea - Intel $5,000 Extreme Tech Upgrade" | https://www.youtube.com/watch?v=cjGqxbsY9JA | time=23.39
[24/02/22 21:47:35] "This Seems Like a BAD Idea - Intel $5,000 Extreme Tech Upgrade" | https://www.youtube.com/watch?v=cjGqxbsY9JA | time=94.228
[24/02/22 21:49:29] "This Seems Like a BAD Idea - Intel $5,000 Extreme Tech Upgrade" | https://www.youtube.com/watch?v=cjGqxbsY9JA | time=138.572
[24/02/22 22:04:33] "Fix Lag in Vegas Pro 18 and 19! (2021)" | https://www.youtube.com/watch?v=nezdBQAZFNI | time=273.557
[25/02/22 18:27:25] "274698858_678567316598721_8046614988194266896_n.mp4" | https://media.discordapp.net/attachments/889947477971722286/946723522087125063/274698858_678567316598721_8046614988194266896_n.mp4 | time=14.56594180494
[25/02/22 22:36:29] "QLER- จีบ" | https://www.youtube.com/watch?v=pk4q4-U891E | time=57.958
[25/02/22 22:40:58] "QLER- จีบ" | https://www.youtube.com/watch?v=pk4q4-U891E | time=7.941
[25/02/22 22:41:16] "QLER- จีบ" | https://www.youtube.com/watch?v=pk4q4-U891E | time=1.401
[25/02/22 22:41:42] "ANATOMY RABBIT - ธรรมดาแสนพิเศษ | Extraordinary (Official Audio)" | https://www.youtube.com/watch?v=h2VIUdst5y4 | time=16.92
[25/02/22 22:41:48] "ANATOMY RABBIT - ธรรมดาแสนพิเศษ | Extraordinary (Official Audio)" | https://www.youtube.com/watch?v=h2VIUdst5y4 | time=0
[25/02/22 22:42:44] "A ROCKET TO THE MOON - GAVIN.D 「Official MV」" | https://www.youtube.com/watch?v=3aCctY3DGac | time=45.44
[25/02/22 22:47:06] "Katy Perry - The One That Got Away (Lyrics)" | https://www.youtube.com/watch?v=MoQYsJTfN2c | time=244.15883333338
[25/02/22 22:51:14] "Westlife -  Nothing's Gonna Change My Love For You (Lyrics)" | https://www.youtube.com/watch?v=CQNgGiBO1Rk | time=231.53881250004
[25/02/22 22:55:13] "Westlife - Nothing's Going to Change My Love For You (Audio)" | https://www.youtube.com/watch?v=dmVtts8oPjA | time=228.88012500004
[25/02/22 22:59:37] "Westlife - My Love (Official Video)" | https://www.youtube.com/watch?v=ulOb9gIGGd0 | time=253.09852083339
[25/02/22 23:57:26] "WESTLIFE's TOP Best SONGs Ever - SONG LIST of WESTLIFE" | https://www.youtube.com/watch?v=WsTjF9VL2iM | time=3460
[26/02/22 00:35:30] "A Rocket To The Moon: Like We Used To [OFFICIAL VIDEO]" | https://www.youtube.com/watch?v=US46cHVj0-M | time=206.63539583337
[26/02/22 00:38:40] "A Rocket To The Moon: Ever Enough [OFFICIAL VIDEO]" | https://www.youtube.com/watch?v=8Yu7gUyHfok | time=181.765
[26/02/22 22:39:30] "VID20220226104629.mp4" | https://media.discordapp.net/attachments/889947477971722286/947155299708592168/VID20220226104629.mp4 | time=11.641577777778
[26/02/22 23:53:43] - | time=716.8
[27/02/22 10:10:46] "chunklist.m3u8" | https://nvndcagevswv87c6afake.thapcam.link/live/_definst_/stream_1_1bda7@may1SD/chunklist.m3u8 | time=2296.002
[27/02/22 14:09:36] "This dead guy still registers alive on the motion sensor." | https://www.reddit.com/r/metro/comments/szllvh/this_dead_guy_still_registers_alive_on_the_motion/ | time=60.012666666664
[28/02/22 08:43:09] "chunklist.m3u8" | https://nvndcagevswv87c6afake.thapcam.link/live/_definst_/stream_1_1bda7@may1SD/chunklist.m3u8 | time=6679.9999999804
[28/02/22 11:09:45] "36 Optical Triggers in the name of ASMR (extended request)" | https://www.youtube.com/watch?v=gVI_lwnbakU | time=2878.590395831
[28/02/22 11:16:53] "The BEST ASMR Eye Exam on YouTube (role play)" | https://www.youtube.com/watch?v=BKlAUT-vuGc | time=415.6
[28/02/22 11:24:23] "Finn Askew - Roses (Official Video)" | https://www.youtube.com/watch?v=H8G-bOzO5AY | time=202.64156250003
[28/02/22 11:33:33] "[1 HOUR] Powfu - Death Bed (Lyrics)" | https://www.youtube.com/watch?v=XUZvX_MtSJk | time=171.3
[28/02/22 11:37:01] "keshi - blue" | https://www.youtube.com/watch?v=o3zVtbw0VDM | time=199.866
[28/02/22 11:40:59] "keshi - drunk (live acoustic)" | https://www.youtube.com/watch?v=pbNs7tAUFkk | time=227.602
[28/02/22 11:46:22] "Lauv - Paris in the Rain [Official Video]" | https://www.youtube.com/watch?v=kOCkne-Bku4 | time=216.80575000004
[28/02/22 11:52:36] "Powfu - death bed (coffee for your head) (Official Video) ft. beabadoobee" | https://www.youtube.com/watch?v=jJPMnTXl63E | time=173.76756250002
[28/02/22 12:03:55] "[1 HOUR] Powfu - Death Bed (Lyrics)" | https://www.youtube.com/watch?v=XUZvX_MtSJk | time=625.6
[28/02/22 12:05:30] "EDEN - forever//over (official audio)" | https://www.youtube.com/watch?v=2FFdYZ1ZsbA | time=342.84364583326
[28/02/22 13:09:47] "EDEN - drugs (official video)" | https://www.youtube.com/watch?v=IjZ75qI5BOk | time=238.988
[28/02/22 20:27:21] "Miro - Vertical (Lyric Video) feat. Isabel Higuero" | https://www.youtube.com/watch?v=CBQF5CAxIdM | time=6.907
[28/02/22 20:31:55] "Miro - Vertical (Lyric Video) feat. Isabel Higuero" | https://www.youtube.com/watch?v=CBQF5CAxIdM | time=269.32927083338
[28/02/22 20:32:54] "Miro - Vertical (ft. Isabel Higuero)" | https://www.youtube.com/watch?v=Yr3Uvgi733k | time=4.917
[28/02/22 20:37:24] "Lauv - I Like Me Better (Miro Remix) [LYRICS]" | https://www.youtube.com/watch?v=UVGVovmu9W4 | time=259.96002083339
[28/02/22 20:37:26] "Lauv - I Like Me Better (Miro Remix) [LYRICS]" | https://www.youtube.com/watch?v=UVGVovmu9W4 | time=0
[28/02/22 20:42:50] "Satellite Empire - Aubade (Exclusion Remix)" | https://www.youtube.com/watch?v=YAx1e7srdbM | time=7.72
[28/02/22 20:44:07] "Miro - Ashes | Chillstep" | https://www.youtube.com/watch?v=jywfrjY5mc4 | time=65.399
[28/02/22 20:49:41] "Miro - Ennui | Chill" | https://www.youtube.com/watch?v=K9NPQOFoQeY | time=322.1546875
[28/02/22 20:50:08] "Epic Chillstep Collection 2016 [2 Hours]" | https://www.youtube.com/watch?v=IfL0JsTbv0M | time=16.633
[28/02/22 21:46:39] "Pink Sweat$ - At My Worst (Official Video)" | https://www.youtube.com/watch?v=8CEJoCr_9UI | time=191.78625000002
[28/02/22 21:49:43] "Pink Sweat$ - At My Worst (feat. Kehlani) [Official Video]" | https://www.youtube.com/watch?v=K_zylJH4PRI | time=174.76600000002
[28/02/22 21:53:04] "Pink Sweat$ - At My Worst (Official Video)" | https://www.youtube.com/watch?v=8CEJoCr_9UI | time=190.69
[28/02/22 21:53:17] "Sasha Alex Sloan - Dancing With Your Ghost (Lyric Video)" | https://www.youtube.com/watch?v=Qzc_aX8c8g4 | time=3.795
[28/02/22 22:28:33] "Harry Styles - Sign of the Times (Official Video)" | https://www.youtube.com/watch?v=qN4ooNx77u0 | time=299.44
[01/03/22 20:54:16] "Và Thế Là Hết - Chillies (Original)" | https://www.youtube.com/watch?v=ilB9h1pfjc8 | time=14
[01/03/22 20:59:01] "Và Thế Là Hết - Chillies (Original)" | https://www.youtube.com/watch?v=ilB9h1pfjc8 | time=291.69008333336
[01/03/22 21:09:17] "Mascara - Chillies x BLAZE  [OFFICIAL MUSIC VIDEO]" | https://www.youtube.com/watch?v=ntEoGvhoVac | time=300.00283333335
[01/03/22 21:38:57] "Vùng Ký Ức - Chillies (Official Music Video)" | https://www.youtube.com/watch?v=T0sHaz4H9MQ | time=9.6763333333333
[01/03/22 23:45:36] "Qua Khung Cửa Sổ - Chillies [Official Music Video]" | https://www.youtube.com/watch?v=OmmbiyE-d4Q | time=313.6436875
[01/03/22 23:51:13] "Vùng Ký Ức - Chillies (Official Music Video)" | https://www.youtube.com/watch?v=T0sHaz4H9MQ | time=328.16862499999
[01/03/22 23:52:13] "Qua Khung Cửa Sổ - Chillies [Official Music Video]" | https://www.youtube.com/watch?v=OmmbiyE-d4Q | time=49.4
[02/03/22 15:51:08] "Harry Styles - Sign of the Times (Official Video)" | https://www.youtube.com/watch?v=qN4ooNx77u0 | time=341.32274999999
[02/03/22 16:00:17] "Satellite Empire - Aubade (Exclusion Remix)" | https://www.youtube.com/watch?v=YAx1e7srdbM | time=5.94
[02/03/22 16:00:39] "Satellite Empire - Aubade (Exclusion Remix)" | https://www.youtube.com/watch?v=YAx1e7srdbM | time=0.92
[02/03/22 16:01:04] "【Chill】Satellite Empire - Sacrifice (Miro Remix)" | https://www.youtube.com/watch?v=NXxJOyfJmm4 | time=17.6
[02/03/22 16:07:45] "【Chill】Satellite Empire - Sacrifice (Miro Remix)" | https://www.youtube.com/watch?v=NXxJOyfJmm4 | time=293.37352083334
[02/03/22 16:12:51] "【Chill】Satellite Empire - Sacrifice (Miro Remix)" | https://www.youtube.com/watch?v=NXxJOyfJmm4 | time=288.767
[02/03/22 16:17:40] "keshi - beside you (Lyric Video)" | https://www.youtube.com/watch?v=aMyO6GNkfpo | time=27.236
[02/03/22 16:21:09] "A Rocket To The Moon: Ever Enough [OFFICIAL VIDEO]" | https://www.youtube.com/watch?v=8Yu7gUyHfok | time=231.91031250004
[02/03/22 16:25:01] "A Rocket To The Moon: Like We Used To [OFFICIAL VIDEO]" | https://www.youtube.com/watch?v=US46cHVj0-M | time=204.955
[02/03/22 16:30:13] "EDEN - rock + roll (official video)" | https://www.youtube.com/watch?v=geZ_5Ri7ANg | time=313.23820833332
[02/03/22 16:36:21] "EDEN - drugs (official video)" | https://www.youtube.com/watch?v=IjZ75qI5BOk | time=360.36312499996
[02/03/22 16:41:40] "EDEN - rock + roll (official video)" | https://www.youtube.com/watch?v=geZ_5Ri7ANg | time=311.811
[02/03/22 16:41:43] "EDEN - rock + roll (official video)" | https://www.youtube.com/watch?v=geZ_5Ri7ANg | time=0
[02/03/22 16:41:52] "Sunkissed" | https://www.youtube.com/watch?v=taaT4pC-jnc | time=242.1556875
[02/03/22 16:45:10] "TO THE MOON - hooligan. (Official Lyric Video)" | https://www.youtube.com/watch?v=nmKTlmByng0 | time=9.76
[02/03/22 17:19:35] "I SEE STARS - Running With Scissors - Acoustic (Official Music Video)" | https://www.youtube.com/watch?v=d5qHGUzG564 | time=161.036
[04/03/22 10:28:17] "SoMo - 50 Feet (lyrics)" | https://www.youtube.com/watch?v=G7F1eEKhvrs | time=22.166
[04/03/22 10:28:51] "keshi - 2 soon // Lyrics" | https://www.youtube.com/watch?v=6P_w0adSpYU | time=18.367
[04/03/22 10:32:07] "keshi - 2 soon // Lyrics" | https://www.youtube.com/watch?v=6P_w0adSpYU | time=207.00689583337
[04/03/22 10:32:15] "SoMo - 50 Feet (lyrics)" | https://www.youtube.com/watch?v=G7F1eEKhvrs | time=0.29166666666667
[04/03/22 10:37:55] "keshi - 2 soon // Lyrics" | https://www.youtube.com/watch?v=6P_w0adSpYU | time=202.23333333333
[04/03/22 10:57:19] "Official髭男dism - I LOVE...［Official Video］" | https://www.youtube.com/watch?v=bt8wNQJaKAk | time=273.898625
[04/03/22 11:59:41] "King Gnu - 三文小説" | https://www.youtube.com/watch?v=Y8HeOA95UzQ | time=282.26233333337
[04/03/22 12:04:45] "King Gnu - 逆夢" | https://www.youtube.com/watch?v=M6gcoDN9jBc | time=6.9652916666667
[04/03/22 12:09:53] "King Gnu - 逆夢" | https://www.youtube.com/watch?v=M6gcoDN9jBc | time=13.888875
[04/03/22 12:14:40] "King Gnu - 白日" | https://www.youtube.com/watch?v=ony539T074w | time=279.46477083337
[04/03/22 12:15:11] "King Gnu - 逆夢" | https://www.youtube.com/watch?v=M6gcoDN9jBc | time=22.856166666667
[04/03/22 12:20:02] "Official髭男dism - 宿命［Official Video］" | https://www.youtube.com/watch?v=-kgOFJG881I | time=282.78525000003
[04/03/22 12:31:58] "Official髭男dism - Pretender［Official Video］" | https://www.youtube.com/watch?v=TQ8WlA2GXbk | time=63.730333333333
[04/03/22 14:43:10] "Mark Ronson - Uptown Funk (Official Video) ft. Bruno Mars" | https://www.youtube.com/watch?v=OPf0YbXqDm0 | time=25.608916666667
[04/03/22 14:48:10] "Bruno Mars - 24K Magic (Official Music Video)" | https://www.youtube.com/watch?v=UqyT8IEBkvY | time=103.81204166667
[04/03/22 14:48:40] "Animal Crossing • Relaxing Music with Soft Rain 💧" | https://www.youtube.com/watch?v=jk8_YHtOhFA | time=22.56
[04/03/22 15:50:44] "Animal Crossing • Relaxing Music with Soft Rain 💧" | https://www.youtube.com/watch?v=jk8_YHtOhFA | time=1.56
[04/03/22 16:08:39] "Animal Crossing • Relaxing Music with Soft Rain 💧" | https://www.youtube.com/watch?v=jk8_YHtOhFA | time=3688.4895857446
[04/03/22 16:09:57] "cozy animal crossing music" | https://www.youtube.com/watch?v=8kBlKM71pjc | time=62.5625
[04/03/22 18:11:41] "cozy animal crossing music" | https://www.youtube.com/watch?v=8kBlKM71pjc | time=60.0625
[04/03/22 18:20:30] "Dua Lipa - Don't Start Now (Official Music Video)" | https://www.youtube.com/watch?v=oygrmJFKYZY | time=29.905
[04/03/22 18:24:50] "Dua Lipa - Don't Start Now (Official Music Video)" | https://www.youtube.com/watch?v=oygrmJFKYZY | time=12.22
[04/03/22 18:28:49] "Dua Lipa - Levitating Featuring DaBaby (Official Music Video)" | https://www.youtube.com/watch?v=TUVcZfQe-Kw | time=230.12368750004
[04/03/22 18:32:36] "Dua Lipa - Levitating Featuring DaBaby (Official Music Video)" | https://www.youtube.com/watch?v=TUVcZfQe-Kw | time=216.007
[04/03/22 20:20:50] "Bruno Mars - The Lazy Song (Official Music Video)" | https://www.youtube.com/watch?v=fLexgOxsZu0 | time=65.165
[05/03/22 17:46:21] "東京フラッシュ / Vaundy ：MUSIC VIDEO" | https://www.youtube.com/watch?v=SIuF37EWaLU | time=33.25
[05/03/22 18:22:33] "東京フラッシュ / Vaundy ：MUSIC VIDEO" | https://www.youtube.com/watch?v=SIuF37EWaLU | time=262.01500000005
[05/03/22 18:26:48] "踊り子 / Vaundy：MUSIC VIDEO" | https://www.youtube.com/watch?v=7HgJIAUtICU | time=245.37787500005
[05/03/22 18:27:16] "東京フラッシュ / Vaundy ：MUSIC VIDEO" | https://www.youtube.com/watch?v=SIuF37EWaLU | time=3
[05/03/22 18:33:43] "DuaLipa Greatest Hits 2021 - DuaLipa Best Songs Full Album 2021 - DuaLipa New Popular Songs" | https://www.youtube.com/watch?v=JuGZbBZ8NAQ | time=94.334
[05/03/22 18:41:35] "DuaLipa Greatest Hits 2021 - DuaLipa Best Songs Full Album 2021 - DuaLipa New Popular Songs" | https://www.youtube.com/watch?v=JuGZbBZ8NAQ | time=211.667
[05/03/22 18:53:25] "Dua Lipa - Physical (Official Video)" | https://www.youtube.com/watch?v=9HDEHj2yzew | time=243.37168750005
[05/03/22 19:08:46] "DuaLipa Greatest Hits 2021 - DuaLipa Best Songs Full Album 2021 - DuaLipa New Popular Songs" | https://www.youtube.com/watch?v=JuGZbBZ8NAQ | time=479.5
[06/03/22 00:26:30] C:\Windows.old\Users\BOSS\Downloads\Video\2021-06-30_18-23-58.mp4 | time=10.716666666667
[06/03/22 00:26:56] C:\Windows.old\Users\BOSS\Downloads\Video\getfvid_48656281_510353040013177_8025263912148502596_n.mp4 | time=8.6473307291667
[06/03/22 00:27:06] C:\Users\SakuraFrost225\Downloads\Video\43760932_492309922266155_4964759691118760913_n.mp4 | time=20.1
[06/03/22 00:27:12] C:\Windows.old\Users\BOSS\Downloads\Video\232939109_1235226000244949_7244351516778048411_n.mp4 | time=2.1139973958333
[06/03/22 00:27:29] C:\Users\SakuraFrost225\Downloads\Facebook_Watch_2.mp4 | time=11
[06/03/22 00:27:42] C:\Windows.old\Users\BOSS\Downloads\Video\WCGW by running around - Whatcouldgowrong.mp4 | time=5.696
[06/03/22 00:27:48] C:\Windows.old\Users\BOSS\Downloads\Video\getfvid_196780300_784012362316524_6516913366647453184_n.mp4 | time=0.5
[06/03/22 00:28:02] C:\Windows.old\Users\BOSS\Downloads\Video\176677777_1280042062411811_1100316071868096028_n.mp4 | time=1.2318421201814
[06/03/22 00:28:16] C:\Windows.old\Users\BOSS\Downloads\Video\mc_kiem.mp4 | time=6.3866754535147
[06/03/22 00:28:29] C:\Windows.old\Users\BOSS\Downloads\Video\internet_is_for.mp4 | time=0.41666666666667
[06/03/22 00:28:33] C:\Windows.old\Users\BOSS\Downloads\Video\https___t.co_57Atx64yef_3.mp4 | time=0.86666666666667
[06/03/22 00:28:56] C:\Users\SakuraFrost225\Downloads\Video\273330871_325513016006668_4127507245148968837_n.mp4 | time=17.784451117784
[06/03/22 00:33:33] C:\Users\SakuraFrost225\Downloads\Video\273330871_325513016006668_4127507245148968837_n.mp4 | time=15.515515515516
[06/03/22 00:36:36] C:\Users\SakuraFrost225\Downloads\Video\Những thứ bị nguyền trên internet - Facebook.mp4 | time=48.466666666667
[06/03/22 12:09:16] "Bruno Mars - That’s What I Like (Official Music Video)" | https://www.youtube.com/watch?v=PMivT7MJ41M | time=210.72212500003
[06/03/22 12:13:55] "Mark Ronson - Uptown Funk (Official Video) ft. Bruno Mars" | https://www.youtube.com/watch?v=OPf0YbXqDm0 | time=270.39737500004
[06/03/22 12:14:39] "Maroon 5 - Sugar (Official Music Video)" | https://www.youtube.com/watch?v=09R8_2nJtjg | time=36.745041666667
[06/03/22 12:14:52] "Official髭男dism - I LOVE...［Official Video］" | https://www.youtube.com/watch?v=bt8wNQJaKAk | time=288.47033333333
[06/03/22 12:20:22] "Official髭男dism - Pretender［Official Video］" | https://www.youtube.com/watch?v=TQ8WlA2GXbk | time=320.028
[07/03/22 13:21:22] "Official髭男dism - I LOVE...［Official Video］" | https://www.youtube.com/watch?v=bt8wNQJaKAk | time=228.479
[07/03/22 15:04:42] "2022-03-07_11-28-25.mp4" | https://media.discordapp.net/attachments/889947477971722286/950301652408209428/2022-03-07_11-28-25.mp4 | time=7.7666666666667
[07/03/22 15:14:12] "2022-03-07_15-10-08.mp4" | https://media.discordapp.net/attachments/889947477971722286/950304724719112202/2022-03-07_15-10-08.mp4 | time=10.9
[07/03/22 21:00:00] G:\Users\Administrator\Downloads\Video\zzz.mp4 | time=3.0333333333333
[07/03/22 21:00:24] G:\Users\Administrator\Downloads\Video\Mặt Tối Của TikTok - Facebook_3.mp4 | time=7.0333333333333
[07/03/22 21:01:29] C:\Users\SakuraFrost225\Downloads\Video\what_would_happen_if_a_russian_touhou_player_was_a_military_man__HD.mp4 | time=21.2
[07/03/22 21:01:51] C:\Users\SakuraFrost225\Downloads\Video\VIETNAM ANTI VIDEOS ON THE INTERNET - Facebook_3.mp4 | time=12.423862953515
[07/03/22 21:01:55] C:\Users\SakuraFrost225\Downloads\Video\VIETNAM ANTI VIDEOS ON THE INTERNET - Facebook_2.mp4 | time=1.9333333333333
[07/03/22 21:02:24] C:\Users\SakuraFrost225\Downloads\Video\272719862_609737293452873_1294670079973747731_n.mp4 | time=13.966666666667
[07/03/22 21:02:50] C:\Users\SakuraFrost225\Downloads\Video\video_2022-01-01_03-38-21.mp4 | time=4
[08/03/22 00:31:25] "275250236_939084563636128_2398314124046071373_n.mp4" | https://media.discordapp.net/attachments/889947477971722286/950444480413184010/275250236_939084563636128_2398314124046071373_n.mp4 | time=6.5333333333333
[08/03/22 00:31:53] "275250236_939084563636128_2398314124046071373_n.mp4" | https://media.discordapp.net/attachments/889947477971722286/950444480413184010/275250236_939084563636128_2398314124046071373_n.mp4 | time=10.666666666667
[08/03/22 00:33:01] G:\Users\Administrator\Downloads\Video\Mặt Tối Của TikTok - Facebook_3.mp4 | time=16
[08/03/22 09:01:13] "Big Sean - I Don't Fuck With You ft. E-40 (Official Music Video)" | https://www.youtube.com/watch?v=ZR_X6PrASho | time=30.488
[08/03/22 09:05:42] "Big Sean - I Don't Fuck With You ft. E-40 (Official Music Video)" | https://www.youtube.com/watch?v=ZR_X6PrASho | time=29.154
[08/03/22 09:07:51] "2022-03-07_10-51-42.mp4" | https://media.discordapp.net/attachments/889947477971722286/950302917221560381/2022-03-07_10-51-42.mp4 | time=20.233333333333
[08/03/22 12:39:34] "Big Sean - I Don't Fuck With You ft. E-40 (Official Music Video)" | https://www.youtube.com/watch?v=ZR_X6PrASho | time=284.85181249999
[08/03/22 12:47:06] "Big Sean - I Don't Fuck With You (Official Music Video) ft. E-40" | https://www.youtube.com/watch?v=cZaJYDPY-YQ | time=347.35993749992
[08/03/22 12:47:12] "Big Sean - I Don't Fuck With You (Official Music Video) ft. E-40" | https://www.youtube.com/watch?v=cZaJYDPY-YQ | time=0
[08/03/22 15:19:59] "2022-03-07_10-51-42.mp4" | https://media.discordapp.net/attachments/889947477971722286/950302917221560381/2022-03-07_10-51-42.mp4 | time=10.183333333333
[09/03/22 11:37:06] E:\danser-0.6.8-win\videos\danser_2022-03-09_11-36-30.mp4 | time=12.65
[09/03/22 11:40:09] E:\danser-0.6.8-win\videos\danser_2022-03-09_11-37-48.mp4 | time=29.016666666667
[09/03/22 11:43:14] C:\Users\SakuraFrost225\Videos\20220309-113920-danser_2022-03-09_11-37-48.20220309-114214.mp4 | time=18.0830078125
[09/03/22 11:56:22] "20220309-113920-danser_2022-03-09_11-37-48.20220309-114214.mp4" | https://media.discordapp.net/attachments/889947477971722286/950976870202085417/20220309-113920-danser_2022-03-09_11-37-48.20220309-114214.mp4 | time=18.0830078125
[10/03/22 16:30:37] "redditsave.com__-jbgia0bqfk381.mp4" | https://media.discordapp.net/attachments/889947477971722286/951410525722525696/redditsave.com__-jbgia0bqfk381.mp4 | time=8.5333541666667
[10/03/22 21:34:42] "dit_me_united.mp4" | https://media.discordapp.net/attachments/889947477971722286/951487007719321610/dit_me_united.mp4 | time=7.5666666666667
[11/03/22 19:20:58] E:\danser-0.6.8-win\videos\danser_2022-02-21_23-01-35.mp4 | time=62.5
[11/03/22 19:21:44] E:\danser-0.6.8-win\videos\danser_2021-12-14_11-03-59.mp4 | time=41.15
[11/03/22 19:22:08] E:\danser-0.6.8-win\videos\danser_2021-11-02_23-56-41.mp4 | time=34.083333333333
[11/03/22 19:24:16] E:\Video\629668 KAMELOT Liar Liar Wasteland Monarchy played by ErogeMaster225.mp4 | time=80.85
[11/03/22 19:26:16] E:\Video\629668 KAMELOT Liar Liar Wasteland Monarchy played by ErogeMaster225_EDIT.mp4 | time=19.202018229167
[11/03/22 22:54:52] "275706878_1014675232457195_1274470257006216302_n.png" | https://cdn.discordapp.com/attachments/889947477971722286/951870597053435904/275706878_1014675232457195_1274470257006216302_n.png | time=0
[11/03/22 22:55:38] "275559091_664404544869533_3813521322399706444_n.mp4" | https://media.discordapp.net/attachments/889947477971722286/951868301951254538/275559091_664404544869533_3813521322399706444_n.mp4 | time=24.933333333333
[11/03/22 23:34:30] "flabbergasted-hero.mp4" | https://media.discordapp.net/attachments/889947477971722286/951880026238890004/flabbergasted-hero.mp4 | time=1.62
[14/03/22 21:57:46] E:\danser-0.6.8-win\videos\danser_2022-02-23_22-56-47.mp4 | time=2.2
[14/03/22 21:57:50] E:\danser-0.6.8-win\videos\danser_2022-02-21_23-01-35.mp4 | time=8.3666666666667
[14/03/22 21:57:56] C:\Users\SakuraFrost225\Videos\20220218-211419-danser_2022-02-18_21-12-54.20220218-211637.mp4 | time=0.014322916666667
[14/03/22 21:58:01] E:\danser-0.6.8-win\videos\danser_2022-02-18_21-12-54.mp4 | time=9.2666666666667
[14/03/22 21:59:39] C:\Users\SakuraFrost225\Videos\20220216-222114-danser_2022-02-16_22-18-38.20220216-222306.mp4 | time=45.731640625
[15/03/22 18:38:24] D:\Music\MrSuicideSheep\Best of 2017 Mix.mp3 | time=241.36430039847
[15/03/22 18:43:02] "NIKI - Every Summertime (Official Video)" | https://www.youtube.com/watch?v=a0OHkWX7B-E | time=212.71902083337
[15/03/22 18:59:46] "dhruv - double take (Official Audio)" | https://www.youtube.com/watch?v=uQiF1yOnzDg | time=29.546383999999
[15/03/22 19:03:32] "Bazzi - Myself [Official Music Video]" | https://www.youtube.com/watch?v=VgKjHh1Y-1Y | time=196.88100000003
[15/03/22 19:07:12] "Bazzi - Beautiful feat. Camila [Official Audio]" | https://www.youtube.com/watch?v=BWC9OS45HAM | time=180.08337500002
[15/03/22 19:07:48] "Lauv - I Like Me Better [Official Audio]" | https://www.youtube.com/watch?v=a7fzkqLozwA | time=25.061851
[15/03/22 19:10:46] "Bazzi - Paradise [Official Music Video]" | https://www.youtube.com/watch?v=x90WLRa5uGo | time=168.02062500001
[15/03/22 19:13:42] "Bazzi - I.F.L.Y. [Official Music Video]" | https://www.youtube.com/watch?v=Xhh3_-JRnDc | time=166.18625000001
[15/03/22 19:16:44] "dhruv - double take (Official Audio)" | https://www.youtube.com/watch?v=uQiF1yOnzDg | time=172.54850000001
[15/03/22 19:19:56] "Jeremy Zucker - comethru (Official Video)" | https://www.youtube.com/watch?v=jO2viLEW-1A | time=180.65227083335
[15/03/22 19:20:49] "dhruv - double take (Official Audio)" | https://www.youtube.com/watch?v=uQiF1yOnzDg | time=43.429989000001
[18/03/22 08:48:09] C:\Windows.old\Users\BOSS\Downloads\Video\[9.38 ([s])] Aricin ([sl]) xi - FREEDOM DiVE [Arles] ([pl])NF 93.79([p])-Ef61.mp4 | time=128.3
[18/03/22 09:47:35] C:\Users\SakuraFrost225\Downloads\Video\SE Exit Video.mp4 | time=106.0059
[19/03/22 14:44:17] "Snail's House - Lullaby" | https://www.youtube.com/watch?v=H87GqJujcOk | time=197.866
[19/03/22 18:01:24] "Jeremy Zucker - comethru (Official Video)" | https://www.youtube.com/watch?v=jO2viLEW-1A | time=1.835
[23/03/22 00:27:03] "Kanye West - Stronger" | https://www.youtube.com/watch?v=PsO6ZnUZI0g | time=266.22939583338
[23/03/22 00:27:28] "Kanye West - Heartless" | https://www.youtube.com/watch?v=Co0tTeuUVhU | time=18.879354
[23/03/22 10:56:05] "Official髭男dism - Laughter［Official Video］" | https://www.youtube.com/watch?v=kff_DXor7jc | time=379.60083333328
[23/03/22 11:18:51] "Official髭男dism - Pretender［Official Video］" | https://www.youtube.com/watch?v=TQ8WlA2GXbk | time=317.7945
[23/03/22 11:39:59] "Official髭男dism - 宿命［Official Video］" | https://www.youtube.com/watch?v=-kgOFJG881I | time=99.034870999997
[23/03/22 13:50:40] "【女性が歌う】 Pretender / Official髭男dism (Covered by コバソロ & 春茶)" | https://www.youtube.com/watch?v=FmZhFMzWIGQ | time=305.24771100001
[26/03/22 00:10:19] C:\Users\SakuraFrost225\Downloads\Video\Shrek.mkv | time=1678.3122158888
[26/03/22 00:12:28] C:\Users\SakuraFrost225\Downloads\shrek.webm | time=6.507
[08/04/22 10:32:38] C:\Users\SakuraFrost225\AppData\Local\Microsoft\Windows\INetCache\IE\ZCEZQ1OO\heIKaaamvdc_All_Sports_Golf_Battle_at_The_Masters[1].mp4 | time=677.395733
[08/04/22 10:32:51] C:\Users\SakuraFrost225\AppData\Local\Microsoft\Windows\INetCache\IE\ZCEZQ1OO\received_714872132534607[1].mp4 | time=0.83333333333333
[08/04/22 10:33:00] C:\Users\SakuraFrost225\AppData\Local\Microsoft\Windows\INetCache\IE\L8HTY0JF\EDITED_20210429_185339[1].mp4 | time=1.0604111111111
[09/04/22 17:15:47] E:\Torrents\Turning.Red.2022.REPACK.2160p.WEBRip.3500MB.DDP5.1.x264-GalaxyRG[TGx]\Turning.Red.2022.REPACK.2160p.WEBRip.3500MB.DDP5.1.x264-GalaxyRG_1.mkv | time=7.513
[09/04/22 17:18:50] E:\Torrents\Turning.Red.2022.REPACK.2160p.WEBRip.3500MB.DDP5.1.x264-GalaxyRG[TGx]\Turning.Red.2022.REPACK.2160p.WEBRip.3500MB.DDP5.1.x264-GalaxyRG_1.mkv | time=147.569
[09/04/22 19:47:00] E:\Torrents\Turning.Red.2022.REPACK.2160p.WEBRip.3500MB.DDP5.1.x264-GalaxyRG[TGx]\Turning.Red.2022.REPACK.2160p.WEBRip.3500MB.DDP5.1.x264-GalaxyRG_1.mkv | time=1020.525
[10/04/22 21:50:30] C:\Windows.old\Users\BOSS\Downloads\Compressed\King_Gnu_-_Sanmon_Shosetsu_[24bit_⁄_48kHz]\[Jpflac] King Gnu - Sanmon Shosetsu [24bit ⁄ 48kHz]\01. 三文小説.flac | time=0
[10/04/22 22:08:55] C:\Users\SakuraFrost225\Downloads\Music\02. drugs.flac | time=338.33310657595
[11/04/22 11:44:49] "EDEN - Wake Up" | https://www.youtube.com/watch?v=YthChN1Wq8M | time=250.92
[23/04/22 20:07:42] "LPL (live) 2022-04-23 20:07" | https://www.twitch.tv/lpl | time=16552.103
[23/04/22 20:10:53] "VTV1 HD" | https://vips-livecdn.fptplay.net/hda1/vtv1hd_vhls.smil/chunklist_b5000000.m3u8 | time=1.188
[23/04/22 20:11:50] "VTV1 | 1080P" | https://drfamaga5qliv.vcdn.cloud/vtv01/vtv01@1080p.m3u8 | time=3.563
[23/04/22 20:12:38] C:\Users\SakuraFrost225\Downloads\Video\Xem trực tiếp Arsenal vs Manchester United vào 18-30 ngày 23_04_2022.ts | time=12.032
[23/04/22 20:48:08] C:\Users\SakuraFrost225\Videos\VID_20201001_163750_387.mp4 | time=65.435190983093
[23/04/22 20:57:52] "vtv01@1080p.m3u8" | https://drfamaga5qliv.vcdn.cloud/vtv01/vtv01@1080p.m3u8 | time=7.552
[23/04/22 20:59:38] "LPL (live) 2022-04-23 20:58" | https://www.twitch.tv/lpl | time=19664.005
[23/04/22 20:59:58] "chunklist.m3u8" | https://nvndcagevswv87c6afake.thapcam.link/live/_definst_/stream_1_1bda7@may3SD/chunklist.m3u8 | time=18.736
[23/04/22 21:00:02] "chunklist.m3u8" | https://nvndcagevswv87c6afake.thapcam.link/live/_definst_/stream_1_1bda7@may3SD/chunklist.m3u8 | time=0
[24/04/22 21:50:32] C:\mpv\Yoasobi - Racing Into The Night, but it is an iPhone ringtone [Ryox Version] [OChc4YcajiQ].opus | time=37.150428
[04/05/22 20:30:02] C:\Users\SakuraFrost225\Downloads\Compressed\Untitled folder-20220504T132347Z-001\Untitled folder\超可愛い１８歳巨乳彼女が極上手コキ 完整版\│¼┐╔É█ññú▒ú╕Ür╛▐╚Θ▒╦┼«ñ¼ÿO╔╧╩╓Ñ│Ñ¡ ═Ω╒√░µ\╕╜╘∙DLC\DLC 01.mp4 | time=9.4
[04/05/22 20:30:16] C:\Users\SakuraFrost225\Downloads\Compressed\Untitled folder-20220504T132347Z-001\Untitled folder\超可愛い１８歳巨乳彼女が極上手コキ 完整版\│¼┐╔É█ññú▒ú╕Ür╛▐╚Θ▒╦┼«ñ¼ÿO╔╧╩╓Ñ│Ñ¡ ═Ω╒√░µ\╕╜╘∙DLC\DLC 02.mp4 | time=8.9
[04/05/22 20:34:03] C:\Users\SakuraFrost225\Downloads\Compressed\Untitled folder-20220504T132347Z-001\Untitled folder\超可愛い１８歳巨乳彼女が極上手コキ 完整版\│¼┐╔É█ññú▒ú╕Ür╛▐╚Θ▒╦┼«ñ¼ÿO╔╧╩╓Ñ│Ñ¡ ═Ω╒√░µ\╕╜╘∙DLC\DLC 01.mp4 | time=160.83333333333
[04/05/22 20:34:17] C:\Users\SakuraFrost225\Downloads\Compressed\Untitled folder-20220504T132347Z-001\Untitled folder\超可愛い１８歳巨乳彼女が極上手コキ 完整版\│¼┐╔É█ññú▒ú╕Ür╛▐╚Θ▒╦┼«ñ¼ÿO╔╧╩╓Ñ│Ñ¡ ═Ω╒√░µ\╙░╞¼\│¼┐╔É█ññú▒ú╕Ür╛▐╚Θ▒╦┼«ñ¼ÿO╔╧╩╓Ñ│Ñ¡ ═Ω╒√░µ.mp4 | time=9.3756666666667
[05/05/22 19:53:45] C:\Users\SakuraFrost225\Downloads\Video\trim.69EAA910-16F2-4DDB-BFF2-C4023D5EE1DB.mov | time=1.2679346012679
[05/05/22 19:54:01] C:\Users\SakuraFrost225\Downloads\Video\trim.69EAA910-16F2-4DDB-BFF2-C4023D5EE1DB.mov | time=0.43376710043377
[10/05/22 17:32:41] C:\Users\SakuraFrost225\Videos\20220510-131826-Nghe_Vai_L_-_No_bop_vu_em_anh_a_-_Facebook.20220510-173200.mp4 | time=1.8473673469388
[10/05/22 17:38:55] E:\danser-0.6.8-win\videos\danser_2021-12-10_17-30-57.mp4 | time=125.68333333333
[21/05/22 23:33:37] C:\Users\SakuraFrost225\Downloads\Video\du_ma.mp4 | time=5.1
[29/05/22 01:42:07] E:\android backup\CSNMusic\Download\Music\Space Oddity__David Bowie__320.mp3 | time=176.15015999998
[29/05/22 02:07:15] E:\android backup\CSNMusic\Download\Music\Space Oddity__David Bowie__320.mp3 | time=193.40236224486
[02/06/22 22:37:07] E:\AutoWall\2022-06-02 22-35-53.mp4 | time=15.116666666667
[02/06/22 22:43:37] C:\Users\SakuraFrost225\Videos\20220602-223617-2022-06-02 22-35-53.20220602-224306.mp4 | time=19.366015625
[03/06/22 17:03:56] E:\754451 The Oral Cigarettes Rei Played By Erogemaster225-1.avi | time=2.05
[04/06/22 20:50:01] E:\osu!\Songs\962562 Imperial Circus Dead Decadence - Uta\audio 1.400x withDT.mp3 | time=84.171275496599
[08/06/22 14:54:21] "[LYRICS] The Eden Project - Times Like These" | https://www.youtube.com/watch?v=efTEqGz863k | time=9.784
[08/06/22 14:55:06] "[LYRICS] The Eden Project - Times Like These" | https://www.youtube.com/watch?v=efTEqGz863k | time=36.817
[08/06/22 14:55:19] "[LYRICS] The Eden Project - Times Like These" | https://www.youtube.com/watch?v=efTEqGz863k | time=0
[09/06/22 23:32:06] E:\AutoWall\2022-06-09 23-30-56.mp4 | time=6.0166666666667
[09/06/22 23:32:29] E:\AutoWall\2022-06-09 23-31-40.mp4 | time=6.0166666666667
[09/06/22 23:33:37] E:\AutoWall\2022-06-09 23-31-40.mp4 | time=2.2
[09/06/22 23:42:48] C:\Users\SakuraFrost225\Videos\20220609-233311-2022-06-09 23-33-02.20220609-234217.mp4 | time=5.8706666666667
[09/06/22 23:43:09] E:\AutoWall\2022-06-09 23-33-02.mp4 | time=6.6166666666667
[10/06/22 14:40:26] C:\Users\SakuraFrost225\Downloads\Compressed\Untitled folder-20220504T132347Z-001\Untitled folder\超可愛い１８歳巨乳彼女が極上手コキ 完整版\│¼┐╔É█ññú▒ú╕Ür╛▐╚Θ▒╦┼«ñ¼ÿO╔╧╩╓Ñ│Ñ¡ ═Ω╒√░µ\╙░╞¼\│¼┐╔É█ññú▒ú╕Ür╛▐╚Θ▒╦┼«ñ¼ÿO╔╧╩╓Ñ│Ñ¡ ═Ω╒√░µ.mp4 | time=109.22542222222
[13/06/22 22:45:26] C:\Users\SakuraFrost225\Downloads\Video\287869489_1186427595503595_7915490737443116110_n.mp4 | time=15.533333333333
[16/06/22 18:51:56] E:\danser-0.6.8-win\videos\danser_2022-06-16_18-46-23.mp4 | time=160.93333333333
[16/06/22 20:05:47] C:\Users\SakuraFrost225\Videos\20220616-184959-danser_2022-06-16_18-46-23.20220616-185743.mp4 | time=159.26266666667
[18/06/22 23:55:45] "All I Ask - Adele (Lyrics)" | https://www.youtube.com/watch?v=FOn8SdYF7eg | time=270.67602083338
[18/06/22 23:55:51] "All I Ask - Adele (Lyrics)" | https://www.youtube.com/watch?v=FOn8SdYF7eg | time=0
[21/06/22 18:13:32] E:\danser-0.6.8-win\videos\danser_2022-06-21_18-11-38.mp4 | time=58.75
[21/06/22 18:27:23] E:\danser-0.6.8-win\videos\danser_2022-06-21_18-18-22.mp4 | time=117.45
[21/06/22 18:29:47] C:\Windows.old.000\Users\SakuraFrost225\Videos\20220309-113920-danser_2022-03-09_11-37-48.20220309-114214.mp4 | time=18.0830078125
[21/06/22 18:42:31] C:\Users\SakuraFrost225\Videos\20220621-181918-danser_2022-06-21_18-18-22.20220621-182902_1.mp4 | time=8.6666666666667
[21/06/22 18:45:25] C:\Users\SakuraFrost225\Videos\20220621-181918-danser_2022-06-21_18-18-22.20220621-182902_1.mp4 | time=28.181333333334
[21/06/22 18:45:45] C:\Users\SakuraFrost225\Videos\20220621-181918-danser_2022-06-21_18-18-22.20220621-182902.mp4 | time=57.427333333331
[22/06/22 21:58:43] E:\danser-0.6.8-win\videos\danser_2021-09-12_17-00-48.mp4 | time=323.41666666667
[22/06/22 22:16:59] E:\danser-0.6.8-win\videos\danser_2022-02-18_21-12-54.mp4 | time=95.466666666667
[23/06/22 22:44:39] E:\danser-0.6.8-win\videos\danser_2021-09-12_17-00-48.mp4 | time=328.61666666667
[23/06/22 22:45:44] E:\danser-0.6.8-win\videos\danser_2021-12-10_17-30-57.mp4 | time=1.7333333333333
[23/06/22 22:48:00] E:\danser-0.6.8-win\videos\danser_2021-12-14_11-19-32.mp4 | time=143.93333333333
[25/06/22 13:04:02] E:\Torrents\Business.Proposal.S01.KOREAN.1080p.NF.WEBRip.DDP2.0.x264-REVOLT[rartv]\Business.Proposal.S01E01.1080p.NF.WEB-DL.DDP2.0.x264-REVOLT.mkv | time=539.748
[25/06/22 15:22:41] G:\Business Proposal tập 1.ts | time=1815.4803333333
[26/06/22 12:17:07] "Intel Messed Up - WAN Show June 24, 2022" | https://www.youtube.com/watch?v=dOyrx5HOCyY | time=353.687
[26/06/22 15:40:01] "Can you really drive while facing backwards?" | https://www.youtube.com/watch?v=hSmtKMx1CB4 | time=331.565
[28/06/22 11:55:41] E:\danser-0.6.8-win\videos\danser_2022-06-28_11-52-51.mp4 | time=125.45
[28/06/22 12:00:28] C:\Users\SakuraFrost225\Videos\20220628-115410-danser_2022-06-28_11-52-51.20220628-115801.mp4 | time=161.60166666666
[28/06/22 19:51:27] E:\Business Proposal tập 2.mp4 | time=453.36958333333
[30/06/22 12:12:05] E:\danser-0.6.8-win\videos\danser_2022-06-28_11-52-51.mp4 | time=162.05
[30/06/22 12:17:54] E:\danser-0.6.8-win\videos\danser_2022-06-28_11-52-51.mp4 | time=124.3
[03/07/22 17:24:07] E:\danser-0.6.8-win\videos\danser_2022-07-03_17-19-48.mp4 | time=171.85
[03/07/22 17:27:23] E:\danser-0.6.8-win\videos\danser_2022-07-03_17-19-48.mp4 | time=170.85
[03/07/22 20:17:55] E:\danser-0.6.8-win\videos\danser_2022-03-09_11-37-48.mp4 | time=40.733333333333
[03/07/22 20:44:19] E:\danser-0.6.8-win\videos\danser_2022-07-03_20-42-41.mp4 | time=59.6
[03/07/22 20:44:21] E:\danser-0.6.8-win\videos\danser_2022-07-03_20-42-41.mp4 | time=25.266666666667
[03/07/22 20:45:54] E:\danser-0.6.8-win\videos\danser_2022-07-03_20-42-41.mp4 | time=76.6
[03/07/22 20:47:01] E:\danser-0.6.8-win\videos\danser_2022-07-03_20-45-58.mp4 | time=29.583333333333
[03/07/22 20:48:56] E:\danser-0.6.8-win\videos\danser_2022-07-03_20-48-07.mp4 | time=13.583333333333
[03/07/22 20:50:34] E:\danser-0.6.8-win\videos\danser_2022-07-03_20-49-53.mp4 | time=9.5
[08/07/22 23:35:41] C:\Users\SakuraFrost225\チューリングの跡 [1084029958].mp3 | time=1.7800887165533
[08/07/22 23:43:29] C:\Users\SakuraFrost225\Frums [192133367].mp3 | time=2.2909997165533
[10/07/22 22:09:05] E:\danser-0.6.8-win\videos\danser_2022-07-10_22-05-00.mp4 | time=152.03333333333
[10/07/22 22:10:32] E:\danser-0.6.8-win\videos\danser_2022-07-10_22-09-36.mp4 | time=36.3
[10/07/22 22:11:08] E:\danser-0.6.8-win\videos\danser_2022-07-03_20-49-53.mp4 | time=26.5
[10/07/22 22:11:59] E:\danser-0.6.8-win\videos\danser_2022-07-10_22-10-50.mp4 | time=46.433333333333
[11/07/22 16:57:16] E:\danser-0.6.8-win\videos\danser_2022-07-10_22-12-20.mp4 | time=47.033333333333
[11/07/22 19:19:48] E:\danser-0.6.8-win\videos\danser_2022-07-11_19-18-14.mp4 | time=17.033333333333
[11/07/22 20:29:00] E:\danser-0.6.8-win\videos\danser_2022-07-11_19-18-14.mp4 | time=20.7
[11/07/22 20:49:39] E:\danser-0.6.8-win\videos\danser_2022-07-11_20-48-08.mp4 | time=41.666666666667
[14/07/22 19:28:01] E:\danser-0.6.8-win\videos\danser_2022-07-14_19-26-49.mp4 | time=34.7
[14/07/22 19:28:26] E:\danser-0.6.8-win\videos\danser_2022-07-14_19-26-49.mp4 | time=35.45
[14/07/22 19:28:57] E:\danser-0.6.8-win\videos\danser_2022-07-14_19-26-49.mp4 | time=40.661333333333
[15/07/22 15:37:00] E:\danser-0.6.8-win\videos\danser_2022-07-15_15-35-12.mp4 | time=31.516666666667
[15/07/22 15:37:42] E:\danser-0.6.8-win\videos\danser_2022-07-15_15-35-12.mp4 | time=74.965333333333
[19/07/22 22:09:28] E:\danser-0.6.8-win\videos\danser_2022-07-19_22-06-16.mp4 | time=77.216666666667
[19/07/22 22:13:14] E:\danser-0.6.8-win\videos\danser_2022-07-19_22-10-01.mp4 | time=139.56666666667
[19/07/22 22:15:22] E:\danser-0.6.8-win\videos\danser_2022-07-19_22-14-01.mp4 | time=50.05
[19/07/22 22:16:26] E:\danser-0.6.8-win\videos\danser_2022-07-15_15-35-12.mp4 | time=7.75
[19/07/22 22:16:57] E:\danser-0.6.8-win\videos\danser_2022-07-19_22-14-01.mp4 | time=57.833333333333
[19/07/22 22:17:09] E:\danser-0.6.8-win\videos\danser_2022-07-19_22-15-55.mp4 | time=10.783333333333
[21/07/22 20:50:20] E:\danser-0.6.8-win\videos\danser_2022-07-21_20-45-21.mp4 | time=237.13333333333
[21/07/22 20:57:58] E:\danser-0.6.8-win\videos\danser_2022-07-21_20-45-21.mp4 | time=156.16666666667
[22/07/22 15:35:21] E:\danser-0.6.8-win\videos\danser_2022-07-22_15-33-54.mp4 | time=51.05
[22/07/22 21:23:40] E:\danser-0.6.8-win\videos\danser_2022-07-22_21-22-53.mp4 | time=15.366666666667
[22/07/22 21:24:10] E:\danser-0.6.8-win\videos\danser_2022-07-22_21-22-53.mp4 | time=2.6666666666667
[22/07/22 21:24:46] E:\danser-0.6.8-win\videos\danser_2022-07-22_21-24-02.mp4 | time=9.7333333333333
[22/07/22 21:26:11] E:\danser-0.6.8-win\videos\danser_2022-07-22_21-25-01.mp4 | time=1.5833333333333
[22/07/22 21:26:32] E:\danser-0.6.8-win\videos\danser_2022-07-22_15-33-54.mp4 | time=14.35
[22/07/22 21:27:21] E:\danser-0.6.8-win\videos\danser_2022-07-22_21-26-05.mp4 | time=29.45
[22/07/22 21:27:29] E:\danser-0.6.8-win\videos\danser_2022-07-22_21-26-05.mp4 | time=50.65
[22/07/22 21:28:28] E:\danser-0.6.8-win\videos\danser_2022-07-22_21-27-48.mp4 | time=19.783333333333
[22/07/22 21:29:01] E:\danser-0.6.8-win\videos\danser_2022-07-22_21-25-01.mp4 | time=32.55
[22/07/22 21:29:17] E:\danser-0.6.8-win\videos\danser_2022-07-22_21-28-44.mp4 | time=9.7333333333333
[22/07/22 21:29:57] E:\danser-0.6.8-win\videos\danser_2022-07-22_21-29-33.mp4 | time=3.8166666666667
[22/07/22 21:30:45] E:\danser-0.6.8-win\videos\danser_2022-07-22_21-30-12.mp4 | time=17.6
[22/07/22 21:31:43] E:\danser-0.6.8-win\videos\danser_2022-07-22_21-31-01.mp4 | time=22.65
[22/07/22 21:32:54] E:\danser-0.6.8-win\videos\danser_2022-07-22_21-32-17.mp4 | time=16.016666666667
[22/07/22 21:34:22] E:\danser-0.6.8-win\videos\danser_2022-07-22_21-33-11.mp4 | time=22.333333333333
[22/07/22 21:34:39] E:\danser-0.6.8-win\videos\danser_2022-07-22_21-33-11.mp4 | time=0.95
[22/07/22 21:34:55] E:\danser-0.6.8-win\videos\danser_2022-07-22_21-25-01.mp4 | time=11.233333333333
[22/07/22 21:35:32] E:\danser-0.6.8-win\videos\danser_2022-07-22_21-34-41.mp4 | time=26.516666666667
[22/07/22 21:36:04] E:\danser-0.6.8-win\videos\danser_2022-07-22_15-33-54.mp4 | time=53.933333333333
[22/07/22 21:36:39] E:\danser-0.6.8-win\videos\danser_2022-07-22_21-35-45.mp4 | time=24.95
[22/07/22 21:37:44] E:\danser-0.6.8-win\videos\danser_2022-07-22_21-37-04.mp4 | time=43.466666666667
[22/07/22 21:41:57] E:\danser-0.6.8-win\videos\danser_2022-07-22_21-40-08.mp4 | time=80.3
[22/07/22 22:10:49] E:\danser-0.6.8-win\videos\danser_2022-07-22_21-40-08.mp4 | time=62.983333333333
[22/07/22 22:11:16] E:\danser-0.6.8-win\videos\danser_2022-07-22_21-40-08.mp4 | time=79.933333333333
[26/07/22 11:38:29] E:\osu!\Skins\MyAngelsim\combobreak.wav | time=1.485174
[26/07/22 11:38:33] E:\osu!\Skins\MyAngelsim\combobreak.mp3 | time=1.8429396258503
[26/07/22 11:38:38] E:\osu!\Skins\MyAngelsim\combobreakAH.wav | time=0.28406490929705
[26/07/22 17:14:26] E:\danser-0.6.8-win\videos\danser_2022-07-26_17-12-14.mp4 | time=87.6
[26/07/22 17:18:50] E:\danser-0.6.8-win\videos\danser_2022-07-26_17-18-05.mp4 | time=8.1166666666667
[26/07/22 17:20:10] E:\danser-0.6.8-win\videos\danser_2022-07-26_17-19-06.mp4 | time=28.066666666667
[26/07/22 17:22:23] E:\danser-0.6.8-win\videos\danser_2022-07-26_17-15-00.mp4 | time=23.05
[26/07/22 17:22:43] E:\danser-0.6.8-win\videos\danser_2022-07-26_17-18-05.mp4 | time=7.9
[26/07/22 17:22:49] E:\danser-0.6.8-win\videos\danser_2022-07-26_17-19-06.mp4 | time=11.116666666667
[26/07/22 17:22:59] E:\danser-0.6.8-win\videos\danser_2022-07-26_17-15-00.mp4 | time=12.75
[26/07/22 17:23:59] E:\danser-0.6.8-win\videos\danser_2022-07-26_17-23-19.mp4 | time=15.533333333333
[26/07/22 17:27:42] E:\danser-0.6.8-win\videos\danser_2022-07-26_17-15-00.mp4 | time=39.083333333333
[26/07/22 17:27:43] E:\danser-0.6.8-win\videos\danser_2022-07-26_17-24-16.mp4 | time=39.15
[26/07/22 17:28:18] E:\danser-0.6.8-win\videos\danser_2022-07-26_17-24-16.mp4 | time=82.15
[26/07/22 17:38:03] E:\danser-0.6.8-win\videos\danser_2022-07-26_17-24-16.mp4 | time=87.85
[31/07/22 17:50:59] E:\danser-0.6.8-win\videos\danser_2022-07-31_17-41-06.mp4 | time=109.83333333333
[02/08/22 17:12:22] E:\danser-0.6.8-win\videos\danser_2022-08-01_16-18-13.mp4 | time=37.738666666667
[02/08/22 17:13:04] E:\danser-0.6.8-win\videos\danser_2022-08-01_16-18-13.mp4 | time=35.3
[02/08/22 18:05:07] E:\danser-0.6.8-win\videos\danser_2022-08-02_18-04-14.mp4 | time=13.8
[02/08/22 18:09:23] E:\danser-0.6.8-win\videos\danser_2022-08-01_16-18-13.mp4 | time=11.233333333333
[03/08/22 18:07:47] "水瀬いのり「MELODY FLAG」リリックビデオ【&LYRICTED #9】" | https://www.youtube.com/watch?v=fxVyjfVDQfY | time=198.765
[03/08/22 18:48:20] "水瀬いのり「MELODY FLAG」リリックビデオ【&LYRICTED #9】" | https://www.youtube.com/watch?v=fxVyjfVDQfY | time=284.01706666667
[04/08/22 12:02:10] "水瀬いのり「MELODY FLAG」リリックビデオ【&LYRICTED #9】" | https://www.youtube.com/watch?v=fxVyjfVDQfY | time=289.03139583336
[04/08/22 12:02:22] "水瀬いのりshortメドレー【103曲】完全版 まとめ" | https://www.youtube.com/watch?v=rmubeKmBniI | time=0
[05/08/22 17:27:38] E:\danser-0.6.8-win\videos\danser_2022-08-05_17-23-11.mp4 | time=163.25
[05/08/22 17:28:41] E:\danser-0.6.8-win\videos\danser_2022-08-05_17-28-03.mp4 | time=10.816666666667
[05/08/22 17:31:10] E:\danser-0.6.8-win\videos\danser_2022-08-05_17-30-02.mp4 | time=13.533333333333
[05/08/22 17:33:33] E:\danser-0.6.8-win\videos\danser_2022-08-05_17-33-05.mp4 | time=14.883333333333
[05/08/22 17:35:36] E:\danser-0.6.8-win\videos\danser_2022-08-05_17-34-52.mp4 | time=17.083333333333
[05/08/22 17:41:09] E:\danser-0.6.8-win\videos\danser_2022-08-05_17-40-45.mp4 | time=9.3333333333333
[05/08/22 17:41:49] E:\danser-0.6.8-win\videos\danser_2022-08-05_17-41-26.mp4 | time=11.383333333333
[05/08/22 17:44:16] E:\danser-0.6.8-win\videos\danser_2022-08-05_17-43-39.mp4 | time=20.133333333333
[05/08/22 17:54:33] E:\danser-0.6.8-win\videos\danser_2022-08-05_17-23-11.mp4 | time=78.7
[05/08/22 18:03:23] E:\danser-0.6.8-win\videos\danser_2022-08-05_17-54-48.mp4 | time=133.75
[05/08/22 18:16:52] E:\danser-0.6.8-win\videos\danser_2022-08-05_18-11-57.mp4 | time=236.28333333333
[15/08/22 19:16:07] D:\Tsukinami (2015, Limited Edition, EAC+CUE+LOG) - Kanon Wakeshima-20201212T152723Z-001\Tsukinami (2015, Limited Edition, EAC+CUE+LOG) - Kanon Wakeshima\05 - signal.flac | time=6.0512942823129
[15/08/22 19:21:56] C:\Users\SakuraFrost225\AppData\Roaming\nicotine\downloads\N.W.A_Straight Outta Compton_1-01_Straight Outta Compton.flac | time=258.73310657595
[15/08/22 20:28:03] C:\Users\SakuraFrost225\AppData\Roaming\nicotine\downloads\(01) [葉月ゆら] happy☆day.flac | time=231.23977324262
[17/08/22 14:44:30] E:\Windows.old.000\Users\SakuraFrost225\Documents\Untitled.mp4 | time=157.312
[17/08/22 14:44:47] F:\Video\881764 Will Stetson Snow Halation feat BeasttrollMC .mp4 | time=21.15
[17/08/22 14:45:11] F:\Video\532522 SakiZ osu memories played by ErogeMaster225.mp4 | time=47.616666666667
[17/08/22 14:45:17] F:\android backup\Telegram\Telegram Video\2_5361929698806860643.mp4 | time=210.34466145833
[17/08/22 14:45:25] F:\android backup\apower\Active 3(2022-04-07-20-55-29)\videos\1\EDITED_20210429_185339.mp4 | time=1.7483777777778
[22/08/22 16:41:18] "Official髭男dism - 115万キロのフィルム (Cover Harutya/春茶) lyrics Romanji" | https://www.youtube.com/watch?v=7c4F-YJtQ5Q | time=40.166
[22/08/22 16:46:49] "115万キロのフィルム / Official髭男dism  full covered by 春茶" | https://www.youtube.com/watch?v=sNcrMPhDoPQ | time=320.85433333333
[22/08/22 16:52:19] "Official髭男dism - 115万キロのフィルム［Official Audio］" | https://www.youtube.com/watch?v=ReCnlwVZj1M | time=323.629125
[22/08/22 17:14:21] "【一時間耐久　広告なし】115万キロのフィルム/Official髭男dism【作業用,睡眠用,勉強用BGM】" | https://www.youtube.com/watch?v=jt4CesevCM8 | time=1305.15
[23/08/22 16:58:23] C:\Users\SakuraFrost225\AppData\Roaming\nicotine\downloads\03. MELODY FLAG.flac | time=281.63194238434
[29/08/22 16:04:49] C:\Users\SakuraFrost225\Downloads\Compressed\ShinkanzenNgheHieuN4\ShinkanzenN4Choukai-Disc1\01 Track 1.mp3 | time=31.0324375
[30/08/22 08:03:50] D:\Music\Diversity\Rameses B - Neon Rainbow (ft. Anna Yvette).mp3 | time=252.3045237386
[30/08/22 08:04:14] D:\Tsukinami (2015, Limited Edition, EAC+CUE+LOG) - Kanon Wakeshima-20201212T152723Z-001\Tsukinami (2015, Limited Edition, EAC+CUE+LOG) - Kanon Wakeshima\05 - signal.flac | time=102.57039748866
[30/08/22 08:13:20] D:\Tsukinami (2015, Limited Edition, EAC+CUE+LOG) - Kanon Wakeshima-20201212T152723Z-001\Tsukinami (2015, Limited Edition, EAC+CUE+LOG) - Kanon Wakeshima\02 - Tsukinami.flac | time=139.090729
[17/09/22 20:08:28] F:\danser-0.6.8-win\videos\danser_2022-09-17_20-02-48.mp4 | time=59.65
[17/09/22 20:08:55] F:\danser-0.6.8-win\videos\danser_2022-09-17_20-02-48.mp4 | time=55.883333333333
[17/09/22 20:10:03] F:\danser-0.6.8-win\videos\danser_2022-09-17_20-09-16.mp4 | time=48.516666666667
[17/09/22 20:10:16] F:\danser-0.6.8-win\videos\danser_2022-09-17_20-02-48.mp4 | time=48.966666666667
[17/09/22 20:11:59] F:\danser-0.6.8-win\videos\danser_2022-09-17_20-10-31.mp4 | time=50.733333333333
[18/09/22 00:40:30] E:\Users\SakuraFrost225\Downloads\Compressed\Untitled folder-20220504T132347Z-001\Untitled folder\超可愛い１８歳巨乳彼女が極上手コキ 完整版\│¼┐╔É█ññú▒ú╕Ür╛▐╚Θ▒╦┼«ñ¼ÿO╔╧╩╓Ñ│Ñ¡ ═Ω╒√░µ\╙░╞¼\│¼┐╔É█ññú▒ú╕Ür╛▐╚Θ▒╦┼«ñ¼ÿO╔╧╩╓Ñ│Ñ¡ ═Ω╒√░µ.mp4 | time=1143.6755
[18/09/22 23:03:17] F:\osu!\Songs\361740 Agnete Kjolsrud - Get Jinxed\CrazyJinx.avi | time=81.166666666667
[18/09/22 23:03:23] F:\osu!\Songs\1502927 Masami Okui - Rondo-revolution (TV Size)\a.mp4 | time=65.566655555556
[18/09/22 23:03:28] F:\osu!\Songs\1769792 NANA - Mirai no Kaze ga Fuku\IloveNanaWindEroge.mp4 | time=93.64
[19/09/22 22:13:24] F:\danser-0.6.8-win\videos\danser_2022-09-19_22-10-44.mp4 | time=77.766666666667
[21/09/22 18:10:49] F:\osu!\Songs\1635918 zts - discolor\audio.mp3 | time=344.27999985829
[23/09/22 13:17:22] F:\Wallpaper.Engine.v1.7.12\Game\projects\defaultprojects\2B.mp4 | time=126.29283333333
[23/09/22 13:17:30] F:\Wallpaper.Engine.v1.7.12\Game\projects\defaultprojects\BoLoli VN Wang Yu CHun.005\MrCong.com BoLoli VN.005 Wang Yu Chun.mp4 | time=161.39456666667
[23/09/22 21:25:27] F:\danser-0.6.8-win\videos\danser_2022-09-23_21-24-05.mp4 | time=52.033333333333
[23/09/22 21:27:03] F:\danser-0.6.8-win\videos\danser_2022-09-23_21-24-05.mp4 | time=31.6
[23/09/22 21:27:46] F:\danser-0.6.8-win\videos\danser_2022-09-23_21-27-09.mp4 | time=16.066666666667
[23/09/22 21:28:54] F:\danser-0.6.8-win\videos\danser_2022-09-23_21-28-22.mp4 | time=20.245333333333
[23/09/22 21:30:14] F:\danser-0.6.8-win\videos\danser_2022-09-23_21-29-47.mp4 | time=6.2166666666667
[23/09/22 21:30:23] F:\danser-0.6.8-win\videos\danser_2022-09-23_21-29-47.mp4 | time=19.533333333333
[23/09/22 21:31:23] F:\danser-0.6.8-win\videos\danser_2022-09-23_21-30-43.mp4 | time=20.033333333333
[25/09/22 13:43:56] F:\Video\591442 S3RL feat Harri Rush Nostalgic Nightcore Mix played by ErogeMaster225.mp4 | time=121.28333333333
[26/09/22 00:30:37] "corsace (live) 2022-09-26 00:26" | https://www.twitch.tv/corsace | time=6883.587
[27/09/22 20:27:13] "playlist.m3u8" | http://storage.googleapiscdn.com/playlist/6320589c37f99d4074d8dc03/playlist.m3u8 | time=1536.032865
[28/09/22 10:23:44] F:\osu!\Skins2\very cool and good skin\pause-loop_1.mp3 | time=18.919999858276
[28/09/22 10:30:02] F:\osu!\Skins2\very cool and good skin\pause-loop.mp3 | time=15.6
[28/09/22 10:34:06] F:\osu!\Skins\Ene V3 Macbook(No HitCircle Effects)_2\failsound.wav | time=2.46979
[28/09/22 10:34:21] F:\osu!\Skins\-              ## FukutoTojido.OriginalZ.V3.Remake\failsound.mp3 | time=11.880757721088
[28/09/22 10:34:24] F:\osu!\Skins\-              ## FukutoTojido.OriginalZ.V3\failsound.mp3 | time=15.961756789116
[28/09/22 10:34:27] F:\osu!\Skins\K-On!! - Tainaka Ritsu\FailSound.mp3 | time=21.409302829932
[28/09/22 10:34:30] F:\osu!\Skins\Seamie\(mixed) HighBell owo\failsound.mp3 | time=26.370672918367
[28/09/22 10:34:33] F:\osu!\Skins\-+Selyu+v2.2_2\FailSound.mp3 | time=21.379051598639
[28/09/22 10:34:37] F:\osu!\Skins\aetrnaaberratefujiwara_v22\failsound.mp3 | time=41.841473272109
[28/09/22 10:34:39] F:\osu!\Skins\aetrnaaberrateFujiwara v3\failsound.mp3 | time=31.226555465986
[28/09/22 10:34:52] F:\osu!\Skins\Ene V3 Macbook(No HitCircle Effects)_2\applause.wav | time=1.069869
[28/09/22 10:35:16] F:\osu!\Skins\Cookiezi 35 2018-10-27\failsound.mp3 | time=1.0599817165533
[28/09/22 10:35:35] F:\osu!\Skins\Cookiezi 35 2018-10-27\applause.mp3 | time=0.48628371655329
[28/09/22 10:35:50] F:\osu!\Skins\vaxei nomod ver. 3\applause.wav | time=9.3614996133787
[28/09/22 10:36:46] F:\osu!\Skins\-        # re;owoTuna MonkaBacon 2\applause.wav | time=4.277167
[28/09/22 10:36:56] F:\osu!\Skins\-        # re;owoTuna MonkaBacon 2\applause.mp3 | time=7.7670217165533
[28/09/22 10:37:43] F:\osu!\Skins\-        # re;owoTuna MonkaBacon 2\applause.mp3 | time=9.2396007165533
[28/09/22 10:37:48] F:\osu!\Skins\-        # re;owoTuna MonkaBacon 2\applause.wav | time=3.437541
[28/09/22 10:38:53] F:\osu!\Skins\-        # re;owoTuna MonkaBacon 2\applause_1.mp3 | time=40.535693819728
[28/09/22 10:39:49] F:\osu!\Skins\vaxei nomod ver. 3\applause.mp3 | time=1.8406147165533
[28/09/22 10:40:04] F:\osu!\Skins\- Illustrious -\failsound2.wav | time=1.596475
[28/09/22 10:40:07] F:\osu!\Skins\riu xin\FailSound.wav | time=1.529752
[28/09/22 10:40:27] F:\osu!\Skins\Megumin Edit 2022\applause.mp3 | time=17.100406100907
[28/09/22 10:40:45] F:\osu!\Skinsbig\Sky Arrow v1.32\failsound.mp3 | time=1.010021
[28/09/22 10:41:18] F:\osu!\Skinsbig\Sky Arrow v1.32\failsound_1.mp3 | time=122.91984068367
[28/09/22 10:41:22] F:\osu!\Skinsbig\Sky Arrow v1.32\failsound.mp3 | time=124.12425061224
[28/09/22 14:32:29] F:\AutoWall\2021-10-15_19-14-17.mp4 | time=9.0833333333333
[28/09/22 15:24:11] F:\osu!\Skinsbig\Sky Arrow v1.32\failsound.mp3 | time=180.0992458095
[28/09/22 15:25:08] D:\Music\MrSuicideSheep\5 Million Subscriber Gaming Mix (by TheFatRat).mp3 | time=34.012035888322
[28/09/22 15:27:00] F:\osu!\Songs\1636902 Aries - BELIEVE IN ME, WHO BELIEVES IN YOU\audio.mp3 | time=1884.1197901735
[28/09/22 15:27:17] F:\osu!\Songs\1249679 Various Artists - Hololive Songs Compilation\hololive songs compilation.mp3 | time=1.4769117165533
[28/09/22 15:27:20] F:\osu!\Songs\389467 toby fox - Undertale Boss Themes\Undertale Boss Themes.mp3 | time=1.1869547165533
[28/09/22 15:27:24] F:\osu!\Songs\1016805 Various Artists - A Tribute to Kyoto Animation\audio.mp3 | time=3.437184
[28/09/22 15:27:28] F:\osu!\Songs\635855 PINK GUY - PINK SEASON THE PROPHECY\audio.mp3 | time=2.7790177165533
[28/09/22 15:27:36] F:\osu!\Skins\[L] I'm Rafis - NM_Dark\failsound.wav | time=1.857581
[28/09/22 15:27:40] F:\osu!\Skins\- Illustrious -\failsound2.wav | time=2.126983
[28/09/22 15:31:27] F:\osu!\Skins\Yuyuko Saigyouji\readys.wav | time=60
[28/09/22 15:31:33] F:\osu!\Skins\Yuyuko Saigyouji\readys.mp3 | time=52.489672482993
[28/09/22 15:31:53] F:\osu!\Skins\- # Mastasz but refreshed chuj -\applause.mp3 | time=1.0402637165533
[28/09/22 15:31:58] F:\osu!\Skins\- # Mastasz but refreshed chuj -\applause.mp3 | time=8.5939012244898
[28/09/22 15:32:04] F:\osu!\Skins\- # Mastasz but refreshed chuj -\applause.wav | time=8.820111085034
[28/09/22 15:33:19] F:\osu!\Skins2\voez+inspire+question+mark\applause54.wav | time=1.979735
[28/09/22 15:33:21] F:\osu!\Skins2\_RyuK 2018-10-15\applause54.wav | time=0.438396
[28/09/22 15:33:25] F:\osu!\Skins2\- - ! contrarily sunset aesthetic\applause54.wav | time=0
[30/09/22 01:03:33] F:\osu!\Songs\1636902 Aries - BELIEVE IN ME, WHO BELIEVES IN YOU\audio.mp3 | time=573.12356531292
[30/09/22 01:03:59] F:\osu!\Songs\1636902 Aries - BELIEVE IN ME, WHO BELIEVES IN YOU\audio_2.mp3 | time=975.43543045918
[30/09/22 01:04:08] F:\osu!\Songs\1636902 Aries - BELIEVE IN ME, WHO BELIEVES IN YOU\audio.mp3 | time=973.78618345918
[30/09/22 01:04:39] F:\osu!\Songs\1249679 Various Artists - Hololive Songs Compilation\hololive songs compilation.mp3 | time=4.7962947165533
[30/09/22 01:04:56] F:\osu!\Songs\972 Yoko Ishida - paraparaMAX I\paraparaMAX I.mp3 | time=46.040581085034
[30/09/22 01:05:07] F:\osu!\Songs\1249679 Various Artists - Hololive Songs Compilation\hololive songs compilation.mp3 | time=1548.1765173299
[30/09/22 01:05:16] F:\osu!\Songs\635855 PINK GUY - PINK SEASON THE PROPHECY\audio.mp3 | time=309.53691597959
[30/09/22 01:06:07] F:\osu!\Songs\635855 PINK GUY - PINK SEASON THE PROPHECY\audio_1.mp3 | time=286.97791667007
[30/09/22 01:06:19] F:\osu!\Songs\635855 PINK GUY - PINK SEASON THE PROPHECY\audio.mp3 | time=289.81427051701
[30/09/22 01:06:32] F:\osu!\Songs\635855 PINK GUY - PINK SEASON THE PROPHECY\audio_1.mp3 | time=292.58100953742
[30/09/22 01:07:32] F:\osu!\Skinsbig\azr8 x Seoul\applause2.wav | time=3.579907
[30/09/22 01:07:41] F:\osu!\Skinsbig\azr8 x Seoul\applause.mp3 | time=3.837412
[30/09/22 01:50:49] F:\android backup\Download\video0.mp4 | time=37.470766666667
[04/10/22 00:57:57] F:\danser-0.6.8-win\videos\danser_2022-10-04_00-54-58.mp4 | time=154.08333333333
[04/10/22 01:01:27] F:\danser-0.6.8-win\videos\danser_2022-10-04_00-58-26.mp4 | time=157.65333333333
[04/10/22 21:04:52] F:\danser-0.6.8-win\videos\danser_2022-10-04_21-02-16.mp4 | time=84.366666666667
[04/10/22 21:12:07] F:\danser-0.6.8-win\videos\danser_2022-10-04_21-04-31.mp4 | time=32.066666666667
[04/10/22 21:13:21] F:\danser-0.6.8-win\videos\danser_2022-10-04_21-04-31.mp4 | time=80.55
[06/10/22 20:07:51] F:\danser-0.6.8-win\videos\danser_2022-10-06_20-05-29.mp4 | time=71.583333333333
[08/10/22 11:11:02] "T1 vs. EDG | WORLDS 22 | GROUPS - DAY 1 2022-10-08 08:38" | https://www.youtube.com/watch?v=uFIF7VZ_1iM | time=243.73821111111
[08/10/22 11:14:48] "Riot Games (live) 2022-10-08 11:13" | https://www.twitch.tv/riotgames | time=1466.765
[09/10/22 10:03:58] F:\android backup\CSNMusic\Download\Music\Time To Say Goodbye__Mr FijiWiji; Direct & Aruna__320.mp3 | time=0
[09/10/22 12:22:42] F:\danser-0.6.8-win\videos\danser_2022-10-09_12-19-37.mp4 | time=151.85
[11/10/22 20:20:02] E:\Windows.old.000\Users\SakuraFrost225\Documents\Untitled.mp4 | time=21.30445
[11/10/22 20:20:51] F:\AutoWall\2021-11-25_22-42-29.mp4 | time=380.3
[11/10/22 20:22:37] F:\AutoWall\2021-11-25_22-42-29.mp4 | time=1513.8833333333
[11/10/22 21:38:00] F:\AutoWall\2021-11-25_22-42-29.mp4 | time=494.53333333333
[11/10/22 22:42:09] F:\Video\754451 THE ORAL CIGARETTES ReI played by ErogeMaster225.mp4 | time=4.0416666666667
[11/10/22 22:42:24] F:\Video\754451 THE ORAL CIGARETTES ReI played by ErogeMaster225.mp4 | time=2.7333333333333
[11/10/22 22:43:29] F:\Video\754451 THE ORAL CIGARETTES ReI played by ErogeMaster225.mp4 | time=16.416666666667
[11/10/22 23:06:14] D:\Video\Seitokai Yakuindomo\4. Seitokai Yakuindomo Bleep OVA\Seitokai Yakuindomo Bleep - 20-21 (Movie).mkv | time=121.452
[11/10/22 23:13:40] D:\Video\Seitokai Yakuindomo\4. Seitokai Yakuindomo Bleep OVA\Seitokai Yakuindomo Bleep - 20-21 (Movie).mkv | time=476.765
[11/10/22 23:14:00] E:\Windows.old\Users\BOSS\Videos\Phong su TK DSVN 2019.mp4 | time=3.48
[11/10/22 23:15:14] D:\Video\Seitokai Yakuindomo\4. Seitokai Yakuindomo Bleep OVA\Seitokai Yakuindomo Bleep - 20-21 (Movie).mkv | time=118.365
[11/10/22 23:52:33] E:\Windows.old.000\Users\SakuraFrost225\Documents\Untitled.mp4 | time=19.402566666667
[14/10/22 13:56:30] "Cozy Keyboard ASMR | different keyboard, switch, keycap combinations (no mid-roll ads)" | https://www.youtube.com/watch?v=M_OueQ37YMc | time=11.916
[14/10/22 16:09:25] - | time=20.7
[14/10/22 16:09:42] - | time=3.1333333333333
[14/10/22 16:12:55] "Cozy Keyboard ASMR ☁ | 9 different Keyboards (no mid-roll ads)" | https://www.youtube.com/watch?v=U7Y50T7NKyw | time=6
[14/10/22 17:25:04] "webm&ns=qkNVm38yLyQT8N7zjKHIrTEI&gir=yes&clen=337494443&dur=3274.483&lmt=1660503269425442&mt=1665742423&fvip=6&keepalive=yes&fexp=24001373,24007246&c=WEB&txp=5537434&n=DU1PF0EM6jnviLcztx&sparams=expire,ei,ip,id,aitags,source,requiressl,spc,vprv,mime,ns,gir,clen,dur,lmt&sig=AOq0QJ8wRQIgfu2CHnM1vlEdurQs79NWsQuBG5OOkW8eiCQBK3Zh8pgCIQD3nii6LaID0D7aIqY8GJCA03xxU02KsYNnn9kw-foqUw==&lsparams=mh,mm,mn,ms,mv,mvi,pl,initcwndbps&lsig=AG3C_xAwRQIhAJQ_Gkuu8FiKf6mgQML5dH02B3c6W23PeaF06Z_ss6K-AiBEisKmYFTWO5Cj096TmqLQcNE1D9CmTov4qf9mVtYQWw==" | https://rr3---sn-8pxuuxa-q5qz.googlevideo.com/videoplayback?expire=1665764431&ei=7zdJY--dEYP24ALM3KGICQ&ip=171.225.184.71&id=o-AGtwrltMEOSCEZsDZWs72uId9Qtcm_gGMpsSzs8wR30A&itag=303&aitags=133%2C134%2C135%2C136%2C160%2C242%2C243%2C244%2C247%2C278%2C298%2C299%2C302%2C303%2C308%2C394%2C395%2C396%2C397%2C398%2C399%2C400&source=youtube&requiressl=yes&mh=bf&mm=31%2C29&mn=sn-8pxuuxa-q5qz%2Csn-8pxuuxa-nbo6k&ms=au%2Crdu&mv=m&mvi=3&pl=24&initcwndbps=1800000&spc=yR2vpziAaHr2IIBvUSdLt_JrLYmJPLA&vprv=1&mime=video%2Fwebm&ns=qkNVm38yLyQT8N7zjKHIrTEI&gir=yes&clen=337494443&dur=3274.483&lmt=1660503269425442&mt=1665742423&fvip=6&keepalive=yes&fexp=24001373%2C24007246&c=WEB&txp=5537434&n=DU1PF0EM6jnviLcztx&sparams=expire%2Cei%2Cip%2Cid%2Caitags%2Csource%2Crequiressl%2Cspc%2Cvprv%2Cmime%2Cns%2Cgir%2Cclen%2Cdur%2Clmt&sig=AOq0QJ8wRQIgfu2CHnM1vlEdurQs79NWsQuBG5OOkW8eiCQBK3Zh8pgCIQD3nii6LaID0D7aIqY8GJCA03xxU02KsYNnn9kw-foqUw%3D%3D&lsparams=mh%2Cmm%2Cmn%2Cms%2Cmv%2Cmvi%2Cpl%2Cinitcwndbps&lsig=AG3C_xAwRQIhAJQ_Gkuu8FiKf6mgQML5dH02B3c6W23PeaF06Z_ss6K-AiBEisKmYFTWO5Cj096TmqLQcNE1D9CmTov4qf9mVtYQWw%3D%3D | time=12.416
[14/10/22 17:29:27] "webm&ns=qkNVm38yLyQT8N7zjKHIrTEI&gir=yes&clen=337494443&dur=3274.483&lmt=1660503269425442&mt=1665742423&fvip=6&keepalive=yes&fexp=24001373,24007246&c=WEB&txp=5537434&n=DU1PF0EM6jnviLcztx&sparams=expire,ei,ip,id,aitags,source,requiressl,spc,vprv,mime,ns,gir,clen,dur,lmt&sig=AOq0QJ8wRQIgfu2CHnM1vlEdurQs79NWsQuBG5OOkW8eiCQBK3Zh8pgCIQD3nii6LaID0D7aIqY8GJCA03xxU02KsYNnn9kw-foqUw==&lsparams=mh,mm,mn,ms,mv,mvi,pl,initcwndbps&lsig=AG3C_xAwRQIhAJQ_Gkuu8FiKf6mgQML5dH02B3c6W23PeaF06Z_ss6K-AiBEisKmYFTWO5Cj096TmqLQcNE1D9CmTov4qf9mVtYQWw==" | https://rr3---sn-8pxuuxa-q5qz.googlevideo.com/videoplayback?expire=1665764431&ei=7zdJY--dEYP24ALM3KGICQ&ip=171.225.184.71&id=o-AGtwrltMEOSCEZsDZWs72uId9Qtcm_gGMpsSzs8wR30A&itag=303&aitags=133%2C134%2C135%2C136%2C160%2C242%2C243%2C244%2C247%2C278%2C298%2C299%2C302%2C303%2C308%2C394%2C395%2C396%2C397%2C398%2C399%2C400&source=youtube&requiressl=yes&mh=bf&mm=31%2C29&mn=sn-8pxuuxa-q5qz%2Csn-8pxuuxa-nbo6k&ms=au%2Crdu&mv=m&mvi=3&pl=24&initcwndbps=1800000&spc=yR2vpziAaHr2IIBvUSdLt_JrLYmJPLA&vprv=1&mime=video%2Fwebm&ns=qkNVm38yLyQT8N7zjKHIrTEI&gir=yes&clen=337494443&dur=3274.483&lmt=1660503269425442&mt=1665742423&fvip=6&keepalive=yes&fexp=24001373%2C24007246&c=WEB&txp=5537434&n=DU1PF0EM6jnviLcztx&sparams=expire%2Cei%2Cip%2Cid%2Caitags%2Csource%2Crequiressl%2Cspc%2Cvprv%2Cmime%2Cns%2Cgir%2Cclen%2Cdur%2Clmt&sig=AOq0QJ8wRQIgfu2CHnM1vlEdurQs79NWsQuBG5OOkW8eiCQBK3Zh8pgCIQD3nii6LaID0D7aIqY8GJCA03xxU02KsYNnn9kw-foqUw%3D%3D&lsparams=mh%2Cmm%2Cmn%2Cms%2Cmv%2Cmvi%2Cpl%2Cinitcwndbps&lsig=AG3C_xAwRQIhAJQ_Gkuu8FiKf6mgQML5dH02B3c6W23PeaF06Z_ss6K-AiBEisKmYFTWO5Cj096TmqLQcNE1D9CmTov4qf9mVtYQWw%3D%3D | time=242.167
[14/10/22 17:31:27] "webm&ns=nzASpgRePeZAolbvuhMTX4MI&gir=yes&clen=337494443&dur=3274.483&lmt=1660503269425442&mt=1665743140&fvip=6&keepalive=yes&fexp=24001373,24007246&c=WEB&txp=5537434&n=Aq4EMbEUKnNkcw3-WU&sparams=expire,ei,ip,id,aitags,source,requiressl,spc,vprv,mime,ns,gir,clen,dur,lmt&sig=AOq0QJ8wRQIgM9-MdTxVzjoH1Fv4Jf5bOq4YIY1a9-GWWJwTWX72UqECIQDHqRU-Uiz-9OapLAYQecH7Kz_uW275rE7UDJqUX1A6Ug==&lsparams=mh,mm,mn,ms,mv,mvi,pl,initcwndbps&lsig=AG3C_xAwRgIhAJwq4X63WM_aRX8xMcvNmB10Qzqr5P6kiuB-sGwvSv4MAiEA8aaJIz8crMeMvo0jRHnn7zlgTQfYZPZHOy3uxSjJ_tk=" | https://rr3---sn-8pxuuxa-q5qz.googlevideo.com/videoplayback?expire=1665765034&ei=SjpJY8yMFIHA4AKS26CABA&ip=171.225.184.71&id=o-AIEhpOLPdXTAoEU9j-gIAA4YNbBCibP8xzX_Mskhohwr&itag=303&aitags=133%2C134%2C135%2C136%2C160%2C242%2C243%2C244%2C247%2C278%2C298%2C299%2C302%2C303%2C308%2C394%2C395%2C396%2C397%2C398%2C399%2C400&source=youtube&requiressl=yes&mh=bf&mm=31%2C29&mn=sn-8pxuuxa-q5qz%2Csn-8pxuuxa-nbo6k&ms=au%2Crdu&mv=m&mvi=3&pl=24&initcwndbps=2032500&spc=yR2vp0tswl-uC5oNyRzZNFVclUW9X8s&vprv=1&mime=video%2Fwebm&ns=nzASpgRePeZAolbvuhMTX4MI&gir=yes&clen=337494443&dur=3274.483&lmt=1660503269425442&mt=1665743140&fvip=6&keepalive=yes&fexp=24001373%2C24007246&c=WEB&txp=5537434&n=Aq4EMbEUKnNkcw3-WU&sparams=expire%2Cei%2Cip%2Cid%2Caitags%2Csource%2Crequiressl%2Cspc%2Cvprv%2Cmime%2Cns%2Cgir%2Cclen%2Cdur%2Clmt&sig=AOq0QJ8wRQIgM9-MdTxVzjoH1Fv4Jf5bOq4YIY1a9-GWWJwTWX72UqECIQDHqRU-Uiz-9OapLAYQecH7Kz_uW275rE7UDJqUX1A6Ug%3D%3D&lsparams=mh%2Cmm%2Cmn%2Cms%2Cmv%2Cmvi%2Cpl%2Cinitcwndbps&lsig=AG3C_xAwRgIhAJwq4X63WM_aRX8xMcvNmB10Qzqr5P6kiuB-sGwvSv4MAiEA8aaJIz8crMeMvo0jRHnn7zlgTQfYZPZHOy3uxSjJ_tk%3D | time=19.25
[14/10/22 17:32:21] "webm&ns=zYvytSxjXGGsFg2H14feUkcI&gir=yes&clen=337494443&dur=3274.483&lmt=1660503269425442&mt=1665743140&fvip=6&keepalive=yes&fexp=24001373,24007246&c=WEB&txp=5537434&n=FOui_A93Wl0N0CLKwd&sparams=expire,ei,ip,id,aitags,source,requiressl,pcm2,spc,vprv,mime,ns,gir,clen,dur,lmt&sig=AOq0QJ8wRQIgJ5_qgH0EBtHE15gidF1f4LafYGoYeFX7C-VoOFnireICIQD85E9b9MidhczMXNY85ULEhd3h0VE__aSq1oChHT0Fcw==&lsparams=mh,mm,mn,ms,mv,mvi,pl,initcwndbps&lsig=AG3C_xAwRQIhAPMX6mlZ_bhK-LA-gNjTkCQc5gm89iBERr7iSOyOCg0iAiBRrDV4jDykZQf1qklEnVqTA0Wxddrgdclzv6ynpSfBcw==" | https://rr3---sn-8pxuuxa-q5qz.googlevideo.com/videoplayback?expire=1665765132&ei=rDpJY7qlJ4GKigb5mg8&ip=171.225.184.71&id=o-ABY_xrfiSCPXOyngrTTJdYw-97si5vpQAQ41UaR2HFhV&itag=303&aitags=133%2C134%2C135%2C136%2C160%2C242%2C243%2C244%2C247%2C278%2C298%2C299%2C302%2C303%2C308%2C394%2C395%2C396%2C397%2C398%2C399%2C400&source=youtube&requiressl=yes&mh=bf&mm=31%2C29&mn=sn-8pxuuxa-q5qz%2Csn-8pxuuxa-nbo6k&ms=au%2Crdu&mv=m&mvi=3&pl=24&pcm2=no&initcwndbps=2032500&spc=yR2vp58lCAmHBkofCG-d6AXj_PQBw-Y&vprv=1&mime=video%2Fwebm&ns=zYvytSxjXGGsFg2H14feUkcI&gir=yes&clen=337494443&dur=3274.483&lmt=1660503269425442&mt=1665743140&fvip=6&keepalive=yes&fexp=24001373%2C24007246&c=WEB&txp=5537434&n=FOui_A93Wl0N0CLKwd&sparams=expire%2Cei%2Cip%2Cid%2Caitags%2Csource%2Crequiressl%2Cpcm2%2Cspc%2Cvprv%2Cmime%2Cns%2Cgir%2Cclen%2Cdur%2Clmt&sig=AOq0QJ8wRQIgJ5_qgH0EBtHE15gidF1f4LafYGoYeFX7C-VoOFnireICIQD85E9b9MidhczMXNY85ULEhd3h0VE__aSq1oChHT0Fcw%3D%3D&lsparams=mh%2Cmm%2Cmn%2Cms%2Cmv%2Cmvi%2Cpl%2Cinitcwndbps&lsig=AG3C_xAwRQIhAPMX6mlZ_bhK-LA-gNjTkCQc5gm89iBERr7iSOyOCg0iAiBRrDV4jDykZQf1qklEnVqTA0Wxddrgdclzv6ynpSfBcw%3D%3D | time=2.117
[14/10/22 17:35:10] "Cozy Keyboard ASMR ☁ | 9 different Keyboards (no mid-roll ads)" | https://www.youtube.com/watch?v=U7Y50T7NKyw | time=1.517
[14/10/22 17:36:16] "Cozy Keyboard ASMR ☁ | 9 different Keyboards (no mid-roll ads)" | https://www.youtube.com/watch?v=U7Y50T7NKyw | time=4
[14/10/22 17:43:42] "webm&ns=Mq__olOXPVM9eXkd2uJeAHUI&gir=yes&clen=337494443&dur=3274.483&lmt=1660503269425442&mt=1665743851&fvip=6&keepalive=yes&fexp=24001373,24007246&c=WEB&txp=5537434&n=m5KP4snnKM_6-wWNYz&sparams=expire,ei,ip,id,aitags,source,requiressl,spc,vprv,mime,ns,gir,clen,dur,lmt&sig=AOq0QJ8wRgIhAPWqIkQCAUbrxFbr20JjmNBownZ_q1kQIhyKamnozzSsAiEA9N51UkbH35Dl0rIeyuRj_djgf8QjTSoSOPxKpkcJYko=&lsparams=mh,mm,mn,ms,mv,mvi,pl,initcwndbps&lsig=AG3C_xAwRgIhANisPu87nCU0KzRsfCF_Tc_VDe44qBn2JboBeiT6wF77AiEAvKdbQOc0kU4YoCgnTZEXfNSNlVM1WYVVpEnHB1_MStY=" | https://rr3---sn-8pxuuxa-q5qz.googlevideo.com/videoplayback?expire=1665765802&ei=Sj1JY9XzHvSmvcAPyYK1wAc&ip=171.225.184.71&id=o-AGrrJww_5f2PZ4agQulBzjZ98Ws4NCri3PU-eisJiyCt&itag=303&aitags=133%2C134%2C135%2C136%2C160%2C242%2C243%2C244%2C247%2C278%2C298%2C299%2C302%2C303%2C308%2C394%2C395%2C396%2C397%2C398%2C399%2C400&source=youtube&requiressl=yes&mh=bf&mm=31%2C29&mn=sn-8pxuuxa-q5qz%2Csn-8pxuuxa-nbo6k&ms=au%2Crdu&mv=m&mvi=3&pl=24&initcwndbps=1986250&spc=yR2vpwzcbblvrCo_0TBAS5XuKlDh8Zk&vprv=1&mime=video%2Fwebm&ns=Mq__olOXPVM9eXkd2uJeAHUI&gir=yes&clen=337494443&dur=3274.483&lmt=1660503269425442&mt=1665743851&fvip=6&keepalive=yes&fexp=24001373%2C24007246&c=WEB&txp=5537434&n=m5KP4snnKM_6-wWNYz&sparams=expire%2Cei%2Cip%2Cid%2Caitags%2Csource%2Crequiressl%2Cspc%2Cvprv%2Cmime%2Cns%2Cgir%2Cclen%2Cdur%2Clmt&sig=AOq0QJ8wRgIhAPWqIkQCAUbrxFbr20JjmNBownZ_q1kQIhyKamnozzSsAiEA9N51UkbH35Dl0rIeyuRj_djgf8QjTSoSOPxKpkcJYko%3D&lsparams=mh%2Cmm%2Cmn%2Cms%2Cmv%2Cmvi%2Cpl%2Cinitcwndbps&lsig=AG3C_xAwRgIhANisPu87nCU0KzRsfCF_Tc_VDe44qBn2JboBeiT6wF77AiEAvKdbQOc0kU4YoCgnTZEXfNSNlVM1WYVVpEnHB1_MStY%3D | time=5.383
[14/10/22 17:44:05] "webm&ns=7pYWdEPdcVrRqI55hPzw85UI&gir=yes&clen=337494443&dur=3274.483&lmt=1660503269425442&mt=1665743851&fvip=6&keepalive=yes&fexp=24001373,24007246&c=WEB&txp=5537434&n=HZN71MI8lop-ZTjqgG&sparams=expire,ei,ip,id,aitags,source,requiressl,spc,vprv,mime,ns,gir,clen,dur,lmt&sig=AOq0QJ8wRQIhAOgeY_qFVz5JtcQ-D3Yulz_fdgySuOGgtcagYpTPBoK_AiBDLG_5G0t3OdzIyvTrmNRthblBPNJZI0OiMxqqodUUSA==&lsparams=mh,mm,mn,ms,mv,mvi,pl,initcwndbps&lsig=AG3C_xAwRQIhANHkJpXsIBVMnxWkbOSx-4UmzI0Q5Twiz_sUmJeJqMVjAiAWuCtf1bX3HFsOfvSo5V4rkbXlxaaS5XlxXL6-Ko0DgA==" | https://rr3---sn-8pxuuxa-q5qz.googlevideo.com/videoplayback?expire=1665765832&ei=aD1JY6uQLtyUvcAP8PKn4A8&ip=171.225.184.71&id=o-AN1cLM26Sf9vgrYdURQLp6DPFjRgT18jEBcKn0zJ3pfe&itag=303&aitags=133%2C134%2C135%2C136%2C160%2C242%2C243%2C244%2C247%2C278%2C298%2C299%2C302%2C303%2C308%2C394%2C395%2C396%2C397%2C398%2C399%2C400&source=youtube&requiressl=yes&mh=bf&mm=31%2C29&mn=sn-8pxuuxa-q5qz%2Csn-8pxuuxa-nbo6k&ms=au%2Crdu&mv=m&mvi=3&pl=24&initcwndbps=1986250&spc=yR2vp8NsvurIstcxBM54KMgi2qk-nyc&vprv=1&mime=video%2Fwebm&ns=7pYWdEPdcVrRqI55hPzw85UI&gir=yes&clen=337494443&dur=3274.483&lmt=1660503269425442&mt=1665743851&fvip=6&keepalive=yes&fexp=24001373%2C24007246&c=WEB&txp=5537434&n=HZN71MI8lop-ZTjqgG&sparams=expire%2Cei%2Cip%2Cid%2Caitags%2Csource%2Crequiressl%2Cspc%2Cvprv%2Cmime%2Cns%2Cgir%2Cclen%2Cdur%2Clmt&sig=AOq0QJ8wRQIhAOgeY_qFVz5JtcQ-D3Yulz_fdgySuOGgtcagYpTPBoK_AiBDLG_5G0t3OdzIyvTrmNRthblBPNJZI0OiMxqqodUUSA%3D%3D&lsparams=mh%2Cmm%2Cmn%2Cms%2Cmv%2Cmvi%2Cpl%2Cinitcwndbps&lsig=AG3C_xAwRQIhANHkJpXsIBVMnxWkbOSx-4UmzI0Q5Twiz_sUmJeJqMVjAiAWuCtf1bX3HFsOfvSo5V4rkbXlxaaS5XlxXL6-Ko0DgA%3D%3D | time=2.117
[14/10/22 17:44:36] "webm&ns=fv21KDKutqm2wDhenpYlMoQI&gir=yes&clen=337494443&dur=3274.483&lmt=1660503269425442&mt=1665743851&fvip=6&keepalive=yes&fexp=24001373,24007246&c=WEB&txp=5537434&n=t83yF5o_WbqWEh3aH2&sparams=expire,ei,ip,id,aitags,source,requiressl,spc,vprv,mime,ns,gir,clen,dur,lmt&sig=AOq0QJ8wRQIhAKHnz2BOxrXtmDy6HZGMASh5ETlNtAPGNMsmhvHruaExAiBCmIiHLcGNMNVre91-MdWB1l_PgI2UeEWLD9pfWb6jQg==&lsparams=mh,mm,mn,ms,mv,mvi,pl,initcwndbps&lsig=AG3C_xAwRAIgCFJmrYOLgUzp4kzd2GoWXgygJui8vGWBN8F2tW3hOv8CICp0HfklJwdi09jiPp3bPNgGF9N0wht8ZvovMPT3bwAk" | https://rr3---sn-8pxuuxa-q5qz.googlevideo.com/videoplayback?expire=1665765858&ei=gj1JY5jCC4r04gKwzo6QBw&ip=171.225.184.71&id=o-ABn7FtSL3a_S_O8l_c6YrDBc1H3qv6PxUlfAFrSdGQKB&itag=303&aitags=133%2C134%2C135%2C136%2C160%2C242%2C243%2C244%2C247%2C278%2C298%2C299%2C302%2C303%2C308%2C394%2C395%2C396%2C397%2C398%2C399%2C400&source=youtube&requiressl=yes&mh=bf&mm=31%2C29&mn=sn-8pxuuxa-q5qz%2Csn-8pxuuxa-nbo6k&ms=au%2Crdu&mv=m&mvi=3&pl=24&initcwndbps=1986250&spc=yR2vp30jX8Hrc9TXHi04tSre6FqpLIU&vprv=1&mime=video%2Fwebm&ns=fv21KDKutqm2wDhenpYlMoQI&gir=yes&clen=337494443&dur=3274.483&lmt=1660503269425442&mt=1665743851&fvip=6&keepalive=yes&fexp=24001373%2C24007246&c=WEB&txp=5537434&n=t83yF5o_WbqWEh3aH2&sparams=expire%2Cei%2Cip%2Cid%2Caitags%2Csource%2Crequiressl%2Cspc%2Cvprv%2Cmime%2Cns%2Cgir%2Cclen%2Cdur%2Clmt&sig=AOq0QJ8wRQIhAKHnz2BOxrXtmDy6HZGMASh5ETlNtAPGNMsmhvHruaExAiBCmIiHLcGNMNVre91-MdWB1l_PgI2UeEWLD9pfWb6jQg%3D%3D&lsparams=mh%2Cmm%2Cmn%2Cms%2Cmv%2Cmvi%2Cpl%2Cinitcwndbps&lsig=AG3C_xAwRAIgCFJmrYOLgUzp4kzd2GoWXgygJui8vGWBN8F2tW3hOv8CICp0HfklJwdi09jiPp3bPNgGF9N0wht8ZvovMPT3bwAk | time=5.45
[14/10/22 17:45:00] "webm&ns=t_aCSRYFIEUGh7dV1HhM9PcI&gir=yes&clen=337494443&dur=3274.483&lmt=1660503269425442&mt=1665743851&fvip=6&keepalive=yes&fexp=24001373,24007246&c=WEB&txp=5537434&n=VNnJXsuksOtg37tsR1&sparams=expire,ei,ip,id,aitags,source,requiressl,spc,vprv,mime,ns,gir,clen,dur,lmt&sig=AOq0QJ8wRgIhAJ5co9nUSHv5hKGVr_LNZrjX_8QGlsdNpg7JzLYMZyPlAiEAjdQQmdk158saP5box4rJcDv9RYFOzxtu6pBSeF2C6_E=&lsparams=mh,mm,mn,ms,mv,mvi,pl,initcwndbps&lsig=AG3C_xAwRAIgCt7AsW13ynFr7capvj9wzYUkYCIe8WoA91SIVCdSadUCIAul3qL2Aa6jlryuu780U-3atHKY6DnjzSRusretrsfm" | https://rr3---sn-8pxuuxa-q5qz.googlevideo.com/videoplayback?expire=1665765891&ei=oz1JY5CjGsiOlQTkx7awAw&ip=171.225.184.71&id=o-AHnJKk61xjo13l-MJ8HPyS-EWueijAzyOd3xw_BNV3si&itag=303&aitags=133%2C134%2C135%2C136%2C160%2C242%2C243%2C244%2C247%2C278%2C298%2C299%2C302%2C303%2C308%2C394%2C395%2C396%2C397%2C398%2C399%2C400&source=youtube&requiressl=yes&mh=bf&mm=31%2C29&mn=sn-8pxuuxa-q5qz%2Csn-8pxuuxa-nbo6k&ms=au%2Crdu&mv=m&mvi=3&pl=24&initcwndbps=1986250&spc=yR2vp_PLZPWNN_YocgKhzJLMBGiyWbs&vprv=1&mime=video%2Fwebm&ns=t_aCSRYFIEUGh7dV1HhM9PcI&gir=yes&clen=337494443&dur=3274.483&lmt=1660503269425442&mt=1665743851&fvip=6&keepalive=yes&fexp=24001373%2C24007246&c=WEB&txp=5537434&n=VNnJXsuksOtg37tsR1&sparams=expire%2Cei%2Cip%2Cid%2Caitags%2Csource%2Crequiressl%2Cspc%2Cvprv%2Cmime%2Cns%2Cgir%2Cclen%2Cdur%2Clmt&sig=AOq0QJ8wRgIhAJ5co9nUSHv5hKGVr_LNZrjX_8QGlsdNpg7JzLYMZyPlAiEAjdQQmdk158saP5box4rJcDv9RYFOzxtu6pBSeF2C6_E%3D&lsparams=mh%2Cmm%2Cmn%2Cms%2Cmv%2Cmvi%2Cpl%2Cinitcwndbps&lsig=AG3C_xAwRAIgCt7AsW13ynFr7capvj9wzYUkYCIe8WoA91SIVCdSadUCIAul3qL2Aa6jlryuu780U-3atHKY6DnjzSRusretrsfm | time=2.317
[14/10/22 17:46:02] "webm&ns=BXtjUQ8wwRq2aoKx1S-dfXMI&gir=yes&clen=337494443&dur=3274.483&lmt=1660503269425442&mt=1665743851&fvip=6&keepalive=yes&fexp=24001373,24007246&c=WEB&txp=5537434&n=05rgGg1asy8FAjusTA&sparams=expire,ei,ip,id,aitags,source,requiressl,spc,vprv,mime,ns,gir,clen,dur,lmt&sig=AOq0QJ8wRQIgdHIpvTglWzd786GUb9ZzQXdyzTCjYeX_fub2CxVHWssCIQD63F0_4U62OGDSFPcNlbraw3txX2wBTz6310aOBlWHNA==&lsparams=mh,mm,mn,ms,mv,mvi,pcm2cms,pl,initcwndbps&lsig=AG3C_xAwRQIhAMnEUJCc_PNb7vjzO54K9PX7F00_CZ-h7xNlL-GyCRl0AiAuKEL7fub5TQK5gzG19FZw1il3u4muGt0dWYGmdARxUQ==" | https://rr3---sn-8pxuuxa-q5qz.googlevideo.com/videoplayback?expire=1665765934&ei=zj1JY8OeJI384gLq3KTABQ&ip=171.225.184.71&id=o-AM3yUbGPtx5ANeTh94DnE44xdARowa5RBaqfNRR95Ogs&itag=303&aitags=133%2C134%2C135%2C136%2C160%2C242%2C243%2C244%2C247%2C278%2C298%2C299%2C302%2C303%2C308%2C394%2C395%2C396%2C397%2C398%2C399%2C400&source=youtube&requiressl=yes&mh=bf&mm=31%2C29&mn=sn-8pxuuxa-q5qz%2Csn-8pxuuxa-nbo6k&ms=au%2Crdu&mv=m&mvi=3&pcm2cms=yes&pl=24&initcwndbps=1986250&spc=yR2vp7garq_DezsV0Oo7ZuTC2xDruM4&vprv=1&mime=video%2Fwebm&ns=BXtjUQ8wwRq2aoKx1S-dfXMI&gir=yes&clen=337494443&dur=3274.483&lmt=1660503269425442&mt=1665743851&fvip=6&keepalive=yes&fexp=24001373%2C24007246&c=WEB&txp=5537434&n=05rgGg1asy8FAjusTA&sparams=expire%2Cei%2Cip%2Cid%2Caitags%2Csource%2Crequiressl%2Cspc%2Cvprv%2Cmime%2Cns%2Cgir%2Cclen%2Cdur%2Clmt&sig=AOq0QJ8wRQIgdHIpvTglWzd786GUb9ZzQXdyzTCjYeX_fub2CxVHWssCIQD63F0_4U62OGDSFPcNlbraw3txX2wBTz6310aOBlWHNA%3D%3D&lsparams=mh%2Cmm%2Cmn%2Cms%2Cmv%2Cmvi%2Cpcm2cms%2Cpl%2Cinitcwndbps&lsig=AG3C_xAwRQIhAMnEUJCc_PNb7vjzO54K9PX7F00_CZ-h7xNlL-GyCRl0AiAuKEL7fub5TQK5gzG19FZw1il3u4muGt0dWYGmdARxUQ%3D%3D | time=277.85
[15/10/22 23:48:58] F:\danser-0.6.8-win\videos\danser_2022-10-15_23-47-24.mp4 | time=40.766666666667
[04/11/22 20:33:13] F:\osu!\Songs\613403 Inori Minase - MELODY FLAG\MELODY FLAG.mp3 | time=7.0861678008738e-07
[07/11/22 00:31:05] F:\Video\puru toki.mp4 | time=143.24368537415
[07/11/22 01:25:31] F:\Video\575330 Imperial Circus Dead Decadence Yomi yori Kikoyu Koukoku no Tou to Honoo no Shoujo played by ErogeMaster225.mp4 | time=16.4
[07/11/22 01:25:57] F:\Video\575330 Imperial Circus Dead Decadence Yomi yori Kikoyu Koukoku no Tou to Honoo no Shoujo played by ErogeMaster225.mp4 | time=3.7
[07/11/22 12:54:46] F:\Video\575330 Imperial Circus Dead Decadence Yomi yori Kikoyu Koukoku no Tou to Honoo no Shoujo played by ErogeMaster225.mp4 | time=454.92512981871
[08/11/22 22:13:00] "챈슬러 (Chancellor) ‘Angel (Feat. 태연 TAEYEON)’ MV" | https://www.youtube.com/watch?v=_kDLta6wvcY | time=262.304
[08/11/22 22:14:42] "챈슬러 (Chancellor) ‘Angel (Feat. 태연 TAEYEON)’ MV" | https://www.youtube.com/watch?v=_kDLta6wvcY | time=27.36
[08/11/22 22:22:42] "챈슬러 (Chancellor) ‘Angel (Feat. 태연 TAEYEON)’ MV" | https://www.youtube.com/watch?v=_kDLta6wvcY | time=279.90573858451
[08/11/22 22:23:00] "챈슬러 (Chancellor) ‘Angel (Feat. 태연 TAEYEON)’ LIVE VIDEO" | https://www.youtube.com/watch?v=S3FNxErHZj0 | time=12.345
[08/11/22 22:25:37] "seven oops - Orange (Short Ver.)" | https://www.youtube.com/watch?v=nf-L5R8U-Q0 | time=151.05824848029
[08/11/22 22:31:48] "7!! - Orange {MV} Your Lie In April Live Action" | https://www.youtube.com/watch?v=fRUJjOViokk | time=347.9634502482
[08/11/22 22:31:54] "7!! - Orange {MV} Your Lie In April Live Action" | https://www.youtube.com/watch?v=fRUJjOViokk | time=0
[08/11/22 22:37:38] "Galileo Galilei - Aoi Shiori" | https://www.youtube.com/watch?v=T3bxbVGWy5k | time=337.47964336395
[08/11/22 22:39:36] "KANA-BOON - Silhouette" | https://www.youtube.com/watch?v=dlFA0Zq1k2A | time=71.305
[08/11/22 22:44:12] "＜ノラガミARAGOTO＞OPテーマ  THE ORAL CIGARETTES「狂乱 Hey Kids!!」MusicVideo" | https://www.youtube.com/watch?v=C-o8pTi6vd8 | time=266.27562682192
[08/11/22 22:44:47] "Mrs. GREEN APPLE - インフェルノ（Inferno）" | https://www.youtube.com/watch?v=wfCcs0vLysk | time=18.018
[08/11/22 22:45:26] "| Yahari Ore no Seishun Love Comedy wa Machigatteiru. Zoku | OP FULL |  [LYRICS]  |" | https://www.youtube.com/watch?v=fub7WVBCReg | time=32.12
[08/11/22 22:50:28] "Just Because! OP／Opening Full 「over and over - Yanagi Nagi」Cover by Kami" | https://www.youtube.com/watch?v=TDCb_qu2mT8 | time=294.97551165705
[08/11/22 22:52:22] "BEATLESS OP/Opening Full「Error - GARNiDELiA」[Kami Cover]" | https://www.youtube.com/watch?v=E8_LAw4LACw | time=11.311
[08/11/22 22:54:06] "supercell - My Dearest (Music Video)" | https://www.youtube.com/watch?v=nIrYjzHAEp0 | time=22.79
